,tweet_id,tweet_url,username,is_retweet,is_pinned,time,ts,text,replies,retweets,likes
0,471403243637964800,/DougKass/status/471403243637964800#m,DougKass,0.0,0.0,2014-05-27 09:31:00+00:00,1401183060000.0,"Coming up tomorrow morning on RealMoneyPro: ""Prepare for a Minsky Moment"" $SPY",4.0,1.0,3.0
1,471231137164308481,/DougKass/status/471231137164308481#m,DougKass,0.0,0.0,2014-05-27 10:07:00+00:00,1401185220000.0,France's Hollande wants to reduce role in EU au.news.yahoo.com/world/a/23…,1.0,2.0,0.0
2,471230911745630208,/DougKass/status/471230911745630208#m,DougKass,0.0,0.0,2014-05-27 10:06:00+00:00,1401185160000.0,Stanley Fischer takes Fed seat cnbc.com/id/101698451,0.0,2.0,2.0
3,471230747869999104,/DougKass/status/471230747869999104#m,DougKass,0.0,0.0,2014-05-27 10:05:00+00:00,1401185100000.0,"Consumers getting ""gassed""",4.0,11.0,2.0
4,471230520169218048,/DougKass/status/471230520169218048#m,DougKass,0.0,0.0,2014-05-27 10:04:00+00:00,1401185040000.0,More big bank manipulations (zinc this time) news.yahoo.com/goldman-jpmor…,2.0,4.0,1.0
5,471230219936735232,/DougKass/status/471230219936735232#m,DougKass,0.0,0.0,2014-05-27 10:03:00+00:00,1401184980000.0,Lagarde urges central bank unity of policy cnbc.com/id/101704136,1.0,2.0,2.0
6,471230034913394688,/DougKass/status/471230034913394688#m,DougKass,0.0,0.0,2014-05-27 10:02:00+00:00,1401184920000.0,Pro European wins in Ukraine nytimes.com/2014/05/26/world…,0.0,2.0,0.0
7,471229818831257600,/DougKass/status/471229818831257600#m,DougKass,0.0,0.0,2014-05-27 10:01:00+00:00,1401184860000.0,More on European elections telegraph.co.uk/news/politic…,0.0,3.0,0.0
8,471229578803814401,/DougKass/status/471229578803814401#m,DougKass,0.0,0.0,2014-05-27 10:01:00+00:00,1401184860000.0,Anti EU and far right parties triumph in European elections news.yahoo.com/europe-votes-…,0.0,2.0,0.0
