,tweet_id,tweet_url,username,is_retweet,is_pinned,time,ts,text,replies,retweets,likes
0,960655729660133383,/DougKass/status/960655729660133383#m,DougKass,0.0,0.0,2018-02-05 11:25:00+00:00,1517829900000.0,"For five years I have written a continuous column on @TSTRealMoneyPro entitled, ""Kill the Quants Before they Kill Our Markets."" Looks like another one tomorrow! @jimcramer @tomkeene @carlquintanilla",2.0,2.0,37.0
1,960654704417165312,/DougKass/status/960654704417165312#m,DougKass,0.0,0.0,2018-02-05 11:21:00+00:00,1517829660000.0,Coming up tomorrow on @TSTRealMoneyPro @jimcramer The SEC is asleep. They should close down the VIX kennel of dogs who's tail wags the markets moves.,1.0,3.0,22.0
2,960654058553044992,/DougKass/status/960654058553044992#m,DougKass,0.0,0.0,2018-02-05 11:19:00+00:00,1517829540000.0,I am hearing that the JPM quant desk is already calling for “policymaker intervention” being a high probability. @realDonaldTrump has tied himself to the the S&P Index. We should rule out nothing.,14.0,15.0,44.0
3,960648686907936768,/DougKass/status/960648686907936768#m,DougKass,0.0,0.0,2018-02-05 10:57:00+00:00,1517828220000.0,I am hearing that the JPM quant desk is already calling for “policymaker intervention” being a high probability.,14.0,14.0,47.0
4,960648022244909056,/DougKass/status/960648022244909056#m,DougKass,0.0,0.0,2018-02-05 10:55:00+00:00,1517828100000.0,@jimcramer The bottom line on the dangerous structural market changes - the SEC is asleep at the wheel. The price action was structurally based. @TSTRealMoneyPro,4.0,4.0,6.0
5,960646366988029956,/DougKass/status/960646366988029956#m,DougKass,0.0,0.0,2018-02-05 10:48:00+00:00,1517827680000.0,@jimcramer On @TSTRealMoneyPro The Revenge of the Machines realmoneypro.thestreet.com/d…,0.0,2.0,4.0
6,960645465262960641,/DougKass/status/960645465262960641#m,DougKass,0.0,0.0,2018-02-05 10:45:00+00:00,1517827500000.0,"Fellow on bitcoin on @CNBCFastMoney ""We are now at an exciting time for bitcoin."" Oy.",9.0,1.0,20.0
7,960637435699974144,/DougKass/status/960637435699974144#m,DougKass,0.0,0.0,2018-02-05 10:13:00+00:00,1517825580000.0,Do bulls in the biz media just forget what they said about the markets a week ago? Is this real or Memorex?,8.0,8.0,46.0
8,960615765916479489,/DougKass/status/960615765916479489#m,DougKass,0.0,0.0,2018-02-05 08:47:00+00:00,1517820420000.0,$3.7 billion to sell market on close.,5.0,7.0,27.0
9,960604194641272834,/DougKass/status/960604194641272834#m,DougKass,0.0,0.0,2018-02-05 08:01:00+00:00,1517817660000.0,This raises the chances of a sharp snapback - but I am uncertain from what level. No one can be certain.,2.0,0.0,26.0
10,960604160755486722,/DougKass/status/960604160755486722#m,DougKass,0.0,0.0,2018-02-05 08:00:00+00:00,1517817600000.0,The ten year US note yield just broke 2.80% to the downside. The yield is down by six basis points - perhaps supportive of my view that today's selling is importantly a function of derisking of vol and risk parity strategies coupled with some margin calls.,2.0,2.0,13.0
11,960600836513648640,/DougKass/status/960600836513648640#m,DougKass,0.0,0.0,2018-02-05 07:47:00+00:00,1517816820000.0,Misguided business media is focus on interest rates. They are not even paying attention to the fact that 10 year yield has hit a day's low and is five basis points down from Friday! The problem is market structure and the dominance of short vol and risk parity,10.0,18.0,48.0
12,960585545226342400,/DougKass/status/960585545226342400#m,DougKass,0.0,0.0,2018-02-05 06:46:00+00:00,1517813160000.0,"One of these days the sort of selective marketing we see every day in the biz media - that emphasizes the positives and deemphasizes the negatives - will end up with broad SEC evaluation, fines and censures.",3.0,2.0,16.0
13,960582777539309570,/DougKass/status/960582777539309570#m,DougKass,0.0,0.0,2018-02-05 06:35:00+00:00,1517812500000.0,A constant refrain - a two crowded side of a boat inhabited by short vol and risk parity strategies - may be producing a derisking and the selling we are witnessing today .,0.0,0.0,11.0
14,960582725764870145,/DougKass/status/960582725764870145#m,DougKass,0.0,0.0,2018-02-05 06:35:00+00:00,1517812500000.0,"However, with stocks making new lows the message to me is that the responsible actor is a dangerous shift in the market's structure - fully discussed in this morning's two part opening missive - that is determining market price action.",0.0,1.0,11.0
15,960582675915526144,/DougKass/status/960582675915526144#m,DougKass,0.0,0.0,2018-02-05 06:35:00+00:00,1517812500000.0,"@TSTRealMoneyPro Interestingly the yield on the ten year US note is at the day's lows - at 2.823%, its three basis points lower this afternoon. If stocks were moving lower (Friday and today) only because of higher interest rates - stocks would have likely stabilized today.",0.0,1.0,1.0
16,960562262980341761,/DougKass/status/960562262980341761#m,DougKass,0.0,0.0,2018-02-05 05:14:00+00:00,1517807640000.0,"@CNBCFastMoney should be addressing the dangerous shift in market structure which likely is exacerbating the market decline. Less first level thinking, more second level thinking... respectfully.",1.0,1.0,3.0
17,960561525974097923,/DougKass/status/960561525974097923#m,DougKass,0.0,0.0,2018-02-05 05:11:00+00:00,1517807460000.0,Remember these terms? * Cryptocurrencies * Unusual call activity @TSTRealMoneyPro,1.0,2.0,14.0
18,960561032442851328,/DougKass/status/960561032442851328#m,DougKass,0.0,0.0,2018-02-05 05:09:00+00:00,1517807340000.0,"""First level thinking"" permeates the business media airways. Not value added or very insightful. As Howard Marks writes first level is stocks are rising because earnings are strong. Second level is have markets discounted the strong EPS?",6.0,4.0,20.0
19,960558692868509696,/DougKass/status/960558692868509696#m,DougKass,0.0,0.0,2018-02-05 05:00:00+00:00,1517806800000.0,@TSTRealMoneyPro Took a trading long rental in $SPY at $274.15. @jimcramer,0.0,0.0,0.0
20,960531223755051008,/DougKass/status/960531223755051008#m,DougKass,0.0,0.0,2018-02-05 03:11:00+00:00,1517800260000.0,@carlquintanilla On @TSTRealMoneyPro Why I believe stocks may end up higher today.,0.0,0.0,4.0
21,960530792026984451,/DougKass/status/960530792026984451#m,DougKass,0.0,0.0,2018-02-05 03:09:00+00:00,1517800140000.0,On @TSTRealMoneyPro I believe stocks could close higher today from Friday. @jimcramer,8.0,3.0,17.0
22,960505172270223360,/DougKass/status/960505172270223360#m,DougKass,0.0,0.0,2018-02-05 01:27:00+00:00,1517794020000.0,More tales from the crypt...,2.0,3.0,5.0
23,960503596084326400,/DougKass/status/960503596084326400#m,DougKass,0.0,0.0,2018-02-05 01:21:00+00:00,1517793660000.0,Why I covered some shorts on @TSTRealMoneyPro @jimcramer,1.0,0.0,4.0
24,960501436281958400,/DougKass/status/960501436281958400#m,DougKass,0.0,0.0,2018-02-05 01:12:00+00:00,1517793120000.0,@jimcramer Bitcoin at $7600 and now only $5600 above my $2k price target discussed in @TSTRealMoneyPro coindesk.com/price/,0.0,1.0,1.0
25,960500631516647424,/DougKass/status/960500631516647424#m,DougKass,0.0,0.0,2018-02-05 01:09:00+00:00,1517792940000.0,Remarkably in this market debate there is no discussion whatsoever about the dangerous structural shifts in the market in which vol has been compressed and short vol bets have grown dramatically.,8.0,1.0,23.0
26,960492392918016001,/DougKass/status/960492392918016001#m,DougKass,0.0,0.0,2018-02-05 12:36:00+00:00,1517834160000.0,Davos (bullish) sentiment was one of the great contra indicators - agree with @andrewrsorkin,1.0,5.0,25.0
27,960490984135110658,/DougKass/status/960490984135110658#m,DougKass,0.0,0.0,2018-02-05 12:31:00+00:00,1517833860000.0,Phew. Kevin OLeary is bullish.,9.0,2.0,31.0
28,960489564921106433,/DougKass/status/960489564921106433#m,DougKass,0.0,0.0,2018-02-05 12:25:00+00:00,1517833500000.0,@jimcramer @tomkeene Coming up on @TSTRealMoneyPro The Market Continues to Underprice Risk,0.0,0.0,1.0
29,960486662596907009,/DougKass/status/960486662596907009#m,DougKass,0.0,0.0,2018-02-05 12:13:00+00:00,1517832780000.0,"The market debate I am listening to is ""first level thinking"" - and doesn't incorporate the market's structural risks that have been building up.",6.0,1.0,21.0
30,960353026203705344,/DougKass/status/960353026203705344#m,DougKass,0.0,0.0,2018-02-05 03:22:00+00:00,1517800920000.0,Broad street!,3.0,0.0,11.0
31,960352852668485632,/DougKass/status/960352852668485632#m,DougKass,0.0,0.0,2018-02-05 03:22:00+00:00,1517800920000.0,@Jim cramer @carlquintanilla @tomkeene,0.0,0.0,0.0
32,960339129929170944,/DougKass/status/960339129929170944#m,DougKass,0.0,0.0,2018-02-05 02:27:00+00:00,1517797620000.0,Super Mario Gabelli and Commerce Secretary Wilbur Ross at Super Bowl party I am at now.. Go Eagles!,4.0,0.0,19.0
33,960332154990456837,/DougKass/status/960332154990456837#m,DougKass,0.0,0.0,2018-02-05 02:00:00+00:00,1517796000000.0,More marijuana industry workers than dental hygienists in the US businessinsider.com/more-mar…,1.0,8.0,14.0
34,960324954947497991,/DougKass/status/960324954947497991#m,DougKass,0.0,0.0,2018-02-05 01:31:00+00:00,1517794260000.0,Bond yields flat from Friday’s close,1.0,0.0,15.0
35,960313495819571200,/DougKass/status/960313495819571200#m,DougKass,0.0,0.0,2018-02-05 12:45:00+00:00,1517834700000.0,My guess is that futures could be higher at the opening tomorrow. @jimcramer,14.0,3.0,47.0
