,tweet_id,tweet_url,username,is_retweet,is_pinned,time,ts,text,replies,retweets,likes
85,1265809717366046725,/DougKass/status/1265809717366046725#m,DougKass,0.0,0.0,2020-05-28 12:58:00+00:00,1590670680000.0,"the President of CNBC Worldwide - as I did two weeks ago in his latest attack. (Hoffman seems to be a very good guy). This morning, like many mornings, Kernen showed his colors. Few of his fellow commentators will publicly chastise Kernen - as understandably @cnbc is a 'club'",1.0,2.0,34.0
86,1265809718297182209,/DougKass/status/1265809718297182209#m,DougKass,0.0,0.0,2020-05-28 12:58:00+00:00,1590670680000.0,"and it would not be politic. However, several of his associates have directly contacted me today - they all recognize his attacks on me and others. While I have promised to maintain their anonymity, they are all in Andrew's corner and have applauded his integrity and straight",1.0,0.0,33.0
87,1265809719190532097,/DougKass/status/1265809719190532097#m,DougKass,0.0,0.0,2020-05-28 12:58:00+00:00,1590670680000.0,"forward responses to Kernen this morning. As well, I have received private emails and calls from frequent @cnbc guests, who unlike me (I dont give a shit about appearing on the network) need to maintain their anonymity in order to continue to be invited guests on CNBC.",1.0,0.0,30.0
88,1265809720054603777,/DougKass/status/1265809720054603777#m,DougKass,0.0,0.0,2020-05-28 12:58:00+00:00,1590670680000.0,"I understand and respect that perspective - their livelihood partially depends upon the invites. No doubt Kernen will not suffer professionally, at least in his own mind - he will appear tomorrow as he has routinely for years at his desk at 6AM, almost as if nothing has",3.0,0.0,28.0
89,1265809720897568768,/DougKass/status/1265809720897568768#m,DougKass,0.0,0.0,2020-05-28 12:58:00+00:00,1590670680000.0,"happened. But others have observed, noticed and decided. Joe, no matter how big one's house is our graves will always be the same size and our reputations will always be remembered. We shape our buildings: thereafter they shape us. Your foundation has crumbled.",5.0,3.0,76.0
90,1265809721719762944,/DougKass/status/1265809721719762944#m,DougKass,0.0,0.0,2020-05-28 12:58:00+00:00,1590670680000.0,@beckyquick @tomkeene @saraeisen @guyadami @joeterranova @cnbcfastmoney @ritholtz @ferrotv @realdonaldtrump @business @SullyCNBC @MelissaLeeCNBC @carlquintinilla @bobpisani @riskreversal @joesquawk @ScottWapnerCNBC @michaelsantoli @threadreaderapp unroll,6.0,2.0,35.0
