,tweet_id,tweet_url,username,is_retweet,is_pinned,time,ts,text,replies,retweets,likes
0,18706793928,/DougKass/status/18706793928#m,DougKass,0.0,0.0,2010-07-16 06:28:00+00:00,1279261680000.0,A CORRECTION IS AT HAND http://bit.ly/cDT8VZ $$,0.0,2.0,2.0
1,18705129445,/DougKass/status/18705129445#m,DougKass,0.0,0.0,2010-07-16 06:01:00+00:00,1279260060000.0,Kass: A Correction Is in the Cards: The magnitude of the economic weakness is now debatable and is most certainl... http://bit.ly/bFTi3p $$,0.0,5.0,1.0
2,18702357213,/DougKass/status/18702357213#m,DougKass,0.0,0.0,2010-07-16 05:19:00+00:00,1279257540000.0,i am renting a long in QQQQ at 44.60 because jobs' appearance reflects the co view of the gravity of situation $$,0.0,1.0,0.0
3,18686571824,/DougKass/status/18686571824#m,DougKass,0.0,0.0,2010-07-16 01:45:00+00:00,1279244700000.0,i am ringing the register and takin g in my spider short now $$,0.0,2.0,0.0
4,18678602584,/DougKass/status/18678602584#m,DougKass,0.0,0.0,2010-07-16 11:36:00+00:00,1279280160000.0,"short term, its time to curb your enthusiasm, shorting spiders at 109.9 $$",0.0,4.0,3.0
