,tweet_id,tweet_url,username,is_retweet,is_pinned,time,ts,text,replies,retweets,likes
0,227132842260447232,/DougKass/status/227132842260447232#m,DougKass,0.0,0.0,2012-07-22 08:07:00+00:00,1342944420000.0,Euro dropping a bit now,2.0,2.0,3.0
1,227118824640610304,/DougKass/status/227118824640610304#m,DougKass,0.0,0.0,2012-07-22 07:12:00+00:00,1342941120000.0,The Best of Kass dlvr.it/1tv4Xl $$,1.0,0.0,4.0
2,227108476806123520,/DougKass/status/227108476806123520#m,DougKass,0.0,0.0,2012-07-22 06:30:00+00:00,1342938600000.0,With the Euro trading flattish - I think we can see the same for the S&P futures at the get go at 6 PM tonite.,5.0,1.0,1.0
3,227088569934688257,/DougKass/status/227088569934688257#m,DougKass,0.0,0.0,2012-07-22 05:11:00+00:00,1342933860000.0,The Open Championship will be won by Els - Ludacris!! on.wsj.com/M4EDtU,4.0,1.0,0.0
4,227085911245090817,/DougKass/status/227085911245090817#m,DougKass,0.0,0.0,2012-07-22 05:01:00+00:00,1342933260000.0,And......here comes Ernie Els! in The British Open!!,3.0,0.0,0.0
