,tweet_id,tweet_url,username,is_retweet,is_pinned,time,ts,text,replies,retweets,likes
0,1227699974529593345,/DougKass/status/1227699974529593345#m,DougKass,0.0,0.0,2020-02-12 09:04:00+00:00,1581498240000.0,@ScottWapnerCNBC @saraeisen,1.0,0.0,0.0
1,1227697064680751105,/DougKass/status/1227697064680751105#m,DougKass,0.0,0.0,2020-02-12 08:52:00+00:00,1581497520000.0,"Berkshire Hathaway ""made"" nearly $2 billion on their $AAPL investment today. @realmoney @SquawkCNBC @cnbcfastmoney @tomkeene @jimcramer @lizclaman @Sarge986 @riskreversal",2.0,3.0,11.0
2,1227653001768206336,/DougKass/status/1227653001768206336#m,DougKass,0.0,0.0,2020-02-12 05:57:00+00:00,1581487020000.0,WTF? Trump cuts scheduled federal pay raise citing “serious economic conditions” in the country ... slate.com/news-and-politics/…,17.0,23.0,57.0
3,1227550913402998784,/DougKass/status/1227550913402998784#m,DougKass,0.0,0.0,2020-02-12 11:11:00+00:00,1581505860000.0,On @realmoney $AMZN is the New $TSLA @jimcramer @tomkeene Indicated +$20(+)/share in premarket trading. @SquawkCNBC @cnbcfastmoney @lizclaman @Sarge986 @riskreversal,2.0,2.0,8.0
4,1227547658845347842,/DougKass/status/1227547658845347842#m,DougKass,0.0,0.0,2020-02-12 10:59:00+00:00,1581505140000.0,Suck up! Morning Kenny!!,0.0,0.0,6.0
5,1227547506009137162,/DougKass/status/1227547506009137162#m,DougKass,0.0,0.0,2020-02-12 10:58:00+00:00,1581505080000.0,"On @realmoney this morning: What's With Futures at 3AM Every Morning? * My speculation about possible government purchases of stock futures may be farfetched. * But, then again, it may not be! @jimcramer @tomkeene @SquawkCNBC @cnbcfastmoney @riskreversal @guyadami",17.0,4.0,36.0
6,1227547506860531712,/DougKass/status/1227547506860531712#m,DougKass,0.0,0.0,2020-02-12 10:58:00+00:00,1581505080000.0,@ScottWapnerCNBC @lizclaman @business @dwyerstrategy @Sarge986 @michaelsantoli @carlquintanilla @terranovajoe,0.0,0.0,1.0
7,1227540706811666432,/DougKass/status/1227540706811666432#m,DougKass,0.0,0.0,2020-02-12 10:31:00+00:00,1581503460000.0,"the Department of Justice. It raises the ugly specter that the Department of Justice has been reduced to a political weapon for Trump. As Tribe said, there was “Not even a pretense of legality. They’re doing it because they can. It’s raw, naked, unprincipled, immoral power.”",1.0,4.0,9.0
8,1227540707881213952,/DougKass/status/1227540707881213952#m,DougKass,0.0,0.0,2020-02-12 10:31:00+00:00,1581503460000.0,"Fortunately for us, there are courageous men and women in the Department of Justice who are willing to resign or withdraw in protest rather than participate in the perversion of the DOJ’s mission. On Tuesday, career prosecutors Adam C. Jed, Aaron Zelinsky, Michael J. Marando,",1.0,1.0,4.0
9,1227540708933984259,/DougKass/status/1227540708933984259#m,DougKass,0.0,0.0,2020-02-12 10:31:00+00:00,1581503460000.0,and Jonathan Kravis withdrew from the case against Roger Stone in protest over Barr’s political interference. Jonathan Kravis resigned from the Department of Justice. The DOJ then,1.0,1.0,3.0
10,1227540709844115456,/DougKass/status/1227540709844115456#m,DougKass,0.0,0.0,2020-02-12 10:31:00+00:00,1581503460000.0,"filed a mealy-mouthed brief that said that the judge should do whatever she wanted regarding sentencing. With no one remaining from the original team to sign the brief, Acting Head of the Criminal Division,",1.0,0.0,1.0
11,1227540710754308098,/DougKass/status/1227540710754308098#m,DougKass,0.0,0.0,2020-02-12 10:31:00+00:00,1581503460000.0,"John Crabb Jr., stepped in to stop the exodus of principled government servants who refused to cave to Trump’s political pressure. We have a new Robert Bork for our times. I don’t know John Crabb. He may be a swell guy. I do know that if he had refused to sign the revised brief",1.0,0.0,2.0
12,1227540711979016192,/DougKass/status/1227540711979016192#m,DougKass,0.0,0.0,2020-02-12 10:31:00+00:00,1581503460000.0,", the chain reaction of resistance to Trump may have continued until there was no one to sign the brief except Bill Barr. In stepping into the breach—even out of a misguided sense of duty—people like Mr. Crabb are enabling Trump’s politicization of the Department of Justice.",1.0,0.0,3.0
13,1227540713195352069,/DougKass/status/1227540713195352069#m,DougKass,0.0,0.0,2020-02-12 10:31:00+00:00,1581503460000.0,"We need more people like Zelinsky, Jed, Marando, and Kravis—and fewer people like Crabb in the Department of Justice. That is what it will take to redeem the reputation of the DOJ. In a truly astounding, breathtaking turn of events, Trump then began a twitter attack on the judge",1.0,2.0,4.0
14,1227540714151608320,/DougKass/status/1227540714151608320#m,DougKass,0.0,0.0,2020-02-12 10:31:00+00:00,1581503460000.0,"who will determine Stone’s sentence, Judge Amy Berman Jackson. Trump tweeted, Is this the Judge that put Paul Manafort in SOLITARY CONFINEMENT, something that not even mobster Al Capone had to endure? How did she treat Crooked Hillary Clinton? Just asking!",1.0,0.0,2.0
15,1227540715074457600,/DougKass/status/1227540715074457600#m,DougKass,0.0,0.0,2020-02-12 10:31:00+00:00,1581503460000.0,"Not satisfied with Barr’s political intervention on behalf of Stone, Trump is now attempting to intimidate a federal judge presiding over a criminal trial. Chief Justice John Roberts should speak out to defend the federal judiciary! Republican Senators who gave Trump",1.0,2.0,3.0
16,1227540716034887680,/DougKass/status/1227540716034887680#m,DougKass,0.0,0.0,2020-02-12 10:31:00+00:00,1581503460000.0,"a “get out of jail free” card should step in to protect the independence of the judiciary. They will not because they are in hiding, their heads hung in shame over their failure to stop the monster they have created. See The Hill, “Democrats call for Graham to launch Senate",1.0,1.0,4.0
17,1227540717054066690,/DougKass/status/1227540717054066690#m,DougKass,0.0,0.0,2020-02-12 10:31:00+00:00,1581503460000.0,"probe into Roger Stone sentence recommendation.” (Blumenthal wrote to Graham, “This highly unusual about-face by the Department is stunning and alarming, and smacks of dangerous political interference in law enforcement decision-making.”) We must be realistic about the",1.0,0.0,2.0
18,1227540718060699648,/DougKass/status/1227540718060699648#m,DougKass,0.0,0.0,2020-02-12 10:31:00+00:00,1581503460000.0,threat posed by Bill Barr’s abandonment of independence and his willingness to act as Trump’s political errand boy. It is a serious threat to the rule of law. But we should take heart that some career professionals are willing to stand up to Trump—as Sally Yates did in January,2.0,0.0,4.0
19,1227540719159726080,/DougKass/status/1227540719159726080#m,DougKass,0.0,0.0,2020-02-12 10:31:00+00:00,1581503460000.0,"2017. Mass resignations from the Department of Justice in solidarity with Zelinsky, Jed, Marando, and Kravis would hobble Barr and Trump. Will there be a chain reaction of resistance? Let’s hope so.",1.0,1.0,9.0
20,1227540704844488705,/DougKass/status/1227540704844488705#m,DougKass,0.0,0.0,2020-02-12 10:31:00+00:00,1581503460000.0,"and would issue a revised recommendation on Tuesday. In response, four assistant US attorneys withdrew from the case; one resigned from the DOJ altogether. Larry Tribe tweeted that",1.0,0.0,0.0
21,1227540705842794496,/DougKass/status/1227540705842794496#m,DougKass,0.0,0.0,2020-02-12 10:31:00+00:00,1581503460000.0,Barr is acting as “Trump’s personal henchman.” Recall that Stone served as Trump’s “dirty trickster” and “back-channel” to Wikileaks. Barr’s political interference in decisions by career prosecutors is stunning. Barr is doing violence to the tradition of political independence of,1.0,3.0,3.0
22,1227540702667694081,/DougKass/status/1227540702667694081#m,DougKass,0.0,0.0,2020-02-12 10:31:00+00:00,1581503460000.0,"@realdonaldtrump On Monday, career prosecutors in the US Attorneys Office for the District of Columbia recommended that Roger Stone be sentenced to seven to nine years in prison for lying to Congress about his knowledge of 2016 election interference. Trump erupted on Twitter,",2.0,0.0,8.0
23,1227425192412110848,/DougKass/status/1227425192412110848#m,DougKass,0.0,0.0,2020-02-12 02:52:00+00:00,1581475920000.0,Thomas Friedman/NY Times: Paging Mike Bloomberg nytimes.com/2020/02/11/opini… @realdonaldtrump,9.0,5.0,24.0
