,tweet_id,tweet_url,username,is_retweet,is_pinned,time,ts,text,replies,retweets,likes
0,1558053036710412288,/DougKass/status/1558053036710412288#m,DougKass,0.0,0.0,2022-08-12 11:29:00+00:00,1660303740000.0,"To my friends, haters and those that don't give a crap -- enjoy the weekend with your families. Back here early next week-- at @SeabreezeLP and @realmoney in the interim.",11.0,1.0,136.0
1,1558051846350114817,/DougKass/status/1558051846350114817#m,DougKass,0.0,0.0,2022-08-12 11:24:00+00:00,1660303440000.0,"@realmoney @dougkass @SeabreezeLP We continue to derisk: Aug 12, 2022 | 06:23 AM EDT DOUG KASS I sold more SPDR S&P 500 ETF ($SPY) at $422.27 in premarket trading at around 6:05 a.m. ET Position: Long SPY; short SPY calls @tomkeene @jimcramer @lisaabramowicz1 @riskreversal",0.0,0.0,9.0
2,1558049985085816835,/DougKass/status/1558049985085816835#m,DougKass,0.0,0.0,2022-08-12 11:17:00+00:00,1660303020000.0,How can this be bullish for equities? @KeithMcCullough @HedgeyeDJ,4.0,1.0,20.0
3,1558049729119981569,/DougKass/status/1558049729119981569#m,DougKass,0.0,0.0,2022-08-12 11:16:00+00:00,1660302960000.0,"@realmoney Interestingly, inflation beneficiaries led yeterday's market... @dougkass @SeabreezeLP",0.0,1.0,2.0
4,1558045618949554176,/DougKass/status/1558045618949554176#m,DougKass,0.0,0.0,2022-08-12 10:59:00+00:00,1660301940000.0,Toddo I have been adding to $TRSSF on weakness. I like the QB and company's current and prospective footprint.,6.0,1.0,23.0
5,1558044619849465857,/DougKass/status/1558044619849465857#m,DougKass,0.0,0.0,2022-08-12 10:55:00+00:00,1660301700000.0,Am i correct that the company's preferred raise has a 20% interest rate with attached warrants? If so this is an unenviable cost of capital ... to put it lightly. $GLASF,6.0,4.0,25.0
6,1558028911946104836,/DougKass/status/1558028911946104836#m,DougKass,0.0,0.0,2022-08-12 09:53:00+00:00,1660297980000.0,"Actually I wrote about the gap higher in soft commodities at 622 AM Thursday morning - six hours before u: Aug 11, 2022 | 06:22 AM EDT DOUG KASS A Quick Look at Overnight Futures * Soft commodities are higher -- let's watch this (for now equity bulls are unconcerned).",1.0,0.0,10.0
7,1557901017601261568,/DougKass/status/1557901017601261568#m,DougKass,0.0,0.0,2022-08-12 01:25:00+00:00,1660267500000.0,"As we have discussed, $MSOS is outsized (in $s) relative to the individual cannabis company floats - rendering the ETF ($MSOS) the tails that wags the cannabis dog.",1.0,0.0,13.0
