,tweet_id,tweet_url,username,is_retweet,is_pinned,time,ts,text,replies,retweets,likes
0,668536534681985030,/DougKass/status/668536534681985030#m,DougKass,0.0,0.0,2015-11-22 09:08:00+00:00,1448183280000.0,This explains my process F. dougkass.tumblr.com/post/133…,2.0,0.0,3.0
1,668536447713062913,/DougKass/status/668536447713062913#m,DougKass,0.0,0.0,2015-11-22 09:08:00+00:00,1448183280000.0,will do.,0.0,0.0,1.0
2,668536417606352896,/DougKass/status/668536417606352896#m,DougKass,0.0,0.0,2015-11-22 09:07:00+00:00,1448183220000.0,"Here is my approach, elaborated.. dougkass.tumblr.com/post/133…",1.0,0.0,2.0
3,668536133861646336,/DougKass/status/668536133861646336#m,DougKass,0.0,0.0,2015-11-22 09:06:00+00:00,1448183160000.0,Coming up on RealMoneyPro tomorrow morning: Bad Breadth and Bad Economic News,1.0,0.0,1.0
4,668498112357523457,/DougKass/status/668498112357523457#m,DougKass,0.0,0.0,2015-11-22 06:35:00+00:00,1448174100000.0,As I expressed recently charts to me say where we have been not where we are going,4.0,1.0,10.0
5,668400961447190528,/DougKass/status/668400961447190528#m,DougKass,0.0,0.0,2015-11-22 12:09:00+00:00,1448194140000.0,Hello! Instant Classic from Saturday Night Live nbc.com/saturday-night-live,1.0,4.0,8.0
6,668395734107095040,/DougKass/status/668395734107095040#m,DougKass,0.0,0.0,2015-11-22 11:48:00+00:00,1448192880000.0,"Posted on Chipolte $CMG Yahoo message board: ""I am typing from a toilet, ate there 3 days ago, legs are numb.""",8.0,2.0,16.0
