,tweet_id,tweet_url,username,is_retweet,is_pinned,time,ts,text,replies,retweets,likes
0,642087920900403201,/DougKass/status/642087920900403201#m,DougKass,0.0,0.0,2015-09-10 09:31:00+00:00,1441877460000.0,yup,0.0,0.0,0.0
1,642068976625950720,/DougKass/status/642068976625950720#m,DougKass,0.0,0.0,2015-09-10 08:15:00+00:00,1441872900000.0,I miss you every day Chuck. thestreet.com/story/11695456…,6.0,1.0,25.0
2,642067603591176192,/DougKass/status/642067603591176192#m,DougKass,0.0,0.0,2015-09-10 08:10:00+00:00,1441872600000.0,I have forgotten.,1.0,0.0,7.0
3,642067540399779841,/DougKass/status/642067540399779841#m,DougKass,0.0,0.0,2015-09-10 08:10:00+00:00,1441872600000.0,Enjoy the evening to all. Tomorrow is the saddest day of the year. On RealMoneyPro I will start with my annual tribute to Chuck who was lost,4.0,1.0,5.0
4,642056924767387648,/DougKass/status/642056924767387648#m,DougKass,0.0,0.0,2015-09-10 07:27:00+00:00,1441870020000.0,@gfpr I am a tremendous slouch piped.video/watch?v=_cLkmYkE…,1.0,0.0,1.0
5,642051333219045377,/DougKass/status/642051333219045377#m,DougKass,0.0,0.0,2015-09-10 07:05:00+00:00,1441868700000.0,Look for an SEC commission to determine the influence of Quant funds... in 2020!,4.0,1.0,4.0
6,642050980109021184,/DougKass/status/642050980109021184#m,DougKass,0.0,0.0,2015-09-10 07:04:00+00:00,1441868640000.0,Today's Takeaways and Observations now up on RealMoneyPro I close the day net short. (last $SPY short at $197 as posted),2.0,0.0,5.0
7,642049675382661120,/DougKass/status/642049675382661120#m,DougKass,0.0,0.0,2015-09-10 06:59:00+00:00,1441868340000.0,Here we go... again. In the market with no memory from hour to hour.,3.0,0.0,3.0
8,642049194841231360,/DougKass/status/642049194841231360#m,DougKass,0.0,0.0,2015-09-10 06:57:00+00:00,1441868220000.0,"No more virtual Tweet Shows these days, so how about singing along... dougkass.tumblr.com/post/128…",0.0,0.0,0.0
9,642047266296041472,/DougKass/status/642047266296041472#m,DougKass,0.0,0.0,2015-09-10 06:49:00+00:00,1441867740000.0,Never ever.,0.0,0.0,1.0
10,642047213141688321,/DougKass/status/642047213141688321#m,DougKass,0.0,0.0,2015-09-10 06:49:00+00:00,1441867740000.0,I dont know. Gold is like religion Either you believe in God or gold - or you dont!,1.0,1.0,3.0
11,642043094955880448,/DougKass/status/642043094955880448#m,DougKass,0.0,0.0,2015-09-10 06:32:00+00:00,1441866720000.0,the schwartz is with me this week. but there are two sides of every schwartz piped.video/watch?v=IjVatNQr…,1.0,3.0,4.0
12,642042915930402816,/DougKass/status/642042915930402816#m,DougKass,0.0,0.0,2015-09-10 06:32:00+00:00,1441866720000.0,May the Schwartz be with YOU! piped.video/watch?v=IjVatNQr…,2.0,0.0,2.0
13,642042709168005125,/DougKass/status/642042709168005125#m,DougKass,0.0,0.0,2015-09-10 06:31:00+00:00,1441866660000.0,Today's Takeaways and Observations going up on RealMoneyPro.,1.0,0.0,1.0
14,642039008449708032,/DougKass/status/642039008449708032#m,DougKass,0.0,0.0,2015-09-10 06:16:00+00:00,1441865760000.0,On realmoneypro - why i reshorted $spy at $197 this afternoon. Exhausting. Now back net short. 1960 to 1990 remains my shorting levels.,4.0,2.0,6.0
15,642034594737451008,/DougKass/status/642034594737451008#m,DougKass,0.0,0.0,2015-09-10 05:59:00+00:00,1441864740000.0,Did I mention the market has no memory from hour to hour?,1.0,3.0,9.0
16,641992576539717633,/DougKass/status/641992576539717633#m,DougKass,0.0,0.0,2015-09-10 03:12:00+00:00,1441854720000.0,BAC or C,1.0,1.0,6.0
17,641990445032148992,/DougKass/status/641990445032148992#m,DougKass,0.0,0.0,2015-09-10 03:03:00+00:00,1441854180000.0,My long SPY rentals have a shorter half life than my short SPY rentals because not bullish dougkass.tumblr.com/post/128… + dougkass.tumblr.com/post/128…,0.0,1.0,4.0
18,641989405645926400,/DougKass/status/641989405645926400#m,DougKass,0.0,0.0,2015-09-10 02:59:00+00:00,1441853940000.0,A short lived trade is as good as a long lived trade if proves profitable.,2.0,0.0,3.0
19,641987432796299264,/DougKass/status/641987432796299264#m,DougKass,0.0,0.0,2015-09-10 02:51:00+00:00,1441853460000.0,"I have sold the balane of my $SPY long at $196.25. In motion, locomotion! piped.video/watch?v=eKpVQm41…",2.0,0.0,6.0
20,641986878263181312,/DougKass/status/641986878263181312#m,DougKass,0.0,0.0,2015-09-10 02:49:00+00:00,1441853340000.0,Sold half of my SPY long rental at the figure ($196),2.0,0.0,8.0
21,641985636245839873,/DougKass/status/641985636245839873#m,DougKass,0.0,0.0,2015-09-10 02:44:00+00:00,1441853040000.0,I am not worthy I am not worthy piped.video/watch?v=-FucbvoF…,0.0,0.0,1.0
22,641980822745124865,/DougKass/status/641980822745124865#m,DougKass,0.0,0.0,2015-09-10 02:25:00+00:00,1441851900000.0,Thanks AH. Good to see you back on thread.,1.0,1.0,0.0
23,641980751010000897,/DougKass/status/641980751010000897#m,DougKass,0.0,0.0,2015-09-10 02:25:00+00:00,1441851900000.0,Back in SPY long rental. See RealMoneyPro for reasons. (at $194.50),3.0,2.0,1.0
24,641979211910135808,/DougKass/status/641979211910135808#m,DougKass,0.0,0.0,2015-09-10 02:19:00+00:00,1441851540000.0,"According to a column on WSJ on line just put up, OPEC sees weak oil prices through 2015.",1.0,0.0,1.0
25,641977767492501504,/DougKass/status/641977767492501504#m,DougKass,0.0,0.0,2015-09-10 02:13:00+00:00,1441851180000.0,No diff.,0.0,0.0,2.0
26,641976808368377856,/DougKass/status/641976808368377856#m,DougKass,0.0,0.0,2015-09-10 02:09:00+00:00,1441850940000.0,"Up on RealMoneyPro ""I am Sour on Apple, Dude!"" A funny analysis of new product offerings.",0.0,0.0,4.0
27,641973630948233216,/DougKass/status/641973630948233216#m,DougKass,0.0,0.0,2015-09-10 01:56:00+00:00,1441850160000.0,I have been trading on the short side of $SPY for months. With my neg view I gave mkt berth.,1.0,0.0,1.0
28,641972829886525440,/DougKass/status/641972829886525440#m,DougKass,0.0,0.0,2015-09-10 01:53:00+00:00,1441849980000.0,Yes in the machine driven market. always. be well. dougie,0.0,0.0,2.0
29,641971959329329152,/DougKass/status/641971959329329152#m,DougKass,0.0,0.0,2015-09-10 01:50:00+00:00,1441849800000.0,It was a rookie move by me Bobby.,3.0,0.0,0.0
30,641971881902534656,/DougKass/status/641971881902534656#m,DougKass,0.0,0.0,2015-09-10 01:49:00+00:00,1441849740000.0,A Yaya back to ya.,0.0,0.0,0.0
31,641970511753412608,/DougKass/status/641970511753412608#m,DougKass,0.0,0.0,2015-09-10 01:44:00+00:00,1441849440000.0,Looking big G,0.0,0.0,0.0
32,641970465175699456,/DougKass/status/641970465175699456#m,DougKass,0.0,0.0,2015-09-10 01:44:00+00:00,1441849440000.0,Probably made a mistake in selling my $SPY long rental for a push. David Tepper got into my head!,6.0,0.0,6.0
33,641969669587513344,/DougKass/status/641969669587513344#m,DougKass,0.0,0.0,2015-09-10 01:41:00+00:00,1441849260000.0,"To me, rentals are somewhere between thirty minutes and a few days ML.",0.0,0.0,1.0
34,641969554600685568,/DougKass/status/641969554600685568#m,DougKass,0.0,0.0,2015-09-10 01:40:00+00:00,1441849200000.0,Aggressively adding to $BAC $JPM $C,7.0,3.0,8.0
35,641968943339601920,/DougKass/status/641968943339601920#m,DougKass,0.0,0.0,2015-09-10 01:38:00+00:00,1441849080000.0,"you are correct, sir.",0.0,0.0,2.0
36,641968539188994052,/DougKass/status/641968539188994052#m,DougKass,0.0,0.0,2015-09-10 01:36:00+00:00,1441848960000.0,i sold my $SPY long rental for a small gain (my average cost was $194.80),0.0,1.0,2.0
37,641967999872802816,/DougKass/status/641967999872802816#m,DougKass,0.0,0.0,2015-09-10 01:34:00+00:00,1441848840000.0,Yup. I licked cancer two years ago Deb.,2.0,1.0,12.0
38,641967901772251136,/DougKass/status/641967901772251136#m,DougKass,0.0,0.0,2015-09-10 01:34:00+00:00,1441848840000.0,Cost basis on $SPY long rental is $194.78,1.0,1.0,2.0
39,641965706809053184,/DougKass/status/641965706809053184#m,DougKass,0.0,0.0,2015-09-10 01:25:00+00:00,1441848300000.0,thanks danny,1.0,0.0,0.0
40,641965635434627072,/DougKass/status/641965635434627072#m,DougKass,0.0,0.0,2015-09-10 01:25:00+00:00,1441848300000.0,LIfe is too short LeRoy. I dont have time for ad hominem attacks. No Yayas.,2.0,0.0,4.0
41,641964252719382528,/DougKass/status/641964252719382528#m,DougKass,0.0,0.0,2015-09-10 01:19:00+00:00,1441847940000.0,My unconventional reaction to $AAPL product introductions on RealMoneyPro shortly.,0.0,0.0,1.0
42,641963937186099200,/DougKass/status/641963937186099200#m,DougKass,0.0,0.0,2015-09-10 01:18:00+00:00,1441847880000.0,You can never assume that.,1.0,0.0,2.0
43,641961866449821696,/DougKass/status/641961866449821696#m,DougKass,0.0,0.0,2015-09-10 01:10:00+00:00,1441847400000.0,Go to RealMoneyPro I dont work for Twitter.,1.0,0.0,2.0
44,641961140684197888,/DougKass/status/641961140684197888#m,DougKass,0.0,0.0,2015-09-10 01:07:00+00:00,1441847220000.0,"Yes, he writes unemotionally.",0.0,0.0,1.0
45,641961084828692480,/DougKass/status/641961084828692480#m,DougKass,0.0,0.0,2015-09-10 01:07:00+00:00,1441847220000.0,"""A Wild Ride Lies Ahead"" dougkass.tumblr.com/post/128… There 3 posts give a good sense of my thinking these days - from Tumblr/RealMoneyPro",1.0,0.0,3.0
46,641960936459382784,/DougKass/status/641960936459382784#m,DougKass,0.0,0.0,2015-09-10 01:06:00+00:00,1441847160000.0,"From RealMoneyPro: ""Baby Its Cold Outside"" dougkass.tumblr.com/post/128… ""Season of the Glitch"" dougkass.tumblr.com/post/128…",0.0,0.0,1.0
47,641956776720629760,/DougKass/status/641956776720629760#m,DougKass,0.0,0.0,2015-09-10 12:49:00+00:00,1441889340000.0,well done.,0.0,0.0,1.0
48,641956688510255104,/DougKass/status/641956688510255104#m,DougKass,0.0,0.0,2015-09-10 12:49:00+00:00,1441889340000.0,"My Fair Market Value calculation is 1890 (on RMPRO you can find my methodology) and this morning's missive says the same about ""VAR."" $SPY",2.0,1.0,2.0
49,641956528682045440,/DougKass/status/641956528682045440#m,DougKass,0.0,0.0,2015-09-10 12:48:00+00:00,1441889280000.0,"On Squawk the great one, David Tepper, sees Fair Market Value at about 1800 and says ""value at risk"" should be reduced.",1.0,7.0,8.0
50,641955294797537280,/DougKass/status/641955294797537280#m,DougKass,0.0,0.0,2015-09-10 12:44:00+00:00,1441889040000.0,Totally incorrect. For failing to understand the diffenece between a short term rental and investment blocked,2.0,0.0,7.0
51,641951932832202752,/DougKass/status/641951932832202752#m,DougKass,0.0,0.0,2015-09-10 12:30:00+00:00,1441888200000.0,,1.0,3.0,3.0
52,641951889932861440,/DougKass/status/641951889932861440#m,DougKass,0.0,0.0,2015-09-10 12:30:00+00:00,1441888200000.0,Howard Marks is a brilliant teacher.,0.0,0.0,4.0
53,641951814624104448,/DougKass/status/641951814624104448#m,DougKass,0.0,0.0,2015-09-10 12:30:00+00:00,1441888200000.0,Tepper is great on Squawk Box now. Must see TV.,0.0,1.0,5.0
54,641943294365331456,/DougKass/status/641943294365331456#m,DougKass,0.0,0.0,2015-09-10 11:56:00+00:00,1441886160000.0,Pat See my opener on RealMoneyPro. I further amplify on the issue.,1.0,0.0,1.0
55,641941011460194304,/DougKass/status/641941011460194304#m,DougKass,0.0,0.0,2015-09-10 11:47:00+00:00,1441885620000.0,Freebie: My Tumblr Thread dougkass.tumblr.com/,0.0,1.0,2.0
56,641940545225531392,/DougKass/status/641940545225531392#m,DougKass,0.0,0.0,2015-09-10 11:45:00+00:00,1441885500000.0,"That, sir... you can take to the bank. Enjoy the day, done with the haters. They are pathetic souls, pity the fools.",1.0,0.0,1.0
57,641939928516005888,/DougKass/status/641939928516005888#m,DougKass,0.0,0.0,2015-09-10 11:43:00+00:00,1441885380000.0,machines too up and down.,0.0,0.0,1.0
58,641939545580281856,/DougKass/status/641939545580281856#m,DougKass,0.0,0.0,2015-09-10 11:41:00+00:00,1441885260000.0,Lets do that webinar a te end of the month.,0.0,0.0,0.0
59,641939469730492416,/DougKass/status/641939469730492416#m,DougKass,0.0,0.0,2015-09-10 11:41:00+00:00,1441885260000.0,My pleasure Bobby Lang!,0.0,0.0,0.0
60,641939373357969409,/DougKass/status/641939373357969409#m,DougKass,0.0,0.0,2015-09-10 11:40:00+00:00,1441885200000.0,I too pity the fools. Blocked and muted.,1.0,0.0,0.0
61,641939211780755457,/DougKass/status/641939211780755457#m,DougKass,0.0,0.0,2015-09-10 11:40:00+00:00,1441885200000.0,Yes you are 100% right. I agree. That guy is a total fraud. Blocked and muted.,2.0,2.0,0.0
62,641939074656419840,/DougKass/status/641939074656419840#m,DougKass,0.0,0.0,2015-09-10 11:39:00+00:00,1441885140000.0,Working on a scale lower on $SPY rental - buying $SPY from $195.40 down to $195.10 in premarket trading.,2.0,0.0,3.0
63,641933022263164929,/DougKass/status/641933022263164929#m,DougKass,0.0,0.0,2015-09-10 11:15:00+00:00,1441883700000.0,See RMPro Bobby.,2.0,0.0,1.0
64,641932866914525184,/DougKass/status/641932866914525184#m,DougKass,0.0,0.0,2015-09-10 11:14:00+00:00,1441883640000.0,"No need to worry. Blocked and muted for stupid, factually incorrect and ad hominem comments. Rating: 0/10",2.0,0.0,0.0
65,641932605982699520,/DougKass/status/641932605982699520#m,DougKass,0.0,0.0,2015-09-10 11:13:00+00:00,1441883580000.0,"A + for near term. I like that ""renters"" have left the building, justifiably spooked by the volatiltiy. $SPY",0.0,0.0,3.0
66,641930909571227648,/DougKass/status/641930909571227648#m,DougKass,0.0,0.0,2015-09-10 11:07:00+00:00,1441883220000.0,On RealMoneyPro: Taking a long rental in $SPY at $195.35 in premarket trading. Expanding my long exposure.,0.0,1.0,1.0
67,641928994179444736,/DougKass/status/641928994179444736#m,DougKass,0.0,0.0,2015-09-10 10:59:00+00:00,1441882740000.0,Brazil’s debt rating cut to junk at S&P,1.0,1.0,1.0
68,641925288868335616,/DougKass/status/641925288868335616#m,DougKass,0.0,0.0,2015-09-10 10:44:00+00:00,1441881840000.0,Precisely my point in my recent columns. A machine dominated market.,6.0,1.0,4.0
69,641916963598532608,/DougKass/status/641916963598532608#m,DougKass,0.0,0.0,2015-09-10 10:11:00+00:00,1441879860000.0,The market? FUBAR! Volatility an outgrowth of a machines dominated market. Kill the Quants Before They Kill our Markets.,5.0,5.0,18.0
70,641912391840735232,/DougKass/status/641912391840735232#m,DougKass,0.0,0.0,2015-09-10 09:53:00+00:00,1441878780000.0,My opener on RealMoneyPro Staying Alive explains my thought process piped.video/watch?v=I_izvAbh…,0.0,0.0,2.0
71,641911345441542144,/DougKass/status/641911345441542144#m,DougKass,0.0,0.0,2015-09-10 09:49:00+00:00,1441878540000.0,I have added to my net long exposure in premarket trading this morning. $SPY,5.0,1.0,7.0
72,641905673220001792,/DougKass/status/641905673220001792#m,DougKass,0.0,0.0,2015-09-10 09:26:00+00:00,1441877160000.0,Coming up on realmoneypro. staying Alive how to deal with today's volatile and treacherous markets,0.0,0.0,3.0
73,641905404646191104,/DougKass/status/641905404646191104#m,DougKass,0.0,0.0,2015-09-10 09:25:00+00:00,1441877100000.0,Now slightly net long,0.0,1.0,3.0
74,641902619468910592,/DougKass/status/641902619468910592#m,DougKass,0.0,0.0,2015-09-10 09:14:00+00:00,1441876440000.0,Yesterday I shorted morning ramp and covered on reversal Now market neutral,1.0,0.0,1.0
75,641769354577739776,/DougKass/status/641769354577739776#m,DougKass,0.0,0.0,2015-09-10 12:25:00+00:00,1441887900000.0,thanks!,0.0,0.0,3.0
