,tweet_id,tweet_url,username,is_retweet,is_pinned,time,ts,text,replies,retweets,likes
0,75593596094517248,/DougKass/status/75593596094517248#m,DougKass,0.0,0.0,2011-05-31 04:04:00+00:00,1306814640000.0,"@mnarayannyc best sector consumer non durables, worst sector industrial materials",0.0,0.0,0.0
1,75567990585831424,/DougKass/status/75567990585831424#m,DougKass,0.0,0.0,2011-05-31 02:23:00+00:00,1306808580000.0,"as i wrote on real money silver today.. gun to my head, another ludicruos forecast - down market on the day.",0.0,1.0,0.0
2,75547021016178688,/DougKass/status/75547021016178688#m,DougKass,0.0,0.0,2011-05-31 12:59:00+00:00,1306846740000.0,on real money... hangover 3 and All Wrong!,0.0,0.0,0.0
3,75358638637711360,/DougKass/status/75358638637711360#m,DougKass,0.0,0.0,2011-05-31 12:31:00+00:00,1306845060000.0,@TweetLeni you are on!,0.0,0.0,0.0
4,75358382965534720,/DougKass/status/75358382965534720#m,DougKass,0.0,0.0,2011-05-31 12:30:00+00:00,1306845000000.0,More from Noah Kass in Daily News today = Prescription Drugs Abuse Use Rising http://nydn.us/jDamA1,0.0,1.0,0.0
