,tweet_id,tweet_url,username,is_retweet,is_pinned,time,ts,text,replies,retweets,likes
82,1268481969769365505,/DougKass/status/1268481969769365505#m,DougKass,0.0,0.0,2020-06-04 09:57:00+00:00,1591264620000.0,"meeting at the White House.”) Shortly thereafter, the D.C. Police sent out an “all-points-bulletin” for Secretary Esper’s missing spine, described as “thin and extremely pliable.” Esper is now on thin ice. When asked if Esper still enjoyed Trump’s confidence, Presidential Press",1.0,0.0,3.0
83,1268481970889203712,/DougKass/status/1268481970889203712#m,DougKass,0.0,0.0,2020-06-04 09:57:00+00:00,1591264620000.0,"Secretary Kayleigh McEnany responded that “as of right now Secretary Esper is still Secretary Esper.” Ouch! That is the presidential equivalent of saying, “we can still be friends” after a breakup. See CNN, “Pentagon chief on shaky ground with White House after breaking with",1.0,1.0,3.0
84,1268481971824574464,/DougKass/status/1268481971824574464#m,DougKass,0.0,0.0,2020-06-04 09:57:00+00:00,1591264620000.0,"Trump over protest response.” In military parlance, the situation in the White House was “SNAFU.” Into this mess strode former Secretary of Defense General James Mattis, who resigned in protest over Trump’s abrupt decision to",1.0,0.0,4.0
85,1268481972814385153,/DougKass/status/1268481972814385153#m,DougKass,0.0,0.0,2020-06-04 09:57:00+00:00,1591264620000.0,"withdraw troops from Syria. After Mattis resigned, he was heavily criticized for failing to express his feelings about Trump. He remedied that situation on Wednesday. Mattis sent a letter to The Atlantic, quoted in full in the article entitled, “James Mattis Denounces President",1.0,1.0,4.0
86,1268481973892329473,/DougKass/status/1268481973892329473#m,DougKass,0.0,0.0,2020-06-04 09:57:00+00:00,1591264620000.0,"Trump, Describes Him as a Threat to the Constitution.” You should read Mattis’ statement, but if you don’t, he said, in part, Never did I dream that troops [would] violate the Constitutional rights of their fellow citizens—much less to provide a bizarre photo op for the elected",1.0,1.0,4.0
87,1268481961028456448,/DougKass/status/1268481961028456448#m,DougKass,0.0,0.0,2020-06-04 09:57:00+00:00,1591264620000.0,"The @realdonaldtrump ""No Apologies"" Tour: The Trump administration’s performance on Wednesday has given new meaning to the word “disarray.” Infighting broke into the open as Trump and military leaders publicly disagreed about whether, when, how, and why the military could be",2.0,3.0,24.0
88,1268481962144137216,/DougKass/status/1268481962144137216#m,DougKass,0.0,0.0,2020-06-04 09:57:00+00:00,1591264620000.0,"used to control protests in the streets. And—only in Trumpworld—First Daughter Ivanka Trump and her $1,500 purse figured prominently in the drama. To review: the attack on peaceful protestors in Lafayette Square by federal officers shocked and unnerved the military establishment.",1.0,1.0,2.0
89,1268481963238797313,/DougKass/status/1268481963238797313#m,DougKass,0.0,0.0,2020-06-04 09:57:00+00:00,1591264620000.0,"In particular, the participation by Secretary Esper and General Milley in the ill-fated photo-op in front of St. John’s Church nearly destroyed the centuries-long reputation of the U.S. military for neutrality in domestic affairs. This next step in the story is pure speculation",1.0,1.0,1.0
90,1268481964262162435,/DougKass/status/1268481964262162435#m,DougKass,0.0,0.0,2020-06-04 09:57:00+00:00,1591264620000.0,"on my part, but I am 100% certain it happened: After the photo-op debacle, the heads of the Army, Navy, Air Force, and Marines told Secretary Esper and General Milley in obscenity-laden phone calls that they would not allow their troops to be used against American citizens.",1.0,0.0,3.0
