,tweet_id,tweet_url,username,is_retweet,is_pinned,time,ts,text,replies,retweets,likes
0,1325224185711439875,/DougKass/status/1325224185711439875#m,DougKass,0.0,0.0,2020-11-07 11:50:00+00:00,1604749800000.0,Who will Biden pick for his Cabinet? Here is my list: Mayor Pete B Veteran Affairs Meg Whitman Commerce Susan Rice State Mike Bloomberg Treasury Michele Flournoy Defense Stacy Abrams Attorney General Alejandro Mayorkas Homeland Security',38.0,3.0,59.0
1,1325224186986573824,/DougKass/status/1325224186986573824#m,DougKass,0.0,0.0,2020-11-07 11:50:00+00:00,1604749800000.0,Michelle Grishalm Health and Human Resources Rahm Emanuel Transportation Elizabeth Randall Energy Tom Udall Interior Heidi Heitkamp Agriculture Julie Su Labor Keisha Bottoms HUD Lily Garcia Education Nelson Cunningham US Trade Rep Jay Inslee EPA Wendy Sherman UN Rep,13.0,0.0,21.0
2,1325224188278398976,/DougKass/status/1325224188278398976#m,DougKass,0.0,0.0,2020-11-07 11:50:00+00:00,1604749800000.0,@jimcramer @tomkeene @business @SquawkCNBC @CNBCFastMoney @riskreversal @carlquintanilla @lizclaman @terranovajoe @guyadami @andrewrsorkin @beckyquick @saraeisen @threadreaderapp unroll,7.0,1.0,6.0
3,1325192728343277569,/DougKass/status/1325192728343277569#m,DougKass,0.0,0.0,2020-11-07 09:45:00+00:00,1604742300000.0,President Biden to announce Covid-19 Task Force on Monday. axios.com/biden-to-announce-…,8.0,0.0,51.0
4,1325142112711696385,/DougKass/status/1325142112711696385#m,DougKass,0.0,0.0,2020-11-07 06:24:00+00:00,1604730240000.0,It is everyone's hope that all the branches of the government move to the middle and compromise. Someway we must work on reducing the deficit and keeping the economy flowing. It is nice to dream and think about a more civil and constructive policy period ahead.,10.0,4.0,93.0
5,1325142113978363905,/DougKass/status/1325142113978363905#m,DougKass,0.0,0.0,2020-11-07 06:24:00+00:00,1604730240000.0,"The sooner the extremities of the right and left are marginalized, the better off we all will be. @morningmika @morning_joe @realdonaldtrump @jimcramer @tomkeene @SquawkCNBC @cnbcfastmoney @ScottWapnerCNBC @andrewrsorkin @carlquintanilla @lizclaman @riskreversal @terranovajoe",3.0,2.0,73.0
6,1325142115186315264,/DougKass/status/1325142115186315264#m,DougKass,0.0,0.0,2020-11-07 06:24:00+00:00,1604730240000.0,@guyadami @michaelsantoli @threadreaderapp unroll,2.0,0.0,5.0
7,1324865388618915840,/DougKass/status/1324865388618915840#m,DougKass,0.0,0.0,2020-11-07 12:04:00+00:00,1604750640000.0,Stephen Colbert from the heart. theguardian.com/culture/2020…,2.0,2.0,30.0
