,tweet_id,tweet_url,username,is_retweet,is_pinned,time,ts,text,replies,retweets,likes
0,1164131965848686592,/DougKass/status/1164131965848686592#m,DougKass,0.0,0.0,2019-08-21 11:07:00+00:00,1566385620000.0,"@donaldtrump The accusation that Jews have dual loyalty is nothing new, but it is a toxic element of white nationalist philosophy.",1.0,0.0,1.0
1,1164117170386874368,/DougKass/status/1164117170386874368#m,DougKass,0.0,0.0,2019-08-21 10:08:00+00:00,1566382080000.0,"And him too. (Why not sell Hawaii to China, Donald?) I am off Twitter for the balance of the week, to, ummmm… maintain balance and enjoy my family and friends.",4.0,0.0,26.0
2,1164116760653651969,/DougKass/status/1164116760653651969#m,DougKass,0.0,0.0,2019-08-21 10:07:00+00:00,1566382020000.0,"Just have to turn off this self possessed ego maniac, Josh.",4.0,0.0,9.0
3,1164115233876656136,/DougKass/status/1164115233876656136#m,DougKass,0.0,0.0,2019-08-21 10:01:00+00:00,1566381660000.0,washingtonpost.com/opinions/… @realdonaldtrump Kudos to the Mooch.,1.0,2.0,11.0
4,1164113363879829506,/DougKass/status/1164113363879829506#m,DougKass,0.0,0.0,2019-08-21 09:53:00+00:00,1566381180000.0,@realdonaldtrump,1.0,0.0,1.0
5,1164113222288498688,/DougKass/status/1164113222288498688#m,DougKass,0.0,0.0,2019-08-21 09:53:00+00:00,1566381180000.0,Trump evoked anti-Semitic tropes against American Jews while trying to prove how pro-Israel he is businessinsider.com/trump-ev…,3.0,1.0,9.0
