,tweet_id,tweet_url,username,is_retweet,is_pinned,time,ts,text,replies,retweets,likes
0,1109883924136775681,/DougKass/status/1109883924136775681#m,DougKass,0.0,0.0,2019-03-24 06:25:00+00:00,1553408700000.0,March Madness!! Iowa-Tennessee in overtime. Iowa comes back from 25 point deficit (21 at halftime).,4.0,0.0,13.0
1,1109855471719116802,/DougKass/status/1109855471719116802#m,DougKass,0.0,0.0,2019-03-24 04:32:00+00:00,1553401920000.0,@realmoney @jimcramer,2.0,2.0,7.0
2,1109854840241438720,/DougKass/status/1109854840241438720#m,DougKass,0.0,0.0,2019-03-24 04:29:00+00:00,1553401740000.0,Real money pro golf and investment conference IV begins Wednesday night!!!,1.0,0.0,6.0
3,1109853164667392000,/DougKass/status/1109853164667392000#m,DougKass,0.0,0.0,2019-03-24 04:23:00+00:00,1553401380000.0,This is a tragedy. nypost.com/2019/03/24/second…,3.0,1.0,5.0
4,1109829996749750273,/DougKass/status/1109829996749750273#m,DougKass,0.0,0.0,2019-03-24 02:51:00+00:00,1553395860000.0,@jimcramer @tomkeene,0.0,0.0,0.0
5,1109816346601230336,/DougKass/status/1109816346601230336#m,DougKass,0.0,0.0,2019-03-24 01:56:00+00:00,1553392560000.0,"@deborahkass (along with artist Chuck Close) was commissioned to do the Democratic National Convention poster in 2016, Here is comparison of Deb's with Warhol's DNC poster for McGovern in 1972, google.com/search?q=deb+kass…",0.0,0.0,1.0
6,1109815705791315968,/DougKass/status/1109815705791315968#m,DougKass,0.0,0.0,2019-03-24 01:54:00+00:00,1553392440000.0,"This afternoon at the High Ridge Country Club in Palm Beach, Fla. I am pleased to have Lisa Dennison, Sotheby's Chairman of the Americas and my sister @deborahkass as participants in our Culture Sundays project. Like Sly Stone sang, this is a family affair!",1.0,1.0,14.0
7,1109815706529525761,/DougKass/status/1109815706529525761#m,DougKass,0.0,0.0,2019-03-24 01:54:00+00:00,1553392440000.0,"Lisa, was formerly Director of The Guggenheim Museum before she joined Sothebys - she is my son's godmother. Deb's work is in many of the major art museums in the U.S. piped.video/watch?v=i3mYv3WH… and her Oy/Yo sculpture has just been placed in front of The Brooklyn Musuem.",2.0,0.0,6.0
8,1109815707326447616,/DougKass/status/1109815707326447616#m,DougKass,0.0,0.0,2019-03-24 01:54:00+00:00,1553392440000.0,This is going to be an amazing event! @jimcramer @tomkeene @SquawkCNBC @CNBCFastMoney,2.0,0.0,6.0
