,tweet_id,tweet_url,username,is_retweet,is_pinned,time,ts,text,replies,retweets,likes
0,1098673853751013376,/DougKass/status/1098673853751013376#m,DougKass,0.0,0.0,2019-02-21 08:00:00+00:00,1550736000000.0,"@realmoney Feb 21, 2019 | 02:46 PM EST DOUG KASS Stated Simply * From my perch, market participants are back wearing rose colored glasses I don't value Wall Street research as much as most. I prefer to do my own research. Today I visited or had telephone conference calls",2.0,0.0,16.0
1,1098673854464081920,/DougKass/status/1098673854464081920#m,DougKass,0.0,0.0,2019-02-21 08:00:00+00:00,1550736000000.0,with four companies in four different industries. This follows meetings with over 10 companies in the last two weeks. I did not like what I heard regarding the implications for domestic economic and corporate profits growth. Many of my concerns about the real economy have,2.0,1.0,4.0
2,1098673855365824512,/DougKass/status/1098673855365824512#m,DougKass,0.0,0.0,2019-02-21 08:00:00+00:00,1550736000000.0,"been underscored in these and other meetings. I believe the ""talking heads"" are wrong about their view of the favorable prospects for the retail, housing and auto markets as well as the outlook for most industrials. I had planned to be more reactionary (than anticipatory)",1.0,1.0,4.0
3,1098673856078860288,/DougKass/status/1098673856078860288#m,DougKass,0.0,0.0,2019-02-21 08:00:00+00:00,1550736000000.0,in raising my short exposure - but I am no longer waiting. The market has had a fantastic rally from the late December low and I am taking advantage of that setup to expand my short exposure today and all week - regardless of price momentum (which may or may not be faltering now),3.0,2.0,6.0
4,1098673856766722049,/DougKass/status/1098673856766722049#m,DougKass,0.0,0.0,2019-02-21 08:00:00+00:00,1550736000000.0,". I frankly don't know why others aren't more concerned that the EU economies are entering recession despite near zero interest rates and, domestically, the Fed is afraid to take fed funds closer to 3% because of their perception of a fragile U.S. economy. With rates so low",4.0,4.0,28.0
5,1098673857999896580,/DougKass/status/1098673857999896580#m,DougKass,0.0,0.0,2019-02-21 08:00:00+00:00,1550736000000.0,"globally, the tools to revive economic growth are not apparent to me. I do not expect a challenge to the low of two months ago but I expect markets to falter again over the next few months.",5.0,6.0,35.0
6,1098673367413084160,/DougKass/status/1098673367413084160#m,DougKass,0.0,0.0,2019-02-21 07:58:00+00:00,1550735880000.0,Welcome back... Dougie piped.video/watch?v=xZzEzDke…,1.0,0.0,8.0
7,1098526997351972864,/DougKass/status/1098526997351972864#m,DougKass,0.0,0.0,2019-02-21 10:17:00+00:00,1550744220000.0,nbcnews.com/news/all/it-s-da…,4.0,1.0,5.0
