,tweet_id,tweet_url,username,is_retweet,is_pinned,time,ts,text,replies,retweets,likes
0,1025853520971485186,/DougKass/status/1025853520971485186#m,DougKass,0.0,0.0,2018-08-04 09:18:00+00:00,1533374280000.0,The filly Atlanta wins the Hambletonian and beats the boys at The Meadowlands! Tough filly!!,0.0,1.0,7.0
1,1025852135706165248,/DougKass/status/1025852135706165248#m,DougKass,0.0,0.0,2018-08-04 09:13:00+00:00,1533373980000.0,Coming up on CBS Sport Network the Hambletonian (inaugurated in 1926) at The Meadowlands!,0.0,0.0,4.0
2,1025849455311028224,/DougKass/status/1025849455311028224#m,DougKass,0.0,0.0,2018-08-04 09:02:00+00:00,1533373320000.0,Congrats to my buddy George Segal for a big win in the Peter Haughton Stake at Meadowlands this afternoon! thebigm.com/results.aspx And also for breeding the winner of the Hambletonian Oaks for fillies!!,1.0,0.0,6.0
3,1025730688107073536,/DougKass/status/1025730688107073536#m,DougKass,0.0,0.0,2018-08-04 01:10:00+00:00,1533345000000.0,I will throw myself into a volcano if Jason is the next bachelor on abc,10.0,0.0,16.0
4,1025721820803158016,/DougKass/status/1025721820803158016#m,DougKass,0.0,0.0,2018-08-04 12:35:00+00:00,1533386100000.0,Berkshire Hathaway businesswire.com/news/home/2…,0.0,2.0,3.0
5,1025557060598071296,/DougKass/status/1025557060598071296#m,DougKass,0.0,0.0,2018-08-04 01:40:00+00:00,1533346800000.0,You miss my entire point. Debt is a liability and is an obligation to repay. The gross $250 BILLION of debt must be reduced by the level of debt that Apple is obligated to eventually repay. You have no clue about basic balance sheet analysis.,13.0,5.0,41.0
