,tweet_id,tweet_url,username,is_retweet,is_pinned,time,ts,text,replies,retweets,likes
0,1289679636125769728,/DougKass/status/1289679636125769728#m,DougKass,0.0,0.0,2020-08-01 09:49:00+00:00,1596275340000.0,"37 on the back nine this morning, I am getting there...",48.0,0.0,206.0
1,1289676703342530562,/DougKass/status/1289676703342530562#m,DougKass,0.0,0.0,2020-08-01 09:37:00+00:00,1596274620000.0,"You are not even a strongman, too weak. You are a heckler of your own government who promotes medical conspiracy theories on Twitter. You play no constructive role in either the management and containment of Covid -19 or in the negotiation of an economic rescue plan in Congress.",12.0,10.0,77.0
2,1289676705456504832,/DougKass/status/1289676705456504832#m,DougKass,0.0,0.0,2020-08-01 09:37:00+00:00,1596274620000.0,"While Congressman John Lewis laid in state and other Presidents paid their respects you were absent. And throughout this, you endlessly complain about the unfairness of it all. @realdonaldtrump @ScottWapnerCNBC @riskreversal @EpsilonTheory @threadreaderapp unroll",10.0,1.0,34.0
3,1289640099387453441,/DougKass/status/1289640099387453441#m,DougKass,0.0,0.0,2020-08-01 07:12:00+00:00,1596265920000.0,Bayesian updating by @realdonaldtrump Wharton graduate! @tomkeene,3.0,0.0,4.0
4,1289517704731402240,/DougKass/status/1289517704731402240#m,DougKass,0.0,0.0,2020-08-01 11:05:00+00:00,1596279900000.0,oh mookie!,3.0,0.0,6.0
