,tweet_id,tweet_url,username,is_retweet,is_pinned,time,ts,text,replies,retweets,likes
0,1294270288172060672,/DougKass/status/1294270288172060672#m,DougKass,0.0,0.0,2020-08-14 01:50:00+00:00,1597369800000.0,"@realmoney Aug 14, 2020 | 08:19 AM EDT DOUG KASS The Top 10 Factors That Could Send Us Into a Sudden Bear Market Over the Next 2 Months * Volatility is likely bottoming, optimism is likely peaking * An imminent five to ten percent market decline is now a heightened possibility",5.0,6.0,27.0
1,1294270289212248064,/DougKass/status/1294270289212248064#m,DougKass,0.0,0.0,2020-08-14 01:50:00+00:00,1597369800000.0,"* The wise man considers the ""ifs' and the contrary - constantly evaluating (and often rallying against) ""group stink"" Enjoy the weekend. The Red Sox are a nightmare, Sir Thomas. Go Yankees. Be safe. @jimcramer @tomkeene @business @FerroTV @SquawkCNBC @cnbcfastmoney",3.0,2.0,20.0
2,1294267684717244417,/DougKass/status/1294267684717244417#m,DougKass,0.0,0.0,2020-08-14 01:40:00+00:00,1597369200000.0,"@realdonaldtrump Cruz on Trump piped.video/watch?v=sNRJJsjG… ""he describes his battle with venereal disease as his own Vietnam"" ""a serial philanderer"" ""yes my dad killed JFL and he is secretly Elvis"" ""this man is a pathological liar, practically every word that comes out of his mouth""",1.0,2.0,18.0
3,1294267686097244160,/DougKass/status/1294267686097244160#m,DougKass,0.0,0.0,2020-08-14 01:40:00+00:00,1597369200000.0,"""he is a narcissist at a level that country has ever seen"" * Lindsay Graham on trump piped.video/watch?v=2bkDykGh… * Ted Cruz on Trump piped.video/watch?v=sNRJJsjG…",1.0,2.0,15.0
4,1294267687238094848,/DougKass/status/1294267687238094848#m,DougKass,0.0,0.0,2020-08-14 01:40:00+00:00,1597369200000.0,piped.video/watch?v=5D-tKJzk… @threadreaderapp unroll,3.0,0.0,7.0
