,tweet_id,tweet_url,username,is_retweet,is_pinned,time,ts,text,replies,retweets,likes
101,1055397663091363840,/DougKass/status/1055397663091363840#m,DougKass,0.0,0.0,2018-10-25 09:56:00+00:00,1540461360000.0,"In order to do that successfully, they have to (1) quantify an asset's intrinsic value and how its likely to change over time and (b) assess how the current market price compares with the asset's intrinsic value, past prices for the asset, the prices of other assets,",1.0,0.0,0.0
102,1055386116080189440,/DougKass/status/1055386116080189440#m,DougKass,0.0,0.0,2018-10-25 09:10:00+00:00,1540458600000.0,"My comment on Twitter was made after the stark revelation of the bomb mailings to Obama, Clinton. It remains my view that @realdonaldtrump may have stoked this by labeling his opponents and the media as ""enemies of the people."" ""Lock them up"" became a recurring theme.",11.0,2.0,20.0
103,1055386117661491201,/DougKass/status/1055386117661491201#m,DougKass,0.0,0.0,2018-10-25 09:10:00+00:00,1540458600000.0,"""Knock the crap out of them... I would like to punch them in their face"" was a familiar refrain at his rallies. As Republican strategist Schmidt said last night: ""His rallies brim with menace... That someone would seek to kill their political enemies is not aberrational",3.0,2.0,4.0
104,1055386118445776896,/DougKass/status/1055386118445776896#m,DougKass,0.0,0.0,2018-10-25 09:10:00+00:00,1540458600000.0,"but rather the inevitable consequence of Trump's incitement."" When pro Trumpers defended the President, they responded that Eric Holder said this in October: “When they go low, we kick them.”",1.0,1.0,3.0
105,1055386119200739328,/DougKass/status/1055386119200739328#m,DougKass,0.0,0.0,2018-10-25 09:10:00+00:00,1540458600000.0,"But this is negative data mining, incomplete and failed to write that Holder quickly added in the same speech: ""When I say we kick them, I don’t mean we do anything inappropriate, we don’t do anything illegal, but we have to be tough and we have to fight.""",2.0,0.0,6.0
106,1055386120291340288,/DougKass/status/1055386120291340288#m,DougKass,0.0,0.0,2018-10-25 09:10:00+00:00,1540458600000.0,This is the end of my conversation/thread on this subject.,5.0,1.0,7.0
107,1055377398429089792,/DougKass/status/1055377398429089792#m,DougKass,0.0,0.0,2018-10-25 08:35:00+00:00,1540456500000.0,"Coming up this morning on @realmoney ""Whither Bank Stocks?"" * I am aggressively using the current weakness in bank stocks to expand my long positions * In a fairly valued market banks represent uncommon value",1.0,4.0,13.0
108,1055377399305719808,/DougKass/status/1055377399305719808#m,DougKass,0.0,0.0,2018-10-25 08:35:00+00:00,1540456500000.0,* Bank stocks are the best long hedge (I know of) as viewed and measured against my economic and market concerns - especially if they are found to be too pessimistic * I anticipate holding on to the stocks for an extended period of time (measured in years and not weeks/months),1.0,4.0,8.0
109,1055377400329093121,/DougKass/status/1055377400329093121#m,DougKass,0.0,0.0,2018-10-25 08:35:00+00:00,1540456500000.0,I substantially upped by bank stock exposure yesterday afternoon. @jimcramer @tomkeene @SaraEisen @SullyCNBC @carlquintanilla @andrewrsorkin @CNBCFastMoney @SquawkCNBC,2.0,0.0,14.0
110,1055368785094414336,/DougKass/status/1055368785094414336#m,DougKass,0.0,0.0,2018-10-25 08:01:00+00:00,1540454460000.0,"From a week ago on @realmoney Stocks and Bonds Were 'Two Wild And Crazy Guys' on Wednesday * Wednesday's stock action was revealing - And, to me, possibly haunting * Too many are drawing a straight line from an oversold market to a resumption of the Bull Market",1.0,0.0,9.0
111,1055368786105249792,/DougKass/status/1055368786105249792#m,DougKass,0.0,0.0,2018-10-25 08:01:00+00:00,1540454460000.0,* The bond vigilantes are likely back... for good * The new regime in volatility will continue piped.video/watch?v=YGv6uo89… @tomkeene @jimcramer,1.0,0.0,7.0
112,1055368125691125760,/DougKass/status/1055368125691125760#m,DougKass,0.0,0.0,2018-10-25 07:59:00+00:00,1540454340000.0,"Yesterday I probably wrote 8k words in my Diary on @realmoney We covered alot of subjects including: ""Toxic Media Chatter (And Why I Nibbled on Longs at the Close)/China Trade Dispute is Reminiscent of the Beginning of the Cold War in 1948/Bob Seger Fest:",3.0,0.0,8.0
113,1055368126492278789,/DougKass/status/1055368126492278789#m,DougKass,0.0,0.0,2018-10-25 07:59:00+00:00,1540454340000.0,"Against the Wind,Night Moves,Still the Same"" Will I be correct in all my invt decisions or in my criticisms? Probably not. But I deliver outside of envelope, second level thinking that recoils from ""Group Stink"" It is intended as contrarian food for thought. @jimcramer @tomkeene",1.0,1.0,24.0
114,1055364983859613697,/DougKass/status/1055364983859613697#m,DougKass,0.0,0.0,2018-10-25 07:46:00+00:00,1540453560000.0,"In the new regime of volatility that I have been looking for - another night of ""Night Moves."" Heightened vol and inconsistent/spastic price action. piped.video/watch?v=CBq_cYsu… @jimcramer @tomkeene Provides opportunities to the swift and emotionless traders. Bad for buy/hold cabal.",2.0,0.0,7.0
