,tweet_id,tweet_url,username,is_retweet,is_pinned,time,ts,text,replies,retweets,likes
0,866420314208694274,/DougKass/status/866420314208694274#m,DougKass,0.0,0.0,2017-05-21 10:27:00+00:00,1495362420000.0,S & p futures +1 in the early going,0.0,3.0,6.0
1,866393479336914944,/DougKass/status/866393479336914944#m,DougKass,0.0,0.0,2017-05-21 08:41:00+00:00,1495356060000.0,Trump speech nytimes.com/2017/05/21/opini…,4.0,0.0,1.0
2,866315273892237312,/DougKass/status/866315273892237312#m,DougKass,0.0,0.0,2017-05-21 03:30:00+00:00,1495337400000.0,"However, the President sounded like the principal solution is a military one - rather than a complex problem generations in the making.",4.0,4.0,15.0
3,866314693618651136,/DougKass/status/866314693618651136#m,DougKass,0.0,0.0,2017-05-21 03:28:00+00:00,1495337280000.0,The President met a low bar and stuck to his script and didnt sound like a guy at the end of the bar.,3.0,3.0,15.0
4,866313940166377472,/DougKass/status/866313940166377472#m,DougKass,0.0,0.0,2017-05-21 03:25:00+00:00,1495337100000.0,"Trump's speech was devoid of solutions to the long, evolving and structural radical Islamic extremism problems in the world.",30.0,4.0,20.0
