,tweet_id,tweet_url,username,is_retweet,is_pinned,time,ts,text,replies,retweets,likes
0,1157400760574971904,/DougKass/status/1157400760574971904#m,DougKass,0.0,0.0,2019-08-02 09:20:00+00:00,1564737600000.0,"No one is addressing the competitive threat to $SQ market share - from Fiserv/First Data - and its impact on co. profitability. As well, Square Capital places credit risk on the company (at a point of time that the credit cycle is maturing). @cnbcfastmoney @riskreversal",1.0,1.0,16.0
1,1157369265089126400,/DougKass/status/1157369265089126400#m,DougKass,0.0,0.0,2019-08-02 07:15:00+00:00,1564730100000.0,Well done.,1.0,0.0,6.0
2,1157347800994209792,/DougKass/status/1157347800994209792#m,DougKass,0.0,0.0,2019-08-02 05:49:00+00:00,1564724940000.0,Stay away from the bottle and do your homework better. I posted on @realmoney that I covered my $DIS short and took it off my Best Ideas List (short).,4.0,2.0,15.0
3,1157315702656774145,/DougKass/status/1157315702656774145#m,DougKass,0.0,0.0,2019-08-02 03:42:00+00:00,1564717320000.0,"If I go dark and come back - that is my perogative. Why do you even care? If that is your only issue, well... In terms of adversarial conflicts I don't do them potently on the forum of Twitter - I use my Diary on @realmoney for that! Enjoy the weekend.",1.0,0.0,7.0
4,1157309946972782593,/DougKass/status/1157309946972782593#m,DougKass,0.0,0.0,2019-08-02 03:19:00+00:00,1564715940000.0,"Opinions are like ass holes, everyone (including me) has one. I didn't see Tom Lee make that statement @blueguy56 If he was balanced, fine. If he was over confident, not so fine. The markets are smarter than all of us.",2.0,0.0,12.0
5,1157307015116578816,/DougKass/status/1157307015116578816#m,DougKass,0.0,0.0,2019-08-02 03:07:00+00:00,1564715220000.0,A big shout out and wishes of good luck to my buddy George Segal who owns Synergy and Don't Let Em in the Peter Haughton Memorial and in the Hambletonian tomorrow at the Meadowlands. northjersey.com/story/sports…,0.0,0.0,1.0
6,1157300275163684868,/DougKass/status/1157300275163684868#m,DougKass,0.0,0.0,2019-08-02 02:41:00+00:00,1564713660000.0,"Where are the self confident bulls in $GS, $SQ and all the others - who had a ""feel"" or saw ""unusual."" It just pisses me off that few in the investment business own up to their investment boners. I have them all the time - and document/admit them. Enjoy the weekend, outta here...",17.0,1.0,77.0
7,1157299352332898306,/DougKass/status/1157299352332898306#m,DougKass,0.0,0.0,2019-08-02 02:37:00+00:00,1564713420000.0,"Do you think Leon Black and others actually sought tax advice from Epstein? Jesus, they pay Sherman Sterling $1k an hour for that - and they probably know a lot more than a drop out from Cooper Union. @davidfaber @VickyPJWard",1.0,1.0,13.0
8,1157288817709277184,/DougKass/status/1157288817709277184#m,DougKass,0.0,0.0,2019-08-02 01:55:00+00:00,1564710900000.0,I get a lot of criticism for being a perma bear. However I have 18 long ideas on my @realmoney Best Ideas List and only 8 short ideas. Case in point - I initiated a long in $DDS yesterday at $67.10. realmoney.thestreet.com/doug… The shares are +$2.50 today. @jimcramer @tomkeene,9.0,0.0,23.0
9,1157287123541811200,/DougKass/status/1157287123541811200#m,DougKass,0.0,0.0,2019-08-02 01:48:00+00:00,1564710480000.0,"$SQ is another vivid example that ""unusual"" call activity is not a predictive independent variable. Nor is it a particularly valuable strategy - taken in isolation. @tomkeene",2.0,0.0,13.0
10,1157283581355528194,/DougKass/status/1157283581355528194#m,DougKass,0.0,0.0,2019-08-02 01:34:00+00:00,1564709640000.0,@carlquintanilla Q see my email on $SQ @jimcramer @realmoney post,0.0,0.0,1.0
11,1157280869507358720,/DougKass/status/1157280869507358720#m,DougKass,0.0,0.0,2019-08-02 01:23:00+00:00,1564708980000.0,That is not new news. He said that yesterday.,9.0,0.0,26.0
12,1157280678171553795,/DougKass/status/1157280678171553795#m,DougKass,0.0,0.0,2019-08-02 01:23:00+00:00,1564708980000.0,I thought the formulation of your approach was based on a combination of fundamentals and technicians - not on the input of others (I rarely if ever see reference of others in your commentary). But I guess I was mistaken.,3.0,0.0,1.0
13,1157273969785004033,/DougKass/status/1157273969785004033#m,DougKass,0.0,0.0,2019-08-02 12:56:00+00:00,1564750560000.0,"Respectfully, I view my job differently. My job is to analyze markets, sectors and companies based on my methodology developed over four decades. I certainly don't make the judgment whether others' views are based on objective considerations at all. Frankly, I could care less!",1.0,0.0,14.0
14,1157272455968382977,/DougKass/status/1157272455968382977#m,DougKass,0.0,0.0,2019-08-02 12:50:00+00:00,1564750200000.0,"My political views are my own business as are yours. My navigation of the market is a function of my assessment of intrinsic value which is based on fundamentals, valuations, interest rates, inflation rates, market positioning/sentiment etc. - as weighed against current",1.0,2.0,13.0
15,1157272460024274950,/DougKass/status/1157272460024274950#m,DougKass,0.0,0.0,2019-08-02 12:50:00+00:00,1564750200000.0,share prices. If value is below share price (depending on degree) I consider buying and vis a versa.,2.0,0.0,8.0
16,1157269855990669312,/DougKass/status/1157269855990669312#m,DougKass,0.0,0.0,2019-08-02 12:40:00+00:00,1564749600000.0,From yesterday's @realmoney opener The Markets Are Uniquely Vulnerable Now realmoney.thestreet.com/doug… @jimcramer @tomkeene @SquawkCNBC,0.0,0.0,4.0
17,1157265103617712129,/DougKass/status/1157265103617712129#m,DougKass,0.0,0.0,2019-08-02 12:21:00+00:00,1564748460000.0,And why is Bannon a bonafide and credible source on bitcoin? Almost as dumb as Novagratz who lost nearly $300 million speculating in the asset class in 2018.,1.0,0.0,20.0
18,1157264681255493634,/DougKass/status/1157264681255493634#m,DougKass,0.0,0.0,2019-08-02 12:19:00+00:00,1564748340000.0,Watching the acceptance and normalization of Trump's behavior and Bannon's views is disturbing on @SquawkCNBC That is part of my opener on @realmoney - history will not treat this period kindly. @andrewrsorkin @BeckyQuick,2.0,2.0,27.0
19,1157260638617575425,/DougKass/status/1157260638617575425#m,DougKass,0.0,0.0,2019-08-02 12:03:00+00:00,1564747380000.0,"You are off the rails, again. You are a ten year old. Unfortunately you are also our President.",8.0,1.0,33.0
20,1157255588696535041,/DougKass/status/1157255588696535041#m,DougKass,0.0,0.0,2019-08-02 11:43:00+00:00,1564746180000.0,"A snippet from my @realmoney opener this morning: * Mean regression may lie ahead * And when it does, look out below as it will be a bitch! Back in 2006-07 I vividly remember my building concerns about the housing market and the slicing and dicing of derivative instruments",4.0,3.0,21.0
21,1157255591187890176,/DougKass/status/1157255591187890176#m,DougKass,0.0,0.0,2019-08-02 11:43:00+00:00,1564746180000.0,(investors were in a search of yield) that was exported to financial institutions' portfolios around the world. Those concerns were outside of consensus - and I appeared weekly (sometimes three times a week) on The Kudlow Report to debate the bullish cabal who were as self confid,1.0,0.0,2.0
22,1157255593192755202,/DougKass/status/1157255593192755202#m,DougKass,0.0,0.0,2019-08-02 11:43:00+00:00,1564746180000.0,"ent in view as they are today. By 2009 the world's banking system was virtually bankrupted - yet 2-3 years earlier concerns existed in only a handful of minds (The Big Short Group, Ritholtz, Roubini, Shilling and, of course, myself).",1.0,0.0,4.0
23,1157255595289972738,/DougKass/status/1157255595289972738#m,DougKass,0.0,0.0,2019-08-02 11:43:00+00:00,1564746180000.0,"Abnormal and aberrant behavior, not relying on history's lessons, unbridled fiscal and monetary policy, the disproportionate role of machines and algos on our markets, hastily crafted (lacking depth) and random communication of policies *by tweets) and conditions (like $13",1.0,0.0,3.0
24,1157255597357699072,/DougKass/status/1157255597357699072#m,DougKass,0.0,0.0,2019-08-02 11:43:00+00:00,1564746180000.0,"trillion of negative interest rates) have been normalized. Like a decade or more ago, strange stuff is happening so fast we are not even questioning their very existence and, in the case of interest rates (for example), why this is not likely a permanent condition.",1.0,0.0,3.0
25,1157255599907885060,/DougKass/status/1157255599907885060#m,DougKass,0.0,0.0,2019-08-02 11:43:00+00:00,1564746180000.0,"But when the history books are written and markets ""normalize"" we will likely shake our heads in looking at the current landscape - and ask ourselves, what were we and the markets thinking? For example, this weekend ask yourself (and conduct second-level thinking) why these",1.0,0.0,7.0
26,1157255601677832192,/DougKass/status/1157255601677832192#m,DougKass,0.0,0.0,2019-08-02 11:43:00+00:00,1564746180000.0,"conditions (below) exist and what is the message of the world's fixed income markets? …. I didnt' know the timing of the adverse consequences from what I saw in the housing markets thirteen or fourteen years ago but I knew that it was coming (relatively soon) and when it did,",1.0,0.0,5.0
27,1157255603544367105,/DougKass/status/1157255603544367105#m,DougKass,0.0,0.0,2019-08-02 11:43:00+00:00,1564746180000.0,the economic and financial consequences would be devastating. These non-consensus concerns that I possessed and articulated (in 2006-07) proved to be bountiful and rewarding. I feel the same today. @Sarge986 @jimcramer @tomkeene @SquawkCNBC @cnbcfastmoney @lizclaman,1.0,0.0,9.0
28,1157255606354493441,/DougKass/status/1157255606354493441#m,DougKass,0.0,0.0,2019-08-02 11:43:00+00:00,1564746180000.0,@riskreversal @guyadami @terranovajoe,0.0,0.0,4.0
29,1157240867868069890,/DougKass/status/1157240867868069890#m,DougKass,0.0,0.0,2019-08-02 10:44:00+00:00,1564742640000.0,This morning on @realmoney * Kill The Quants Before They Kill Our Markets! * Attention Dow Theory Shoppers * Emily Litella -Never Mind! (large revisions to non financial company profits should be heeded) piped.video/watch?v=OjYoNL4g…,1.0,0.0,7.0
30,1157240869860388864,/DougKass/status/1157240869860388864#m,DougKass,0.0,0.0,2019-08-02 10:44:00+00:00,1564742640000.0,@jimcramer @tomkeene @SquawkCNBC @beckyquick @CNBCFastMoney @lizclaman @Sarge986 @riskreversal @guyadami @terranovajoe,1.0,0.0,3.0
