,tweet_id,tweet_url,username,is_retweet,is_pinned,time,ts,text,replies,retweets,likes
89,1234847697317826560,/DougKass/status/1234847697317826560#m,DougKass,0.0,0.0,2020-03-03 02:26:00+00:00,1583202360000.0,"Alot of coronavirus fear but few mentioning things like - some solace in the fact that Singapore and Hong Kong, two warm weather climates right now (Singapore always at 85 degrees and humid) have been stuck at only 100 people infected for weeks now. @jimcramer @tomkeene",8.0,7.0,46.0
90,1234841305995452419,/DougKass/status/1234841305995452419#m,DougKass,0.0,0.0,2020-03-03 02:01:00+00:00,1583200860000.0,?,1.0,1.0,7.0
91,1234840303141621764,/DougKass/status/1234840303141621764#m,DougKass,0.0,0.0,2020-03-03 01:57:00+00:00,1583200620000.0,Getting Technical To me technicals help in volatile times. 3050 was the 200 day moving average in S&P futures. So we pushed thru and then pulled back and tested it this morning in premarket trading. Thus far we have held it - which is constructive (thus far). $SPY @realmoney,5.0,6.0,27.0
92,1234837575359238149,/DougKass/status/1234837575359238149#m,DougKass,0.0,0.0,2020-03-03 01:46:00+00:00,1583199960000.0,"@revshark I guess the technical screwup that prohibited Robin Hood accounts to trade yesterday suggests that trading was not ""free."" To many it was costly on Monday.",0.0,0.0,3.0
93,1234836617858342912,/DougKass/status/1234836617858342912#m,DougKass,0.0,0.0,2020-03-03 01:42:00+00:00,1583199720000.0,"Wow, someone on @cnbc just said ""I dont know."" One of the only other persons I have heard spout those three words is my pal @guyadami on @CNBCFastMoney Most others confidently answer questions on nearly any market (or other) subject...",2.0,1.0,33.0
94,1234836245475360768,/DougKass/status/1234836245475360768#m,DougKass,0.0,0.0,2020-03-03 01:41:00+00:00,1583199660000.0,"It is so much easier just to be a dumb ass, uniformed and attacking troll on twitter. But that approach is neither value added, productive nor does it deliver a stream of investing profits....",0.0,0.0,12.0
95,1234835859758886914,/DougKass/status/1234835859758886914#m,DougKass,0.0,0.0,2020-03-03 01:39:00+00:00,1583199540000.0,What is hard and sometimes distracting in periods of intense volatility is writing 5k+ words a day on @realmoney and trading/investing. (and occassionally tweeting!) The last week has been brutal in terms of multitasking to be honest.,1.0,0.0,12.0
96,1234834220364763138,/DougKass/status/1234834220364763138#m,DougKass,0.0,0.0,2020-03-03 01:33:00+00:00,1583199180000.0,"Don't trade on ""bets"" Richie. Have a program, an approach and discipline. Gut feels are for chumps. Respectfully.",1.0,0.0,7.0
97,1234832202778783749,/DougKass/status/1234832202778783749#m,DougKass,0.0,0.0,2020-03-03 01:25:00+00:00,1583198700000.0,@tomkeene @Qjimcramer,0.0,0.0,0.0
98,1234832024218853376,/DougKass/status/1234832024218853376#m,DougKass,0.0,0.0,2020-03-03 01:24:00+00:00,1583198640000.0,"One person's TDS (Trump Derangement Syndrome) is another person's TAS (Trump Acceptance Syndrome), Smitty.",1.0,0.0,6.0
99,1234831777841188864,/DougKass/status/1234831777841188864#m,DougKass,0.0,0.0,2020-03-03 01:23:00+00:00,1583198580000.0,Rev What are you long and at what prices?,2.0,0.0,3.0
100,1234830590698016769,/DougKass/status/1234830590698016769#m,DougKass,0.0,0.0,2020-03-03 01:18:00+00:00,1583198280000.0,"@revshark Yesterday you suggested that we have to gauge psychology and not charts now. What is the psychology - what specific input are you looking at? Do you mean positioning, fear/greed index or investor surveys?",0.0,0.0,2.0
101,1234829567157833728,/DougKass/status/1234829567157833728#m,DougKass,0.0,0.0,2020-03-03 01:14:00+00:00,1583198040000.0,"Group Stink? So, consensus was not to be long over last weekend. The S&P futures rallied 100 handles from 345-415 on Fri afternoon and another 125 handles yesterday. So consensus was wrong. Consensus now appears that we need another retest. Will consensus be wrong again?",16.0,3.0,42.0
102,1234829034770530312,/DougKass/status/1234829034770530312#m,DougKass,0.0,0.0,2020-03-03 01:12:00+00:00,1583197920000.0,"Amen, Bretsky.",1.0,0.0,6.0
103,1234828868667789312,/DougKass/status/1234828868667789312#m,DougKass,0.0,0.0,2020-03-03 01:11:00+00:00,1583197860000.0,"Frankly and respectfully DM, I would rather hear from people I disagree with rather than peeps I agree with!",2.0,0.0,6.0
104,1234828324637204480,/DougKass/status/1234828324637204480#m,DougKass,0.0,0.0,2020-03-03 01:09:00+00:00,1583197740000.0,"Disagree. I don't get why peeps are distracted or despise political tweets. Everyone should be able to respectfully express their own views on any subject (entertainment, sports, politics, food, markets, etc.) Its Twitter - an open forum. If you dislike what read, unfollow!",3.0,0.0,15.0
105,1234825759761555456,/DougKass/status/1234825759761555456#m,DougKass,0.0,0.0,2020-03-03 12:59:00+00:00,1583240340000.0,"G7 members don't possess the ammunition that central bankers do. They talk a lot, @revshark!",1.0,0.0,12.0
106,1234820472929423360,/DougKass/status/1234820472929423360#m,DougKass,0.0,0.0,2020-03-03 12:38:00+00:00,1583239080000.0,"Investors are almost always uncertain and the investment coast is never clear. You can be paralyzed by uncertainty (by doing nothing) - but that is not opportunistic, particularly in a new regime of heightened volatility. To me, the key is to have a dispassionate",2.0,2.0,10.0
107,1234820473982156801,/DougKass/status/1234820473982156801#m,DougKass,0.0,0.0,2020-03-03 12:38:00+00:00,1583239080000.0,approach (whether technical or fundamental) and unemotionally in order to respond effectively to those opportunities... @realmoney,2.0,1.0,8.0
108,1234817903733694464,/DougKass/status/1234817903733694464#m,DougKass,0.0,0.0,2020-03-03 12:28:00+00:00,1583238480000.0,"Thanks I will keep it up As I tweeted, I am at the polar opposite of his political views as I am with a number of close friends I don't find him annoying, I find his investment wisdom to be world class. He brings a different viewpoint/methodology that is foreign but valued to me.",2.0,0.0,13.0
109,1234809820101955587,/DougKass/status/1234809820101955587#m,DougKass,0.0,0.0,2020-03-03 11:56:00+00:00,1583236560000.0,"Cant he just let his guests talk, Chuck? They have the expertise. What is the point of having guests?",4.0,0.0,18.0
110,1234800378149003264,/DougKass/status/1234800378149003264#m,DougKass,0.0,0.0,2020-03-03 11:18:00+00:00,1583234280000.0,"It was an epic ""Curb Your Enthusiasm"" on Sunday night... nypost.com/2020/03/02/larry-… Larry David gets his revenge against the NY Jets! @jimcramer @tomkeene",0.0,1.0,8.0
111,1234798534345576448,/DougKass/status/1234798534345576448#m,DougKass,0.0,0.0,2020-03-03 11:11:00+00:00,1583233860000.0,"The scary thing is not only does he think @realdonaldtrump is watching him give advice - but that he is probably correct, Chuck.",0.0,2.0,4.0
112,1234794927625834499,/DougKass/status/1234794927625834499#m,DougKass,0.0,0.0,2020-03-03 10:57:00+00:00,1583233020000.0,On @realmoney we made $C our Trade of the Week (for this week) near the close on Friday - the shares rose by over +$4 yesterday to $67.50. @jimcramer @tomkeene @SquawkCNBC @cnbcfastmoney realmoney.thestreet.com/doug… I bought more $C and $BAC on Monday. Also $SPY ++,1.0,1.0,7.0
113,1234793635369095168,/DougKass/status/1234793635369095168#m,DougKass,0.0,0.0,2020-03-03 10:51:00+00:00,1583232660000.0,"This morning on @realmoney ""The Other Side of the Moon"" (and why I got very bullish over the last two trading sessions) Markets are like a rose. How long it lasts, no one knows for sure. Yesterday, in swift pace, we retraced nearly 50% of the decline in the S&P Index from mid-",2.0,2.0,11.0
114,1234793636052787201,/DougKass/status/1234793636052787201#m,DougKass,0.0,0.0,2020-03-03 10:51:00+00:00,1583232660000.0,"February. (This has taken the market (with S&P at 3090) back to levels that incorporate roughly an equal amount of reward v. risk - based on an expected S&P trading range of between 2850-3300) Though thorns and roses grow on the same tree, should the markets continue to rally",1.0,1.0,5.0
115,1234793636837109761,/DougKass/status/1234793636837109761#m,DougKass,0.0,0.0,2020-03-03 10:51:00+00:00,1583232660000.0,over the near term we could really get rolling. @jimcramer @tomkeene @SquawkCNBC @cnbcfastmoney @lizclaman @carlquintanilla @michaelsantoli @SullyCNBC @thedomino @riskreversal @guyadami @terranovajoe @msnbc @andrewrsorkin @beckyquick @saraeisen @davidfaber,0.0,1.0,6.0
116,1234667718130880512,/DougKass/status/1234667718130880512#m,DougKass,0.0,0.0,2020-03-03 02:31:00+00:00,1583202660000.0,This freaking amazing,11.0,4.0,44.0
117,1234665154479968261,/DougKass/status/1234665154479968261#m,DougKass,0.0,0.0,2020-03-03 02:21:00+00:00,1583202060000.0,I am not watching the futures tonight.... here you go!,4.0,0.0,5.0
118,1234644001120292864,/DougKass/status/1234644001120292864#m,DougKass,0.0,0.0,2020-03-03 12:57:00+00:00,1583240220000.0,S&p futures +25 @realmoney 50oercent retracemwnt if decline - go thru and it gets interesting... @jimcramer @tomkeene @SquawkCNBC @CNBCFastMoney,4.0,3.0,21.0
