,tweet_id,tweet_url,username,is_retweet,is_pinned,time,ts,text,replies,retweets,likes
0,651523630388613120,/DougKass/status/651523630388613120#m,DougKass,0.0,0.0,2015-10-06 10:25:00+00:00,1444127100000.0,"Anna Pump, legendary owner of Loaves and Fishes, in Bridgehampton Long Island killed in a car accident.",1.0,0.0,0.0
1,651519357701484549,/DougKass/status/651519357701484549#m,DougKass,0.0,0.0,2015-10-06 10:08:00+00:00,1444126080000.0,"I beleive $BAC is an outstanding multi year long. A portfolio has different horses, different objectives",2.0,1.0,2.0
2,651519110464016384,/DougKass/status/651519110464016384#m,DougKass,0.0,0.0,2015-10-06 10:07:00+00:00,1444126020000.0,Against closed end muni bond fund holdings. Take out rate risk and assuming ratio of Munis to Treasuries improves,0.0,0.0,2.0
3,651514377145856002,/DougKass/status/651514377145856002#m,DougKass,0.0,0.0,2015-10-06 09:48:00+00:00,1444124880000.0,Danny Be the ball.,0.0,0.0,2.0
4,651514288155303937,/DougKass/status/651514288155303937#m,DougKass,0.0,0.0,2015-10-06 09:48:00+00:00,1444124880000.0,Yes. I run a longshrt book.,2.0,0.0,1.0
5,651512380585848836,/DougKass/status/651512380585848836#m,DougKass,0.0,0.0,2015-10-06 09:40:00+00:00,1444124400000.0,$SPY -$2 from its intraday high.,3.0,1.0,4.0
6,651509868772392964,/DougKass/status/651509868772392964#m,DougKass,0.0,0.0,2015-10-06 09:30:00+00:00,1444123800000.0,In last two days sold $MS $GS $F $OAK and some other longs. And added to my $SPY short. See RealMoneyPro for rationale.,4.0,2.0,6.0
7,651506744196222977,/DougKass/status/651506744196222977#m,DougKass,0.0,0.0,2015-10-06 09:18:00+00:00,1444123080000.0,Thanks JL. At times I wish I wasnt a short seller,2.0,0.0,6.0
8,651493943427907585,/DougKass/status/651493943427907585#m,DougKass,0.0,0.0,2015-10-06 08:27:00+00:00,1444120020000.0,$YUM is an absolute disaster. Heads will roll. Activists? Bueller? Activists? Bueller?,9.0,4.0,7.0
9,651491569728651264,/DougKass/status/651491569728651264#m,DougKass,0.0,0.0,2015-10-06 08:17:00+00:00,1444119420000.0,My associate gave me the line. He probably stole it!,0.0,0.0,2.0
10,651491224902352896,/DougKass/status/651491224902352896#m,DougKass,0.0,0.0,2015-10-06 08:16:00+00:00,1444119360000.0,Not so yummy. $YUM cuts forecast.,2.0,2.0,8.0
11,651491025639313408,/DougKass/status/651491025639313408#m,DougKass,0.0,0.0,2015-10-06 08:15:00+00:00,1444119300000.0,"@zerohedge But, But... $ADBE's chart looked fab! finance.yahoo.com/echarts?s=…{""lineWidth"":""2"",""allowChartStacking"":true}",0.0,0.0,0.0
12,651490988968529920,/DougKass/status/651490988968529920#m,DougKass,0.0,0.0,2015-10-06 08:15:00+00:00,1444119300000.0,"But, But... $ADBE's chart looked fab! finance.yahoo.com/echarts?s=…{""lineWidth"":""2"",""allowChartStacking"":true}",4.0,1.0,0.0
13,651489038835302401,/DougKass/status/651489038835302401#m,DougKass,0.0,0.0,2015-10-06 08:07:00+00:00,1444118820000.0,@zerohedge $ADBE opps - the hits keep coming.. even photoshoping $ADBE's results wont make it look better,1.0,1.0,1.0
14,651489012792864768,/DougKass/status/651489012792864768#m,DougKass,0.0,0.0,2015-10-06 08:07:00+00:00,1444118820000.0,$ADBE opps - the hits keep coming.. even photoshoping $ADBE's results wont make it look better,0.0,3.0,7.0
15,651455625738723329,/DougKass/status/651455625738723329#m,DougKass,0.0,0.0,2015-10-06 05:54:00+00:00,1444110840000.0,Peak (Jay) Leno?,0.0,0.0,2.0
16,651453321111318528,/DougKass/status/651453321111318528#m,DougKass,0.0,0.0,2015-10-06 05:45:00+00:00,1444110300000.0,"Coming up on RMPRO - the completion of George Lindsay's ""Three Peaks and a Domed House."" With a hat tip to The Stock Almanac's Jeff Hirsch.",4.0,1.0,1.0
17,651438064301142017,/DougKass/status/651438064301142017#m,DougKass,0.0,0.0,2015-10-06 04:45:00+00:00,1444106700000.0,Whats your market view these days sir justin?,1.0,0.0,0.0
18,651436633225609216,/DougKass/status/651436633225609216#m,DougKass,0.0,0.0,2015-10-06 04:39:00+00:00,1444106340000.0,"Memo to Cochran on Fast $ Halftime - ""Everything is great"" Look at junk bond spreads recently?",1.0,1.0,2.0
19,651436327838318592,/DougKass/status/651436327838318592#m,DougKass,0.0,0.0,2015-10-06 04:38:00+00:00,1444106280000.0,Ralph? Oh never mind. piped.video/watch?v=V3FnpaWQ…,0.0,1.0,2.0
20,651435869581279232,/DougKass/status/651435869581279232#m,DougKass,0.0,0.0,2015-10-06 04:36:00+00:00,1444106160000.0,"Someone should make point to the ""talking heads"" in the business media why it is negative when market leading groups (biotech) lead lower.",4.0,1.0,3.0
21,651434704877551616,/DougKass/status/651434704877551616#m,DougKass,0.0,0.0,2015-10-06 04:31:00+00:00,1444105860000.0,"buying higher works in a bull market, but can be dangerous to your investment health if you're in a neutral or bear market.",4.0,4.0,12.0
22,651434682664525824,/DougKass/status/651434682664525824#m,DougKass,0.0,0.0,2015-10-06 04:31:00+00:00,1444105860000.0,I want to emphasize one very important point that I made in my diary yesterday --,0.0,0.0,2.0
23,651428799444295680,/DougKass/status/651428799444295680#m,DougKass,0.0,0.0,2015-10-06 04:08:00+00:00,1444104480000.0,"Divine, I am sitting next to my associate and I said $10 bet that Helene objects!! Thanks Divine, wanna split it?",2.0,0.0,0.0
24,651428460435476480,/DougKass/status/651428460435476480#m,DougKass,0.0,0.0,2015-10-06 04:07:00+00:00,1444104420000.0,"Almost every single technician I know thinks Friday/Monday was a seminal change in the market's direction. Grandma Koufax, ""Rotzaruck.""",7.0,1.0,5.0
25,651428080704163840,/DougKass/status/651428080704163840#m,DougKass,0.0,0.0,2015-10-06 04:05:00+00:00,1444104300000.0,I believe that was in early September!,1.0,0.0,1.0
26,651421135368794112,/DougKass/status/651421135368794112#m,DougKass,0.0,0.0,2015-10-06 03:37:00+00:00,1444102620000.0,Buying higher works in a bull market but can be dangerous to your investment well being if it is a neutral or bear market.,1.0,1.0,7.0
27,651421108927918080,/DougKass/status/651421108927918080#m,DougKass,0.0,0.0,2015-10-06 03:37:00+00:00,1444102620000.0,"i want to emphasize one important point I made on RealMoneyPro yesterday.,,",1.0,0.0,2.0
28,651403462626942977,/DougKass/status/651403462626942977#m,DougKass,0.0,0.0,2015-10-06 02:27:00+00:00,1444098420000.0,I am keyed on $TLT to time the short term move in market. A higher bond market = risk off. That helps to explain $1 fall in $SPY as bonds +,3.0,2.0,3.0
29,651391116017799169,/DougKass/status/651391116017799169#m,DougKass,0.0,0.0,2015-10-06 01:38:00+00:00,1444095480000.0,"On RealMoneyPro: 3 More Peaks Trump (polls), Icahn and Buffett. (The later two from a high peak, Mt. Everest!)",1.0,0.0,1.0
30,651389654193827841,/DougKass/status/651389654193827841#m,DougKass,0.0,0.0,2015-10-06 01:32:00+00:00,1444095120000.0,Stopped out of $DD for $0.90 losss.,2.0,0.0,1.0
31,651386884933988352,/DougKass/status/651386884933988352#m,DougKass,0.0,0.0,2015-10-06 01:21:00+00:00,1444094460000.0,"Coming up on RealMoneyPro: Three More ""Peaks""",0.0,0.0,1.0
32,651378877860827136,/DougKass/status/651378877860827136#m,DougKass,0.0,0.0,2015-10-06 12:50:00+00:00,1444135800000.0,"Yesterday on RMPRO Sold out of $GS $MS $AMPL and $SUNE (all for profits, from last week, except SUNE a small loss)",2.0,2.0,4.0
33,651370844036407297,/DougKass/status/651370844036407297#m,DougKass,0.0,0.0,2015-10-06 12:18:00+00:00,1444133880000.0,Fun to watch - not market related. businessinsider.com/australi…,2.0,7.0,7.0
34,651368914337800192,/DougKass/status/651368914337800192#m,DougKass,0.0,0.0,2015-10-06 12:10:00+00:00,1444133400000.0,Art imitates life. thebigshortmovie.com,0.0,0.0,4.0
35,651365192958353408,/DougKass/status/651365192958353408#m,DougKass,0.0,0.0,2015-10-06 11:55:00+00:00,1444132500000.0,really?,3.0,0.0,2.0
36,651357813009186817,/DougKass/status/651357813009186817#m,DougKass,0.0,0.0,2015-10-06 11:26:00+00:00,1444130760000.0,$OAK timeframe is apparently different than yours! They are closer to Buffett than the faster money crowd.,2.0,0.0,2.0
37,651357523212169217,/DougKass/status/651357523212169217#m,DougKass,0.0,0.0,2015-10-06 11:25:00+00:00,1444130700000.0,Bloomberg's Stephanie Ruhle is bringing candid and thoughtful and even amusing responses to H Marks this AM.,0.0,0.0,0.0
38,651356671172866048,/DougKass/status/651356671172866048#m,DougKass,0.0,0.0,2015-10-06 11:21:00+00:00,1444130460000.0,"Howard Mark's latest memo from Oaktree - ""Its not easy"""" oaktreecapital.com/memo.aspx",0.0,5.0,8.0
39,651356175112503297,/DougKass/status/651356175112503297#m,DougKass,0.0,0.0,2015-10-06 11:19:00+00:00,1444130340000.0,"$OAK was +$2 yesterday. ""Illiquidity is good for investors and bad for traders.""",1.0,1.0,3.0
40,651355991813025792,/DougKass/status/651355991813025792#m,DougKass,0.0,0.0,2015-10-06 11:19:00+00:00,1444130340000.0,Another great interview on Bloomberg with my personal idol Oaktree's Howard Marks - talking liquidity. amazon.com/Most-Important-Th…,0.0,4.0,6.0
41,651354274723721216,/DougKass/status/651354274723721216#m,DougKass,0.0,0.0,2015-10-06 11:12:00+00:00,1444129920000.0,"On CNBC, ""The Starwood Indicator"" has turned more negative. A new layer of uncertainty.",1.0,1.0,2.0
42,651352443528327168,/DougKass/status/651352443528327168#m,DougKass,0.0,0.0,2015-10-06 11:04:00+00:00,1444129440000.0,$DD Kullman thwarted Peltz - but not the poor demand/supply situation in ag chemicals.,0.0,0.0,3.0
43,651351725216014336,/DougKass/status/651351725216014336#m,DougKass,0.0,0.0,2015-10-06 11:02:00+00:00,1444129320000.0,Now this is good.,0.0,2.0,5.0
44,651351657947746304,/DougKass/status/651351657947746304#m,DougKass,0.0,0.0,2015-10-06 11:01:00+00:00,1444129260000.0,"Breaking News. Cousin Sandy Koufax to return (like Boca Biff) and will pitch for NY Yankees today. Signed, Desparate",3.0,2.0,4.0
45,651349764940939265,/DougKass/status/651349764940939265#m,DougKass,0.0,0.0,2015-10-06 10:54:00+00:00,1444128840000.0,Divine Ms M (Helene Meisler) says 90% up day on nyse but not on nasdaq,2.0,1.0,0.0
46,651347082989715456,/DougKass/status/651347082989715456#m,DougKass,0.0,0.0,2015-10-06 10:43:00+00:00,1444128180000.0,Volkswagen cancels all non essential investments.,1.0,5.0,2.0
47,651345293678628864,/DougKass/status/651345293678628864#m,DougKass,0.0,0.0,2015-10-06 10:36:00+00:00,1444127760000.0,Short term-ism is deterring long term investment. Michael Spence/Bloomberg,0.0,0.0,3.0
48,651344726168326144,/DougKass/status/651344726168326144#m,DougKass,0.0,0.0,2015-10-06 10:34:00+00:00,1444127640000.0,On Bloomberg - Mike Spence: Where is monetary policy taking us? Too far...wont generate demand and stimulate investment.,1.0,0.0,3.0
49,651344310613446656,/DougKass/status/651344310613446656#m,DougKass,0.0,0.0,2015-10-06 10:32:00+00:00,1444127520000.0,"Yes, good point. But to me, and i am in minority - it signals structural growth weakness.",5.0,0.0,0.0
50,651343573049339904,/DougKass/status/651343573049339904#m,DougKass,0.0,0.0,2015-10-06 10:29:00+00:00,1444127340000.0,"I hadnt looked, I will ask my ""TA"" guru - the Divine Ms M (Helene Meisler)!",0.0,0.0,0.0
51,651343143066017792,/DougKass/status/651343143066017792#m,DougKass,0.0,0.0,2015-10-06 10:28:00+00:00,1444127280000.0,"How do you really feel, Reddy?",2.0,0.0,0.0
52,651342849057890304,/DougKass/status/651342849057890304#m,DougKass,0.0,0.0,2015-10-06 10:26:00+00:00,1444127160000.0,"@jimcramer Up on Real $ a thoughtful analysis on markets from Jim ""El Capitan"" Cramer: ""Here's What Is Underpinning These Market Reversals""",0.0,0.0,0.0
53,651342698163642368,/DougKass/status/651342698163642368#m,DougKass,0.0,0.0,2015-10-06 10:26:00+00:00,1444127160000.0,"Up on Real Money a very thoughtful analysis on markets from Jim ""El Capitan"" Cramer: ""Here's What Is Underpinning These Market Reversals""",0.0,0.0,0.0
54,651341926042570752,/DougKass/status/651341926042570752#m,DougKass,0.0,0.0,2015-10-06 10:23:00+00:00,1444126980000.0,"On Bloomberg is Michael Spence, Nobel Prize winner. Brilliant. I believe Bill Gates said he was his most important influence as a teacher.",0.0,1.0,1.0
55,651339706567929857,/DougKass/status/651339706567929857#m,DougKass,0.0,0.0,2015-10-06 10:14:00+00:00,1444126440000.0,Big news? marketwatch.com/story/3-mont…,3.0,0.0,4.0
56,651339455635263488,/DougKass/status/651339455635263488#m,DougKass,0.0,0.0,2015-10-06 10:13:00+00:00,1444126380000.0,"""nothing really matters"" piped.video/watch?v=0MFRujjy…",1.0,1.0,2.0
57,651339202282541058,/DougKass/status/651339202282541058#m,DougKass,0.0,0.0,2015-10-06 10:12:00+00:00,1444126320000.0,companies to expand plant and equipment 3. instead they repurchase stock as it has a more immediate impact on eps,3.0,0.0,14.0
58,651339170116468736,/DougKass/status/651339170116468736#m,DougKass,0.0,0.0,2015-10-06 10:12:00+00:00,1444126320000.0,1. the savings class hoards capital and reduces its personal expenditures 2. there is little incentive for,1.0,0.0,8.0
59,651339108216893440,/DougKass/status/651339108216893440#m,DougKass,0.0,0.0,2015-10-06 10:11:00+00:00,1444126260000.0,"My view: when the time value of money is zero, a perversely negative impact of gross economic activity occurs:",1.0,0.0,10.0
60,651338941820440576,/DougKass/status/651338941820440576#m,DougKass,0.0,0.0,2015-10-06 10:11:00+00:00,1444126260000.0,"Great interview with Bloomberg's Keene and Michael Spence, Nobel Prize winner what happens when the cost of money is zero Tom asks.",0.0,0.0,3.0
61,651334302362415104,/DougKass/status/651334302362415104#m,DougKass,0.0,0.0,2015-10-06 09:52:00+00:00,1444125120000.0,Message form last two weeks: buyers live higher and sellers live lower. in the Upside/Down world we call Wall Street.,0.0,1.0,2.0
62,651332884087853057,/DougKass/status/651332884087853057#m,DougKass,0.0,0.0,2015-10-06 09:47:00+00:00,1444124820000.0,too high.,0.0,0.0,3.0
63,651331755404824576,/DougKass/status/651331755404824576#m,DougKass,0.0,0.0,2015-10-06 09:42:00+00:00,1444124520000.0,Two new shorts yesteray on RealMoneyPro: $AAPL ($110) and $DD ($54),3.0,1.0,5.0
64,651328837863784452,/DougKass/status/651328837863784452#m,DougKass,0.0,0.0,2015-10-06 09:31:00+00:00,1444123860000.0,German factory orders unexpectedly fall.,1.0,2.0,3.0
65,651328538235281409,/DougKass/status/651328538235281409#m,DougKass,0.0,0.0,2015-10-06 09:29:00+00:00,1444123740000.0,For the first time in history US sells 3 month TBill for zero yield. wsj.com/articles/u-s-treasur…,0.0,12.0,5.0
