,tweet_id,tweet_url,username,is_retweet,is_pinned,time,ts,text,replies,retweets,likes
0,127441409023283200,/DougKass/status/127441409023283200#m,DougKass,0.0,0.0,2011-10-21 05:49:00+00:00,1319176140000.0,"An explanation of my ""rental"" trading philosophy on REALMONEYPRO now - couldnt fit into 140 characters here!",2.0,1.0,0.0
1,127431967317819392,/DougKass/status/127431967317819392#m,DougKass,0.0,0.0,2011-10-21 05:12:00+00:00,1319173920000.0,taking in spyder short rental from earlier today on a scale now.,2.0,0.0,0.0
2,127430869953683456,/DougKass/status/127430869953683456#m,DougKass,0.0,0.0,2011-10-21 05:07:00+00:00,1319173620000.0,Over on RealMoneyPro I suggested a one third chance (LUDICRUS FORECAST but no gun to my head!) of a down day,6.0,1.0,0.0
3,127397340247101440,/DougKass/status/127397340247101440#m,DougKass,0.0,0.0,2011-10-21 02:54:00+00:00,1319165640000.0,I just took a short rental in SPY at 123.8 - we went thru techniccal resistance and often see pullbacks ... and there is the EU!,4.0,5.0,0.0
4,127394620870098945,/DougKass/status/127394620870098945#m,DougKass,0.0,0.0,2011-10-21 02:43:00+00:00,1319164980000.0,great column from my son noah kass on The Street - when to stop financially supporting your adult child! bit.ly/qpjZxx,2.0,2.0,5.0
5,127342774159814656,/DougKass/status/127342774159814656#m,DougKass,0.0,0.0,2011-10-21 11:17:00+00:00,1319195820000.0,"Coming up on RealMoneyPro - ""Thank God the Stock Market Didnt Decline in Vain!"" - The Gospel According to Wally Deemer",0.0,3.0,0.0
