,tweet_id,tweet_url,username,is_retweet,is_pinned,time,ts,text,replies,retweets,likes
0,253929606304903168,/DougKass/status/253929606304903168#m,DougKass,0.0,0.0,2012-10-04 06:48:00+00:00,1349333280000.0,I am outta here like Red Sox manager Valentine bo.st/PcX4hc - see you bright and early tomorrow.,11.0,1.0,0.0
1,253927532733276161,/DougKass/status/253927532733276161#m,DougKass,0.0,0.0,2012-10-04 06:40:00+00:00,1349332800000.0,Gallup Poll on Obama's job approval rating bit.ly/OFGZAC $SPY #stockaction,2.0,0.0,2.0
2,253926578466201600,/DougKass/status/253926578466201600#m,DougKass,0.0,0.0,2012-10-04 06:36:00+00:00,1349332560000.0,The Obama job approval results were based on a Gallup Survey today.,4.0,0.0,0.0
3,253926479518392321,/DougKass/status/253926479518392321#m,DougKass,0.0,0.0,2012-10-04 06:36:00+00:00,1349332560000.0,@LJ20175 its a gallup survey... objective.,1.0,0.0,0.0
4,253926350187016193,/DougKass/status/253926350187016193#m,DougKass,0.0,0.0,2012-10-04 06:35:00+00:00,1349332500000.0,Now up on RealMoneyPro: Nothing is Certain #stockaction $SPY,0.0,0.0,0.0
5,253925471224463362,/DougKass/status/253925471224463362#m,DougKass,0.0,0.0,2012-10-04 06:32:00+00:00,1349332320000.0,"Despite a poor showing in debate, Obama's job approval rating has jumped by 4 points, to 54 -- that's the best level since January 2010.",13.0,9.0,1.0
6,253888784414957568,/DougKass/status/253888784414957568#m,DougKass,0.0,0.0,2012-10-04 04:06:00+00:00,1349323560000.0,from thestreet There is no Special Sauce bit.ly/O7UZ4F $spy,3.0,1.0,2.0
7,253802960105123840,/DougKass/status/253802960105123840#m,DougKass,0.0,0.0,2012-10-04 10:25:00+00:00,1349346300000.0,"Overnight Romney bounce: S&Ps +5, Euro mkts -, Euro +, crude +0.6, Gold +11 and 10 year US note 1.63%. #stockaction",5.0,5.0,0.0
