,tweet_id,tweet_url,username,is_retweet,is_pinned,time,ts,text,replies,retweets,likes
0,1326272646351302657,/DougKass/status/1326272646351302657#m,DougKass,0.0,0.0,2020-11-10 09:16:00+00:00,1604999760000.0,"Yes, these two value ETFs stand right in the middle of the pivot from growth, imho.",3.0,1.0,17.0
1,1326257792701837312,/DougKass/status/1326257792701837312#m,DougKass,0.0,0.0,2020-11-10 08:17:00+00:00,1604996220000.0,Netflix and HBO recommendations: * The Undoing piped.video/watch?v=QWoiNlLq… * Queen's Gambit piped.video/watch?v=CDrieqwS… @jimcramer @tomkeene @carlquintanilla @saraeisen @ferrotv @Sarge986 @lizclaman,6.0,3.0,22.0
2,1326249812539416576,/DougKass/status/1326249812539416576#m,DougKass,0.0,0.0,2020-11-10 07:46:00+00:00,1604994360000.0,A good column coming up on @realmoney Not All Investment Views Are Created Equal - Conviction Is A Changing Variable @jimcramer @tomkeene,0.0,1.0,9.0
3,1326247082487930881,/DougKass/status/1326247082487930881#m,DougKass,0.0,0.0,2020-11-10 07:35:00+00:00,1604993700000.0,strong observation.,1.0,1.0,6.0
4,1326246914728333312,/DougKass/status/1326246914728333312#m,DougKass,0.0,0.0,2020-11-10 07:34:00+00:00,1604993640000.0,well put.,1.0,1.0,4.0
5,1326243808909070337,/DougKass/status/1326243808909070337#m,DougKass,0.0,0.0,2020-11-10 07:22:00+00:00,1604992920000.0,"I define it as ""noise"" Patrick.",4.0,1.0,12.0
6,1326239604102615042,/DougKass/status/1326239604102615042#m,DougKass,0.0,0.0,2020-11-10 07:05:00+00:00,1604991900000.0,"Basically agree. Not predictive, like unusual call activity.",2.0,1.0,7.0
7,1326239480777502723,/DougKass/status/1326239480777502723#m,DougKass,0.0,0.0,2020-11-10 07:05:00+00:00,1604991900000.0,"Thanks John, real nice.",1.0,0.0,7.0
8,1326235816142761986,/DougKass/status/1326235816142761986#m,DougKass,0.0,0.0,2020-11-10 06:50:00+00:00,1604991000000.0,"John I have never seen any value in the VIX as a predictive tool. I know many focus in on it, but I dont. And Thanks.",3.0,1.0,8.0
9,1326230734517002241,/DougKass/status/1326230734517002241#m,DougKass,0.0,0.0,2020-11-10 06:30:00+00:00,1604989800000.0,Yesterday on @realmoney I observed the absence of any skepticism regarding the early morning blastoff. After yesterday's reversal I still don't see fear.,4.0,2.0,27.0
10,1326215311524245509,/DougKass/status/1326215311524245509#m,DougKass,0.0,0.0,2020-11-10 05:29:00+00:00,1604986140000.0,Agree Brother Miles!,0.0,0.0,4.0
11,1326214887215935497,/DougKass/status/1326214887215935497#m,DougKass,0.0,0.0,2020-11-10 05:27:00+00:00,1604986020000.0,"Gerstner on @cnbc is an investment genius. Run, don't walk to listen to him. @ScottWapnerCNBC",6.0,4.0,25.0
12,1326211176498409480,/DougKass/status/1326211176498409480#m,DougKass,0.0,0.0,2020-11-10 05:12:00+00:00,1604985120000.0,New agenda for FIN TV questions to panelists. 1. Let's discuss your mistakes and how did you learn from them? 2. Explain your specific process of buying/selling stocks? 3. What is your history of success in that process? 4. What would make you change or alter your process?,3.0,2.0,19.0
13,1326211177442140160,/DougKass/status/1326211177442140160#m,DougKass,0.0,0.0,2020-11-10 05:12:00+00:00,1604985120000.0,"5. How do you spend your day making decisions? 6. What is your analytical methodology? 7. What are your best sources of information? 8. If you trade ""unusual call activity"" - show me, empirically, that directional call buying makes money in the long run.",3.0,1.0,15.0
14,1326211178255839232,/DougKass/status/1326211178255839232#m,DougKass,0.0,0.0,2020-11-10 05:12:00+00:00,1604985120000.0,9. How do you develop your market outlook? 10. What do you read? @jimcramer @tomkeene @business @FerroTV @SquawkCNBC @cnbcfastmoney @threadreaderapp unroll,2.0,1.0,13.0
15,1326209615667793922,/DougKass/status/1326209615667793922#m,DougKass,0.0,0.0,2020-11-10 05:06:00+00:00,1604984760000.0,"Never a question asked that an answer isn't delivered. ""I dont know"" is foreign to many.",1.0,0.0,9.0
16,1326209410155360257,/DougKass/status/1326209410155360257#m,DougKass,0.0,0.0,2020-11-10 05:05:00+00:00,1604984700000.0,Cringe worthy.,1.0,0.0,2.0
17,1326209280752685066,/DougKass/status/1326209280752685066#m,DougKass,0.0,0.0,2020-11-10 05:05:00+00:00,1604984700000.0,Investment wisdom is always 20/20 when viewed in the rear view mirror.,1.0,1.0,10.0
18,1326209046400077825,/DougKass/status/1326209046400077825#m,DougKass,0.0,0.0,2020-11-10 05:04:00+00:00,1604984640000.0,Buy Peleton because of Beyonce? Seriously? $PTON Fin TV too often lacks rigor.,8.0,2.0,36.0
19,1326207613227462656,/DougKass/status/1326207613227462656#m,DougKass,0.0,0.0,2020-11-10 04:58:00+00:00,1604984280000.0,Nomura's McElliggott has a good analysis of what happens next after a multi sigma event (flush/unwind of growth v value). @realmoney,0.0,1.0,12.0
20,1326192296128286722,/DougKass/status/1326192296128286722#m,DougKass,0.0,0.0,2020-11-10 03:57:00+00:00,1604980620000.0,nope.,0.0,1.0,5.0
21,1326191757764202502,/DougKass/status/1326191757764202502#m,DougKass,0.0,0.0,2020-11-10 03:55:00+00:00,1604980500000.0,"Remember unusual call activity in $BABA last week? Well, look at its share price. -$25",8.0,1.0,42.0
22,1326189660582907904,/DougKass/status/1326189660582907904#m,DougKass,0.0,0.0,2020-11-10 03:47:00+00:00,1604980020000.0,"$SPY now -$13/share below yesterday's short @realmoney Moved to tagends in following longs: $VTV $VBR $GS $GM $MS $DIS, etc.",2.0,2.0,15.0
23,1326189150844948482,/DougKass/status/1326189150844948482#m,DougKass,0.0,0.0,2020-11-10 03:45:00+00:00,1604979900000.0,@realmoney Moved to between small and medium sized net short.,0.0,0.0,1.0
24,1326187398095581184,/DougKass/status/1326187398095581184#m,DougKass,0.0,0.0,2020-11-10 03:38:00+00:00,1604979480000.0,More on what I dont like about the market on @realmoney now. @jimcramer @tomkeene,0.0,0.0,6.0
25,1326187274036514817,/DougKass/status/1326187274036514817#m,DougKass,0.0,0.0,2020-11-10 03:37:00+00:00,1604979420000.0,In other words... a top.,2.0,1.0,19.0
26,1326182826396561409,/DougKass/status/1326182826396561409#m,DougKass,0.0,0.0,2020-11-10 03:19:00+00:00,1604978340000.0,"There is a message here. After great EPS and sales (pulled forward), $ZM traded at $588 on October 18th. It is trading at $381 today on no new input. Think homebuilders and other growth names.... @realmoney",4.0,2.0,39.0
27,1326170598830202887,/DougKass/status/1326170598830202887#m,DougKass,0.0,0.0,2020-11-10 02:31:00+00:00,1604975460000.0,"@realmoney My Six Month Tactical Approach to the Markets Remains The Same On October 22nd I outlined, ""Some Investment Themes to Consider Over the Next Few Months."" Let's revisit the column: As you map out your strategy for year-end and for 2021, here are some themes to",2.0,2.0,9.0
28,1326170599715188736,/DougKass/status/1326170599715188736#m,DougKass,0.0,0.0,2020-11-10 02:31:00+00:00,1604975460000.0,"consider: * Short Fixed Income: Bonds are among the most risky and least efficiently priced asset classes extant. The 10 year note yield is about to break to the upside (of its 200 day moving average) - the 30 year yield already has. A large, Democratic-led February stimulus",1.0,1.0,5.0
29,1326170600554045441,/DougKass/status/1326170600554045441#m,DougKass,0.0,0.0,2020-11-10 02:31:00+00:00,1604975460000.0,package could be a catalyst for the 10 year US note to climb over 1% in the near term. (I would note that TLT peaked at $172 in early August and is now trading at $155) * Short Homebuilders: The sector is negatively influenced by the rate of change in bond yields. With mortgage,1.0,1.0,4.0
30,1326170601384534017,/DougKass/status/1326170601384534017#m,DougKass,0.0,0.0,2020-11-10 02:31:00+00:00,1604975460000.0,"rates rising and home prices catapulting higher the seeds of slowing home demand are being sown. Peak Housing may be at hand in the next few months. After having tripled from the March, 2020 lows homebuilder stocks are vulnerable. (See my comments on bonds, TLT, above!)",2.0,1.0,4.0
31,1326170603523624960,/DougKass/status/1326170603523624960#m,DougKass,0.0,0.0,2020-11-10 02:31:00+00:00,1604975460000.0,"* Short ""Growth"": Growth has benefited from a low risk free rate of return which has expanded valuations. This tailwind of 2019-2000 could become a headwind to high price earnings multiple stocks, and maybe for the market as a whole.",1.0,1.0,6.0
32,1326170604333096960,/DougKass/status/1326170604333096960#m,DougKass,0.0,0.0,2020-11-10 02:31:00+00:00,1604975460000.0,"* Short Stocks That Have Had Large Valuation Expansion: Again, interest rates rising are non supportive of further P/E expansion and argue in favor of multiple contraction. Apple (AAPL) is the poster child. * Long Value: There is so much money in ""growth"" that any incremental",1.0,2.0,4.0
33,1326170605276844034,/DougKass/status/1326170605276844034#m,DougKass,0.0,0.0,2020-11-10 02:31:00+00:00,1604975460000.0,"fund flow losses and pivot into value could have a forceful marginal impact on demand/supply equation for value stocks - which are very cheap relative to growth. A Democratic administration will likely lead to a lengthy regulatory attack which most companies, I have written,",1.0,1.0,6.0
34,1326170606145073154,/DougKass/status/1326170606145073154#m,DougKass,0.0,0.0,2020-11-10 02:31:00+00:00,1604975460000.0,"will endure profitably. * Long Banks: I have written that 3Q2020 likely represented a cycle low in net interest income/margin. This, coupled with historically low valuations - that rival 2009 - could light the fire of the much hated bank stock universe over the next few quarters",2.0,2.0,13.0
35,1326170606971326469,/DougKass/status/1326170606971326469#m,DougKass,0.0,0.0,2020-11-10 02:31:00+00:00,1604975460000.0,@jimcramer @carlquintanilla @SquawkCNBC @cnbcfastmoney @tomkeene @business @WilfredFrost @lizclaman @riskreversal @guyadami @terranovajoe @ScottWapnerCNBC @FerroTV @threadreaderapp unroll,1.0,0.0,4.0
36,1326148819474653184,/DougKass/status/1326148819474653184#m,DougKass,0.0,0.0,2020-11-10 01:04:00+00:00,1604970240000.0,"Remember the ""unusual call activity"" in the favorite tech stocks (including $TWTR, $BABA, etc.) It turned out to be quite usual. Most of the otm calls are now zero. piped.video/watch?v=-DT7bX-B…",4.0,0.0,33.0
37,1326148207341133827,/DougKass/status/1326148207341133827#m,DougKass,0.0,0.0,2020-11-10 01:02:00+00:00,1604970120000.0,sic transit gloria.,0.0,0.0,11.0
38,1326145274172104706,/DougKass/status/1326145274172104706#m,DougKass,0.0,0.0,2020-11-10 12:50:00+00:00,1605012600000.0,"Opinions on the markets are like assholes, everyone has one (and that includes me!), Daniel.",8.0,2.0,24.0
39,1326142525376241665,/DougKass/status/1326142525376241665#m,DougKass,0.0,0.0,2020-11-10 12:39:00+00:00,1605011940000.0,Not a name of mine Stefan.,0.0,0.0,4.0
40,1326141454973079554,/DougKass/status/1326141454973079554#m,DougKass,0.0,0.0,2020-11-10 12:35:00+00:00,1605011700000.0,good stuff!,1.0,1.0,6.0
41,1326139952179130368,/DougKass/status/1326139952179130368#m,DougKass,0.0,0.0,2020-11-10 12:29:00+00:00,1605011340000.0,good observation and post.,0.0,1.0,7.0
42,1326133928382574593,/DougKass/status/1326133928382574593#m,DougKass,0.0,0.0,2020-11-10 12:05:00+00:00,1605009900000.0,If the pivot from growth to value is real... With so much of the Indices tech heavy - it is hard to see tech stocks suffer and the market advance at the same time. @jimcramer @tomkeene @SquawkCNBC @cnbcfastmoney @andrewrsorkin @beckyquick @cnbcfastmoney @riskreversal,5.0,2.0,33.0
43,1326128482821267463,/DougKass/status/1326128482821267463#m,DougKass,0.0,0.0,2020-11-10 11:44:00+00:00,1605008640000.0,"It is not Kernan's dogma that i am critical of, its his lack of preparation seen in his elementary questions to guests, among other places. Takes the easy route and doesnt do homework.",16.0,3.0,77.0
44,1326127104946278402,/DougKass/status/1326127104946278402#m,DougKass,0.0,0.0,2020-11-10 11:38:00+00:00,1605008280000.0,with difficulty!,1.0,0.0,12.0
45,1326118742087127041,/DougKass/status/1326118742087127041#m,DougKass,0.0,0.0,2020-11-10 11:05:00+00:00,1605006300000.0,Kernan. Embarrassing.,8.0,2.0,45.0
46,1326118341614989318,/DougKass/status/1326118341614989318#m,DougKass,0.0,0.0,2020-11-10 11:03:00+00:00,1605006180000.0,amazon.com/Doug-Kass-Market-… DM your email and I will send you a list I wrote up of recommended investment books on @realmoney,2.0,0.0,3.0
47,1326117998973898761,/DougKass/status/1326117998973898761#m,DougKass,0.0,0.0,2020-11-10 11:02:00+00:00,1605006120000.0,"Second dumbest headline of the day @CNBC ""Dow futures rise after a record-setting rally on promising vaccine news"" DJIA futures +100 S and P futures -18 Nasdaq futures -190 @tomkeene @andrewrsorkin @SquawkCNBC",2.0,1.0,27.0
48,1326116796764737536,/DougKass/status/1326116796764737536#m,DougKass,0.0,0.0,2020-11-10 10:57:00+00:00,1605005820000.0,I mentioned this rumor on Twitter yesterday B. @tomkeene @ritholtz,2.0,0.0,11.0
49,1326116485115338756,/DougKass/status/1326116485115338756#m,DougKass,0.0,0.0,2020-11-10 10:56:00+00:00,1605005760000.0,"Coming up on @realmoney The Thunder in South Florida Yesterday Was Not the Bad Weather - It Was The Sound of the Market's Pivot From Growth To Value * Yesterday may have represented a classic ""sell on the good news"" * Monday was also an example why unemotional",2.0,2.0,14.0
50,1326116486021312512,/DougKass/status/1326116486021312512#m,DougKass,0.0,0.0,2020-11-10 10:56:00+00:00,1605005760000.0,"trading/investing is so important * Some stocks and sectors had a great year yesterday * While many were cheering about the vaccine news, I was waiting to sell (with red tickets in hand) * On Monday I moved from large net long to small net short - it was the biggest daily",1.0,1.0,6.0
51,1326116486797287424,/DougKass/status/1326116486797287424#m,DougKass,0.0,0.0,2020-11-10 10:56:00+00:00,1605005760000.0,"swing in my aggregate net exposure in years * Given the market's pivot, it may be time to consider a Berkshire Hathaway long @jimcramer @tomkeene @SquawkCNBC @cnbcfastmoney @andrewrsorkin @beckyquick @SquawkCNBC @cnbcfastmoney @riskreversal @ScottWapnerCNBC",1.0,1.0,7.0
52,1326116487623553024,/DougKass/status/1326116487623553024#m,DougKass,0.0,0.0,2020-11-10 10:56:00+00:00,1605005760000.0,@Sarge986 @saraeisen @SullyCNBC @lizclaman @joeterranova @guyadami @ScottWapnerCNBC @melissalee @FerroTV @business @threadreaderapp unroll,1.0,0.0,3.0
53,1326114264474595328,/DougKass/status/1326114264474595328#m,DougKass,0.0,0.0,2020-11-10 10:47:00+00:00,1605005220000.0,Love when you talk sexy like this @tomkeene,0.0,0.0,6.0
54,1326108268167618560,/DougKass/status/1326108268167618560#m,DougKass,0.0,0.0,2020-11-10 10:23:00+00:00,1605003780000.0,The thunder we hear in South Florida is not the bad weather - its the pivot from growth to value. Yesterday value stocks outperformed growth stocks by nearly 10% - that's the largest one day gap in history. @jimcramer @tomkeene @SquawkCNBC @andrewrsorkin @bobpisani @beckyquick,2.0,5.0,34.0
55,1326108269266530304,/DougKass/status/1326108269266530304#m,DougKass,0.0,0.0,2020-11-10 10:23:00+00:00,1605003780000.0,@SullyCNBC @carlquintanilla @TheDomino @saraeisen @ferrotv @business @lizclaman @Sarge986 @threadreaderapp unroll,2.0,0.0,3.0
56,1326107316199022592,/DougKass/status/1326107316199022592#m,DougKass,0.0,0.0,2020-11-10 10:19:00+00:00,1605003540000.0,"Dumbest headline of the morning from @cnbc: ""Dow futures rise 200 points after a record-setting rally on promising vaccine news"" S&P futures -2.50 Nasdaq futures -117 at 515AM @SquawkCNBC",2.0,1.0,21.0
57,1326105612233699328,/DougKass/status/1326105612233699328#m,DougKass,0.0,0.0,2020-11-10 10:13:00+00:00,1605003180000.0,"Dick ""The Monster"" Radatz owned the Yankees.... for a few games in the 1960s.",1.0,0.0,3.0
58,1326105057738321921,/DougKass/status/1326105057738321921#m,DougKass,0.0,0.0,2020-11-10 10:10:00+00:00,1605003000000.0,Follow the thread and go to @realmoney where I have had a blog for 23 years Kevin...,1.0,0.0,8.0
59,1325993878965678080,/DougKass/status/1325993878965678080#m,DougKass,0.0,0.0,2020-11-10 02:49:00+00:00,1604976540000.0,Thanks David.,2.0,0.0,13.0
60,1325979784791388160,/DougKass/status/1325979784791388160#m,DougKass,0.0,0.0,2020-11-10 01:53:00+00:00,1604973180000.0,Honestly David - if someone can find an investor that is more transparent to me I would like to see it. Jeez Louise. Nite.,6.0,0.0,34.0
61,1325978124149018625,/DougKass/status/1325978124149018625#m,DougKass,0.0,0.0,2020-11-10 01:46:00+00:00,1604972760000.0,Go to @realmoney,3.0,0.0,6.0
62,1325977787526746112,/DougKass/status/1325977787526746112#m,DougKass,0.0,0.0,2020-11-10 01:45:00+00:00,1604972700000.0,Homie dont play this game.,2.0,0.0,8.0
63,1325971319880626176,/DougKass/status/1325971319880626176#m,DougKass,0.0,0.0,2020-11-10 01:19:00+00:00,1604971140000.0,Too nice Jason. Better Jewish luck than Christian Science!,2.0,0.0,7.0
64,1325971153106694145,/DougKass/status/1325971153106694145#m,DougKass,0.0,0.0,2020-11-10 01:18:00+00:00,1604971080000.0,"Linda, there's that guy from the stereo store. - Don't you think he looks like Richard Gere?",1.0,0.0,4.0
65,1325968751255236609,/DougKass/status/1325968751255236609#m,DougKass,0.0,0.0,2020-11-10 01:09:00+00:00,1604970540000.0,I give myself a F. I am Jeff Spicoli. piped.video/watch?v=bc2muGlQ…,3.0,0.0,6.0
66,1325968156427423744,/DougKass/status/1325968156427423744#m,DougKass,0.0,0.0,2020-11-10 01:06:00+00:00,1604970360000.0,Today was my most active trading day in over two years. @realmoney,11.0,0.0,72.0
67,1325967911001993216,/DougKass/status/1325967911001993216#m,DougKass,0.0,0.0,2020-11-10 01:05:00+00:00,1604970300000.0,Homebuilder short package down -7.5% today. @realmoney A combination of rising mortgage rates and sharp spike in home prices is sowing the seeds for a residential real estate downturn. Short the sector as discussed on @realmoney and on twitter. Will short more on a rally.,3.0,2.0,26.0
