,tweet_id,tweet_url,username,is_retweet,is_pinned,time,ts,text,replies,retweets,likes
0,223843872659345408,/DougKass/status/223843872659345408#m,DougKass,0.0,0.0,2012-07-13 06:18:00+00:00,1342160280000.0,@dacheshire sold it,1.0,1.0,0.0
1,223781453299855361,/DougKass/status/223781453299855361#m,DougKass,0.0,0.0,2012-07-13 02:10:00+00:00,1342145400000.0,I just took a small short rental in SPY at 135.25. $SPY,7.0,2.0,2.0
2,223776715422449664,/DougKass/status/223776715422449664#m,DougKass,0.0,0.0,2012-07-13 01:51:00+00:00,1342144260000.0,Back to market neutral now.,3.0,0.0,1.0
3,223729161523560448,/DougKass/status/223729161523560448#m,DougKass,0.0,0.0,2012-07-13 10:42:00+00:00,1342176120000.0,I am long JPM going into the number. $JPM,8.0,2.0,0.0
4,223716823122710528,/DougKass/status/223716823122710528#m,DougKass,0.0,0.0,2012-07-13 09:53:00+00:00,1342173180000.0,"Despite a so-so Chinese Buffet last nite modest rebounds: S&P futures +4, Euro Mkts+, Euro+, crude +1, gold + 14, 10 year USnote 1.48%",0.0,2.0,0.0
5,223603386946297857,/DougKass/status/223603386946297857#m,DougKass,0.0,0.0,2012-07-13 02:22:00+00:00,1342146120000.0,China Ind Prod and GDP slight misses to consensus expectations. Shouldnt be impactful to markets.,3.0,8.0,2.0
6,223575212380270594,/DougKass/status/223575212380270594#m,DougKass,0.0,0.0,2012-07-13 12:30:00+00:00,1342182600000.0,WSJ reports Pershing Square owns about $2 billion of PG shares - is it a large enough platform to effect change on.wsj.com/PSTw3J,3.0,4.0,1.0
