,tweet_id,tweet_url,username,is_retweet,is_pinned,time,ts,text,replies,retweets,likes
0,1124791989537529856,/DougKass/status/1124791989537529856#m,DougKass,0.0,0.0,2019-05-04 09:44:00+00:00,1556963040000.0,"Some nostalgia. My questions that I presented to Warren Buffett/Charlie at Berkshire's 2013 Annual Meeting: buffett.cnbc.com/video/2013/… Question #1 at 43 minute mark ""Size Matters"" Question #2 at 1 hour 18 minutes 53 seconds ""Berkshire Post Buffett"" Question #3 at 1 hour 52 minutes",1.0,2.0,9.0
1,1124791990548348928,/DougKass/status/1124791990548348928#m,DougKass,0.0,0.0,2019-05-04 09:44:00+00:00,1556963040000.0,"20 seconds ""Dr. Henry Singleton"" Afternoon Session buffett.cnbc.com/video/2013/… Question #4 15 seconds ""The Game"" Question #5 44 minutes 15 seconds ""A Short Selling Challenge"" Question #6 1 hour 23 minutes 35 seconds ""Howard Buffett as Non Exec Chair""",1.0,0.0,4.0
2,1124791991584395264,/DougKass/status/1124791991584395264#m,DougKass,0.0,0.0,2019-05-04 09:44:00+00:00,1556963040000.0,@jimcramer @tomkeene @pimmfox @TeamCavuto @squawkcnbc @cnbcfastmoney @andrewrsorkin @beckyquick @carlquintanilla @thedomino @saraeisen @sullycnbc @lizclaman @riskreversal @kellyevans @guyadami @terranovajoe @scottwapnercnbc,0.0,0.0,2.0
3,1124762736481710080,/DougKass/status/1124762736481710080#m,DougKass,0.0,0.0,2019-05-04 07:48:00+00:00,1556956080000.0,I cant separate Improbable Game Winner and Tacitus,5.0,0.0,3.0
4,1124632752169549825,/DougKass/status/1124632752169549825#m,DougKass,0.0,0.0,2019-05-04 11:11:00+00:00,1556968260000.0,Yahoo Finance Live Streams the Berkshire Hathaway Annual Meeting today. Here is the link.. finance.yahoo.com/brklivestr…,1.0,1.0,6.0
5,1124627446454784001,/DougKass/status/1124627446454784001#m,DougKass,0.0,0.0,2019-05-04 10:50:00+00:00,1556967000000.0,"Six years ago today I was the ""Credentialed Bear"" at Berkshire Hathaway's Annual Meeting. Sitting on the dais with Warren Buffett and Charlie Munger was one of the most unique experiences in my life that day dealbook.nytimes.com/2013/03… @jimcramer @tomkeene @SquawkCNBC @CNBCFastMoney",5.0,1.0,42.0
6,1124627447297736704,/DougKass/status/1124627447297736704#m,DougKass,0.0,0.0,2019-05-04 10:50:00+00:00,1556967000000.0,@carlquintanilla @BeckyQuick @thedomino @arimbelber @realdonaldtrump @morningmoneyben @morningmika @morning_joe @SullyCNBC #msnbc #cnn @andrewrsorkin,1.0,0.0,0.0
7,1124617693133451265,/DougKass/status/1124617693133451265#m,DougKass,0.0,0.0,2019-05-04 10:12:00+00:00,1556964720000.0,"'The Woodstock for Capitalists' in Omaha, Nebraska at Berkshire Hathaway's Annual Meeting. Enjoy and learn!",1.0,1.0,14.0
