,tweet_id,tweet_url,username,is_retweet,is_pinned,time,ts,text,replies,retweets,likes
0,906666478258278400,/DougKass/status/906666478258278400#m,DougKass,0.0,0.0,2017-09-09 11:51:00+00:00,1504957860000.0,Great Masters in Business podcast with Barry Ritholtz and BTIG's Katie Stockton. Even for a fundie guy like me! assets.bwbx.io/av/users/iqjW…,1.0,0.0,12.0
1,906664094291427333,/DougKass/status/906664094291427333#m,DougKass,0.0,0.0,2017-09-09 11:42:00+00:00,1504957320000.0,This is horrific. nypost.com/2017/09/09/eric-b…,3.0,7.0,10.0
2,906662688318803968,/DougKass/status/906662688318803968#m,DougKass,0.0,0.0,2017-09-09 11:36:00+00:00,1504956960000.0,Omg!,3.0,1.0,6.0
3,906662173115633664,/DougKass/status/906662173115633664#m,DougKass,0.0,0.0,2017-09-09 11:34:00+00:00,1504956840000.0,Sloane Stephens US Open Champ ! nypost.com/2017/09/09/sloane…,1.0,2.0,8.0
4,906660409775677441,/DougKass/status/906660409775677441#m,DougKass,0.0,0.0,2017-09-09 11:27:00+00:00,1504956420000.0,"Be safe, Rev! Your pal, Dougie",2.0,1.0,6.0
5,906323870118023170,/DougKass/status/906323870118023170#m,DougKass,0.0,0.0,2017-09-09 01:10:00+00:00,1504919400000.0,The Gospel According to Howard Marks zerohedge.com/news/2017-09-0…,2.0,5.0,9.0
