,tweet_id,tweet_url,username,is_retweet,is_pinned,time,ts,text,replies,retweets,likes
0,93739523577614340,/DougKass/status/93739523577614340#m,DougKass,0.0,0.0,2011-07-20 05:50:00+00:00,1311141000000.0,On RealMoney Silver now - Where's Waldo...err Nouriel?,1.0,2.0,0.0
1,93723168291815424,/DougKass/status/93723168291815424#m,DougKass,0.0,0.0,2011-07-20 04:45:00+00:00,1311137100000.0,I am adding to my XL long now - it is my largest long holding.,3.0,2.0,0.0
2,93717443750539264,/DougKass/status/93717443750539264#m,DougKass,0.0,0.0,2011-07-20 04:22:00+00:00,1311135720000.0,shorting more qqq,3.0,1.0,1.0
3,93717410472927233,/DougKass/status/93717410472927233#m,DougKass,0.0,0.0,2011-07-20 04:22:00+00:00,1311135720000.0,after the gold rush on yesterday's market and of apple - look carefully and the high octane sector is starting to dip... some cases badly,1.0,3.0,0.0
4,93683798440554496,/DougKass/status/93683798440554496#m,DougKass,0.0,0.0,2011-07-20 02:08:00+00:00,1311127680000.0,goldman is now up 5-6 points since my tweet to buy in premarket trading yest (and weakness) - i am taking the trade now.,6.0,2.0,0.0
