,tweet_id,tweet_url,username,is_retweet,is_pinned,time,ts,text,replies,retweets,likes
0,182555625086124034,/DougKass/status/182555625086124034#m,DougKass,0.0,0.0,2012-03-21 07:53:00+00:00,1332316380000.0,"Some observations today: 1. brutal reversal in oracle, 2. the tape is saying slowing growth (bond yields, cat, cyclical shares) high risk",8.0,5.0,2.0
1,182526853477711872,/DougKass/status/182526853477711872#m,DougKass,0.0,0.0,2012-03-21 05:59:00+00:00,1332309540000.0,"From the Street: What Goes Up Must Go Down (Margins, That is!) bit.ly/GDrEbx #stockaction $SPY",3.0,2.0,2.0
2,182522139239395329,/DougKass/status/182522139239395329#m,DougKass,0.0,0.0,2012-03-21 05:40:00+00:00,1332308400000.0,@Djmojorisin yes sir.,0.0,0.0,0.0
3,182455380163559425,/DougKass/status/182455380163559425#m,DougKass,0.0,0.0,2012-03-21 01:15:00+00:00,1332292500000.0,"Now up on RealMoneyPro - What Goes uyp Must Go Down (Profit margins, that is!) #stockaction",1.0,1.0,1.0
4,182443170141978624,/DougKass/status/182443170141978624#m,DougKass,0.0,0.0,2012-03-21 12:26:00+00:00,1332332760000.0,Muppets Unite! Up on RealMoneyPro - piped.video/oiMZa8flyYY #stockaction $SPY,1.0,1.0,0.0
5,182440678259822592,/DougKass/status/182440678259822592#m,DougKass,0.0,0.0,2012-03-21 12:17:00+00:00,1332332220000.0,So Goldman wakes up to high risk premiums (DUH!) after the S&P has risen from 666 to1400. Muppets unite!!!! #stockacdtion $SPY,2.0,12.0,1.0
6,182438421191598080,/DougKass/status/182438421191598080#m,DougKass,0.0,0.0,2012-03-21 12:08:00+00:00,1332331680000.0,@NomadUNC They promote equities after more than doubling because I suppose they think we are muppets,2.0,0.0,0.0
7,182435439884505089,/DougKass/status/182435439884505089#m,DougKass,0.0,0.0,2012-03-21 11:56:00+00:00,1332330960000.0,"I attack GS's new and positive view) on equities this morning on RealMoneyPro - What Goes Up Must Come Down! (Profit Margins, That Is!)",2.0,2.0,0.0
