,tweet_id,tweet_url,username,is_retweet,is_pinned,time,ts,text,replies,retweets,likes
0,551887649040912385,/DougKass/status/551887649040912385#m,DougKass,0.0,0.0,2015-01-04 11:47:00+00:00,1420372020000.0,"@Pok8Rok8 @zerohedge @platypusfoot David is thoughtful, analytical and independent. There are reasons to be bearish but not bec he bull. .",0.0,0.0,0.0
1,551764255314157569,/DougKass/status/551764255314157569#m,DougKass,0.0,0.0,2015-01-04 03:37:00+00:00,1420342620000.0,"When I had cancer two years ago Stuart Scott helped to get me through - but he never knew it. So I NOW say thank you, Stuart.",6.0,9.0,40.0
2,551763953651445760,/DougKass/status/551763953651445760#m,DougKass,0.0,0.0,2015-01-04 03:35:00+00:00,1420342500000.0,Poetry Jam: Best Ever Stuart Scott piped.video/watch?v=4AlO7pVi…,0.0,4.0,4.0
3,551763322064736256,/DougKass/status/551763322064736256#m,DougKass,0.0,0.0,2015-01-04 03:33:00+00:00,1420342380000.0,This IS Sportscenter piped.video/watch?v=eVqpDxYC…,0.0,1.0,2.0
4,551763053755113472,/DougKass/status/551763053755113472#m,DougKass,0.0,0.0,2015-01-04 03:32:00+00:00,1420342320000.0,Scott Tribute piped.video/watch?v=O7eMrGW1…,0.0,2.0,5.0
5,551761372011188225,/DougKass/status/551761372011188225#m,DougKass,0.0,0.0,2015-01-04 03:25:00+00:00,1420341900000.0,ESPN's Stuart Scott - R.I.P. He was an original - been watching him for 20 years... piped.video/watch?v=Yl_0ieqS…,0.0,4.0,11.0
