,tweet_id,tweet_url,username,is_retweet,is_pinned,time,ts,text,replies,retweets,likes
0,727984698916519937,/DougKass/status/727984698916519937#m,DougKass,0.0,0.0,2016-05-04 10:14:00+00:00,1462356840000.0,"Yes, ""might"" is the operative word!",1.0,0.0,0.0
1,727984187559546880,/DougKass/status/727984187559546880#m,DougKass,0.0,0.0,2016-05-04 10:12:00+00:00,1462356720000.0,I respectfully disagree. Tim Cook has been a reasonable steward of Apple since Jobs. But he is not Steve Jobs.,4.0,2.0,8.0
2,727983911763095552,/DougKass/status/727983911763095552#m,DougKass,0.0,0.0,2016-05-04 10:11:00+00:00,1462356660000.0,"Charts tell us where the markets have been, not where they are going Inari. My view.",0.0,1.0,1.0
3,727983763288952832,/DougKass/status/727983763288952832#m,DougKass,0.0,0.0,2016-05-04 10:10:00+00:00,1462356600000.0,Interesting Milken session now on media.. live stream livestream.com/milkeninstitu…,0.0,1.0,1.0
4,727974735066206208,/DougKass/status/727974735066206208#m,DougKass,0.0,0.0,2016-05-04 09:34:00+00:00,1462354440000.0,"@EdibleApple Barrons/$AAPL/Kass Please pay attention to chart at end, larger misses in Cook era. blogs.barrons.com/techtrader…",0.0,0.0,1.0
5,727974478362255360,/DougKass/status/727974478362255360#m,DougKass,0.0,0.0,2016-05-04 09:33:00+00:00,1462354380000.0,Barrons/Kass/$AAPL blogs.barrons.com/techtrader…,1.0,0.0,3.0
6,727973497863995392,/DougKass/status/727973497863995392#m,DougKass,0.0,0.0,2016-05-04 09:29:00+00:00,1462354140000.0,@jimcramer Greenlight's Einhorn targets $CAT as a short. And I agree.,0.0,1.0,4.0
7,727970938105532416,/DougKass/status/727970938105532416#m,DougKass,0.0,0.0,2016-05-04 09:19:00+00:00,1462353540000.0,"John Kasich on msnbc, live. msnbc.com/live-online/watch/…",2.0,0.0,0.0
8,727970508478808064,/DougKass/status/727970508478808064#m,DougKass,0.0,0.0,2016-05-04 09:17:00+00:00,1462353420000.0,I might disagree with John Kasich politically but I think he is a great man and a wonderful and compassionate leader. Watching him now.,9.0,4.0,29.0
9,727953604812808193,/DougKass/status/727953604812808193#m,DougKass,0.0,0.0,2016-05-04 08:10:00+00:00,1462349400000.0,$TSLA estimates that capital spending will be about 50% higher than expectations. Could this result in a bond/equity financing?,2.0,3.0,13.0
10,727951088574447618,/DougKass/status/727951088574447618#m,DougKass,0.0,0.0,2016-05-04 08:00:00+00:00,1462348800000.0,Will a $TSLA financing be announced coincident with EPS tonite? Stay tuned!,1.0,2.0,3.0
11,727942354624110592,/DougKass/status/727942354624110592#m,DougKass,0.0,0.0,2016-05-04 07:25:00+00:00,1462346700000.0,"How great, compassionate and charitable is Eli Manning? Amazing. @jimcramer",0.0,0.0,10.0
12,727935381966970880,/DougKass/status/727935381966970880#m,DougKass,0.0,0.0,2016-05-04 06:58:00+00:00,1462345080000.0,Thanks I think .(part deux),0.0,0.0,3.0
13,727934205108178944,/DougKass/status/727934205108178944#m,DougKass,0.0,0.0,2016-05-04 06:53:00+00:00,1462344780000.0,On front page Juliek.,0.0,0.0,0.0
14,727934128134361088,/DougKass/status/727934128134361088#m,DougKass,0.0,0.0,2016-05-04 06:53:00+00:00,1462344780000.0,Brazilian Senate Report Supports Motion to Impeach Rousseff,0.0,0.0,2.0
15,727933752991752193,/DougKass/status/727933752991752193#m,DougKass,0.0,0.0,2016-05-04 06:51:00+00:00,1462344660000.0,"@EdibleApple Thanks for the pleasant Email, Yoni. Unblocked and unmuted. Your firend, Dougie Kass",0.0,0.0,0.0
16,727931426134368256,/DougKass/status/727931426134368256#m,DougKass,0.0,0.0,2016-05-04 06:42:00+00:00,1462344120000.0,"To $AAPL devotees Bears on $AAPL can only be wrong, even when they are right. Enjoy the evening!",2.0,1.0,6.0
17,727930436257611777,/DougKass/status/727930436257611777#m,DougKass,0.0,0.0,2016-05-04 06:38:00+00:00,1462343880000.0,I wasnt short from 2012 until 2015! Indeed there were periods in which I was long Do your homeowrk.,0.0,0.0,3.0
18,727930246196924417,/DougKass/status/727930246196924417#m,DougKass,0.0,0.0,2016-05-04 06:37:00+00:00,1462343820000.0,Blocked and muted until you email me with an apology.,1.0,0.0,7.0
19,727930136545234944,/DougKass/status/727930136545234944#m,DougKass,0.0,0.0,2016-05-04 06:37:00+00:00,1462343820000.0,"@EdibleApple I wish I made that mistake every day! Do your homework, Yoni. I enjoy respectful debate not non factual and ad hominem attacks",0.0,0.0,0.0
20,727929962586472448,/DougKass/status/727929962586472448#m,DougKass,0.0,0.0,2016-05-04 06:36:00+00:00,1462343760000.0,@EdibleApple here is the business insider column you linked to. businessinsider.com/doug-kas… If making 40% short in $AAPL was a mistake....,2.0,0.0,1.0
21,727929791819620353,/DougKass/status/727929791819620353#m,DougKass,0.0,0.0,2016-05-04 06:36:00+00:00,1462343760000.0,"$AAPL shares fell by nearly 45% from that point. Margins collapsed, EPS disappointed. I was short.",2.0,1.0,4.0
22,727929643014070272,/DougKass/status/727929643014070272#m,DougKass,0.0,0.0,2016-05-04 06:35:00+00:00,1462343700000.0,You link to my Bearish Case for Apple (written on RealMoney) in Sept 2012,1.0,0.0,1.0
23,727929229644472320,/DougKass/status/727929229644472320#m,DougKass,0.0,0.0,2016-05-04 06:33:00+00:00,1462343580000.0,"You stated that by doing the opposite of my AAPL analysis investors would have made millions Patently untrue, Yoni",0.0,0.0,3.0
24,727928021458395136,/DougKass/status/727928021458395136#m,DougKass,0.0,0.0,2016-05-04 06:28:00+00:00,1462343280000.0,@EdibleApple I prefer respectful debate over ad hominem and non factual attacks. Best of luck. bgr.com/2016/05/04/tim-cook-…,0.0,0.0,0.0
25,727927806634627073,/DougKass/status/727927806634627073#m,DougKass,0.0,0.0,2016-05-04 06:28:00+00:00,1462343280000.0,@EdibleApple I am accustomed to ad hominem attacks by Apple lovers. But your expression of my track record in $AAPL is entirely wrong.,1.0,0.0,0.0
26,727927351745503232,/DougKass/status/727927351745503232#m,DougKass,0.0,0.0,2016-05-04 06:26:00+00:00,1462343160000.0,@edibleapple RealMoneyPro: More hard questions for $AAPL Tim Cook. realmoneypro.thestreet.com/d…,0.0,0.0,0.0
27,727924709526929408,/DougKass/status/727924709526929408#m,DougKass,0.0,0.0,2016-05-04 06:15:00+00:00,1462342500000.0,"Thanks, I think!",1.0,0.0,0.0
28,727924293930078210,/DougKass/status/727924293930078210#m,DougKass,0.0,0.0,2016-05-04 06:14:00+00:00,1462342440000.0,@philiped More Hard Questions for Tim Cook realmoneypro.thestreet.com/d…,0.0,0.0,0.0
29,727919667998654468,/DougKass/status/727919667998654468#m,DougKass,0.0,0.0,2016-05-04 05:55:00+00:00,1462341300000.0,Thanks Tom. Jim Cramer will be happy - and I am sure he thanks you too! @jimcramer,0.0,1.0,0.0
30,727919486595010562,/DougKass/status/727919486595010562#m,DougKass,0.0,0.0,2016-05-04 05:55:00+00:00,1462341300000.0,Thanks ML I try. Not always successful!,1.0,0.0,0.0
31,727903259281645568,/DougKass/status/727903259281645568#m,DougKass,0.0,0.0,2016-05-04 04:50:00+00:00,1462337400000.0,@jimcramer $TSLA -$10 after mgt departures and Chanos admission of being short. I remain $TSLA short and stock on Best Ideas List RealMoney.,0.0,1.0,2.0
32,727901488383709184,/DougKass/status/727901488383709184#m,DougKass,0.0,0.0,2016-05-04 04:43:00+00:00,1462336980000.0,Buyers live higher and sellers live lower - in a world of machines and algos who have no sense of private market value/balance sheets,3.0,6.0,13.0
33,727899187602284544,/DougKass/status/727899187602284544#m,DougKass,0.0,0.0,2016-05-04 04:34:00+00:00,1462336440000.0,On RealMoneyPro: Now 3 longs and 22 shorts.,0.0,0.0,6.0
34,727897416125407233,/DougKass/status/727897416125407233#m,DougKass,0.0,0.0,2016-05-04 04:27:00+00:00,1462336020000.0,Chanos on Fast $ Halftime dissing China and $VRX. On RealMoneyPro- $FXI short last week's Trade of the Week. I wrote critically of $VRX Tues,2.0,3.0,10.0
35,727889954865479680,/DougKass/status/727889954865479680#m,DougKass,0.0,0.0,2016-05-04 03:57:00+00:00,1462334220000.0,From London Betting Parlor (Paddy Power) on The Donald's Manhood Odds! paddypower.com/bet/politics/…,2.0,0.0,3.0
36,727887890101862401,/DougKass/status/727887890101862401#m,DougKass,0.0,0.0,2016-05-04 03:49:00+00:00,1462333740000.0,"Talk to the sell side, Thomas Lee, OPCO, Wells Fargo etc. All bullish.",0.0,0.0,2.0
37,727886973541584896,/DougKass/status/727886973541584896#m,DougKass,0.0,0.0,2016-05-04 03:45:00+00:00,1462333500000.0,Press reports indicate that Kasich will bow out of his campaign this afternoon.,4.0,1.0,11.0
38,727886793245233152,/DougKass/status/727886793245233152#m,DougKass,0.0,0.0,2016-05-04 03:45:00+00:00,1462333500000.0,You have your facts wrong Dom.,2.0,0.0,0.0
39,727885149526892545,/DougKass/status/727885149526892545#m,DougKass,0.0,0.0,2016-05-04 03:38:00+00:00,1462333080000.0,$EWU short goes on my Best Ideas List. RealMoneyPro @jimcramer,0.0,0.0,2.0
40,727880996272508929,/DougKass/status/727880996272508929#m,DougKass,0.0,0.0,2016-05-04 03:22:00+00:00,1462332120000.0,I cant add any value to that!,0.0,0.0,2.0
41,727875800440020992,/DougKass/status/727875800440020992#m,DougKass,0.0,0.0,2016-05-04 03:01:00+00:00,1462330860000.0,"Yup, been adding.",0.0,2.0,2.0
42,727875752524292096,/DougKass/status/727875752524292096#m,DougKass,0.0,0.0,2016-05-04 03:01:00+00:00,1462330860000.0,@jimcramer An important follow up (shortly) to Jim's great interview with Tim Cook $AAPL on RealMoneyPro.,0.0,0.0,0.0
43,727872305804627968,/DougKass/status/727872305804627968#m,DougKass,0.0,0.0,2016-05-04 02:47:00+00:00,1462330020000.0,what else is new? and the bears are dogmatic!,2.0,1.0,2.0
44,727868828307230721,/DougKass/status/727868828307230721#m,DougKass,0.0,0.0,2016-05-04 02:33:00+00:00,1462329180000.0,First glance oil inventory numbers are a little bearish - big crude build.,1.0,3.0,5.0
45,727861628629307392,/DougKass/status/727861628629307392#m,DougKass,0.0,0.0,2016-05-04 02:05:00+00:00,1462327500000.0,Covered small trading rentals in $MS $GS and #MSFT Got plenty of shorts elsewhere. Initiating $EWU short.,1.0,1.0,3.0
46,727849310679896064,/DougKass/status/727849310679896064#m,DougKass,0.0,0.0,2016-05-04 01:16:00+00:00,1462324560000.0,"I dont discuss politics on Twitter or on RealMoneyPro. I took markets, stocks No one should be interested in my pol",2.0,1.0,6.0
47,727848710500171776,/DougKass/status/727848710500171776#m,DougKass,0.0,0.0,2016-05-04 01:13:00+00:00,1462324380000.0,"#jimcramer RealMoneyPro Best Ideas List: Only 3 longs but 21 shorts. A good shopping list, me thinkst.",0.0,3.0,2.0
48,727847716055830530,/DougKass/status/727847716055830530#m,DougKass,0.0,0.0,2016-05-04 01:09:00+00:00,1462324140000.0,Say it aint so,2.0,0.0,0.0
49,727834441746370560,/DougKass/status/727834441746370560#m,DougKass,0.0,0.0,2016-05-04 12:17:00+00:00,1462364220000.0,@jimcramer Another of the Many Peaks I See - PEAK JOBS! ADP disappoints.,1.0,1.0,2.0
50,727834297181310979,/DougKass/status/727834297181310979#m,DougKass,0.0,0.0,2016-05-04 12:16:00+00:00,1462364160000.0,Another of the Many Peaks I See - PEAK JOBS! ADP disappoints.,5.0,1.0,6.0
51,727833819680784384,/DougKass/status/727833819680784384#m,DougKass,0.0,0.0,2016-05-04 12:14:00+00:00,1462364040000.0,"@jimcramer In other news, General Francisco Franco is still dead and the NY Yankees lost again. piped.video/watch?v=butZyxI-…",3.0,0.0,1.0
52,727832651185410048,/DougKass/status/727832651185410048#m,DougKass,0.0,0.0,2016-05-04 12:10:00+00:00,1462363800000.0,"@tomkeene With Trump we stare at the Great Unknown, with Clinton we Know What We Get.",2.0,0.0,1.0
53,727828575412441088,/DougKass/status/727828575412441088#m,DougKass,0.0,0.0,2016-05-04 11:53:00+00:00,1462362780000.0,@zerohedge Biz media's moral obliquity is appalling as it heralds Steve Cohen's return as beau of Wall Street Ball.,0.0,0.0,1.0
54,727826882192912384,/DougKass/status/727826882192912384#m,DougKass,0.0,0.0,2016-05-04 11:47:00+00:00,1462362420000.0,@tomkeene @jimcramer @andrewrsorkin Biz media's moral obliquity is appalling as it heralds Steve Cohen's return as beau of Wall Street Ball.,0.0,0.0,3.0
55,727826122977759233,/DougKass/status/727826122977759233#m,DougKass,0.0,0.0,2016-05-04 11:44:00+00:00,1462362240000.0,"Not selling subscriptions, looking to respectfully debate some investment ideas and concepts.",1.0,0.0,6.0
56,727825275220860928,/DougKass/status/727825275220860928#m,DougKass,0.0,0.0,2016-05-04 11:40:00+00:00,1462362000000.0,"@jimcramer I honestly have alot of good stuff on RealMoney this morning on the markets, the election, EU bourses and of course, $AAPL.",0.0,0.0,2.0
57,727797883555188737,/DougKass/status/727797883555188737#m,DougKass,0.0,0.0,2016-05-04 09:51:00+00:00,1462355460000.0,"@jimcramer Opener on RealMoneyPro: ""Hey, Let's Be Careful Out There."" piped.video/watch?v=T2QApwtE…",0.0,0.0,0.0
58,727795523059630080,/DougKass/status/727795523059630080#m,DougKass,0.0,0.0,2016-05-04 09:42:00+00:00,1462354920000.0,The futures decline is now accelerating to the downside. -13 $SPY,3.0,3.0,4.0
59,727791757992300544,/DougKass/status/727791757992300544#m,DougKass,0.0,0.0,2016-05-04 09:27:00+00:00,1462354020000.0,Coming up on RMPro 1 More Questions for $AAPL 2. Market Thoughts 3. The latest political odds 3. My Newest Short Position,1.0,1.0,2.0
60,727677301492621312,/DougKass/status/727677301492621312#m,DougKass,0.0,0.0,2016-05-04 01:52:00+00:00,1462326720000.0,Totally incorrect. Millions of dollars around the world is bet at Paddy Power.,5.0,0.0,7.0
61,727676889213472768,/DougKass/status/727676889213472768#m,DougKass,0.0,0.0,2016-05-04 01:51:00+00:00,1462326660000.0,Paddy Power: Hilary 1/3 and The Donald down to 2/1 to win the Presidency in November! paddypower.com/bet/politics/…,1.0,4.0,4.0
62,727676526892748800,/DougKass/status/727676526892748800#m,DougKass,0.0,0.0,2016-05-04 01:49:00+00:00,1462326540000.0,"From London Betting Parlor, Paddy Power: Trump moves to 1/50 to win Repub nomination, Cruz falls to 33/1 paddypower.com/bet/politics/…",1.0,0.0,2.0
63,727676037069348864,/DougKass/status/727676037069348864#m,DougKass,0.0,0.0,2016-05-04 01:47:00+00:00,1462326420000.0,@jimcramer @andrewrsorkin One of my Surprises for 2016 on RealMoney comes to pass... Its Hilary vs The Donald. realmoney.thestreet.com/arti…,1.0,0.0,7.0
64,727659200579403778,/DougKass/status/727659200579403778#m,DougKass,0.0,0.0,2016-05-04 12:40:00+00:00,1462365600000.0,"No, she is the new CEO of $twtr",6.0,5.0,11.0
65,727659069037641729,/DougKass/status/727659069037641729#m,DougKass,0.0,0.0,2016-05-04 12:40:00+00:00,1462365600000.0,Carly Fiorina to head $TWTR,16.0,8.0,33.0
66,727658514802319360,/DougKass/status/727658514802319360#m,DougKass,0.0,0.0,2016-05-04 12:38:00+00:00,1462365480000.0,"@jimcramer NBC reports, Cruz to suspend campaign. @andrewrsorkin",1.0,0.0,4.0
67,727657397221621760,/DougKass/status/727657397221621760#m,DougKass,0.0,0.0,2016-05-04 12:33:00+00:00,1462365180000.0,NBC says Cruz to suspend campaign. msnbc.com/live-online/watch/…,3.0,9.0,18.0
68,727655881987350528,/DougKass/status/727655881987350528#m,DougKass,0.0,0.0,2016-05-04 12:27:00+00:00,1462364820000.0,Cruz now up. msnbc.com/live-online/watch/…,1.0,0.0,1.0
69,727655811434971136,/DougKass/status/727655811434971136#m,DougKass,0.0,0.0,2016-05-04 12:27:00+00:00,1462364820000.0,Carly speaks. msnbc.com/live-online/watch/…,0.0,0.0,1.0
70,727655350451609600,/DougKass/status/727655350451609600#m,DougKass,0.0,0.0,2016-05-04 12:25:00+00:00,1462364700000.0,NBC is saying Cruz might end his Presidential campaign this evening.,5.0,3.0,5.0
