,tweet_id,tweet_url,username,is_retweet,is_pinned,time,ts,text,replies,retweets,likes
0,962835533604052993,/DougKass/status/962835533604052993#m,DougKass,0.0,0.0,2018-02-11 11:47:00+00:00,1518349620000.0,Ten year us note yield + 2 1/2 basis points 2.86,2.0,6.0,23.0
1,962834254903246849,/DougKass/status/962834254903246849#m,DougKass,0.0,0.0,2018-02-11 11:42:00+00:00,1518349320000.0,Harry Potter wins pebble beach pga event,3.0,0.0,10.0
2,962712807635595264,/DougKass/status/962712807635595264#m,DougKass,0.0,0.0,2018-02-11 03:39:00+00:00,1518320340000.0,@jimcramer @tomkeene Coming up on @TSTRealMoneyPro A Successful Test Could Lead to A Tradeable Short Term Rally: But Trouble Lies Ahead Over the Balance of the Year,1.0,2.0,3.0
3,962706221437472768,/DougKass/status/962706221437472768#m,DougKass,0.0,0.0,2018-02-11 03:13:00+00:00,1518318780000.0,Let the lawsuits begin ... reuters.com/article/us-usa-f…,2.0,5.0,10.0
4,962520947126226945,/DougKass/status/962520947126226945#m,DougKass,0.0,0.0,2018-02-11 02:57:00+00:00,1518317820000.0,More Jennifer Hudson live in palm beach pscp.tv/w/bU5XGzI3MjYxfDFNbk…,0.0,0.0,6.0
5,962517644719964163,/DougKass/status/962517644719964163#m,DougKass,0.0,0.0,2018-02-11 02:44:00+00:00,1518317040000.0,Jennifer Hudson. Breakers hotel. Palm beach Florida. Dana faber cancer institute event pscp.tv/w/bU5UBzI3MjYxfDFkak…,3.0,1.0,11.0
6,962515963953348608,/DougKass/status/962515963953348608#m,DougKass,0.0,0.0,2018-02-11 02:37:00+00:00,1518316620000.0,Jennifer Hudson at breakers - Dana garner cancer institute pscp.tv/w/bU5SdzI3MjYxfDF2T3…,2.0,0.0,6.0
7,962511760136818688,/DougKass/status/962511760136818688#m,DougKass,0.0,0.0,2018-02-11 02:21:00+00:00,1518315660000.0,My interview on Bloomberg market surveillance on Friday morning bloomberg.com/news/videos/20…,0.0,5.0,16.0
8,962491848978812934,/DougKass/status/962491848978812934#m,DougKass,0.0,0.0,2018-02-11 01:01:00+00:00,1518310860000.0,"My week on Twitter 🎉: 638 Mentions, 1.19M Mention Reach, 2.77K Likes, 402 Retweets, 310 Replies. See yours with sumall.com/performancetweet?…",0.0,1.0,6.0
