,tweet_id,tweet_url,username,is_retweet,is_pinned,time,ts,text,replies,retweets,likes
0,472429129636524032,/DougKass/status/472429129636524032#m,DougKass,0.0,0.0,2014-05-30 05:27:00+00:00,1401427620000.0,"""Prepare for a Minsky Moment"" from TheStreet/Real Money Pro thestreet.com/story/12724898…",1.0,5.0,5.0
1,472371738245079040,/DougKass/status/472371738245079040#m,DougKass,0.0,0.0,2014-05-30 01:39:00+00:00,1401413940000.0,RT @RiskReversal: MorningWord 5/30/14: Hole Poking bit.ly/SjJLxT @DougKass <----quoted Thanks for this Danny!,0.0,1.0,0.0
2,472324229783109632,/DougKass/status/472324229783109632#m,DougKass,0.0,0.0,2014-05-30 10:30:00+00:00,1401445800000.0,"From RealMoneyPro/TheStreet: ""Prepare for a Minsky Moment"" thestreet.com/story/12724898…",1.0,1.0,4.0
3,472314040321318912,/DougKass/status/472314040321318912#m,DougKass,0.0,0.0,2014-05-30 09:50:00+00:00,1401443400000.0,On RealMoneyPro this morning - a look at the developing market divergences. $SPY,0.0,1.0,1.0
4,472313698141622272,/DougKass/status/472313698141622272#m,DougKass,0.0,0.0,2014-05-30 09:48:00+00:00,1401443280000.0,Two weeks ago I suggested new S&P highs led by the Five Horsemen of the Nasdaq and then a final top. Looks like it. As divergences develop.,1.0,5.0,8.0
5,472311957241200640,/DougKass/status/472311957241200640#m,DougKass,0.0,0.0,2014-05-30 09:42:00+00:00,1401442920000.0,It feels like deja vu all over again. Helocs jump+8% in 1Q online.wsj.com/articles/borr…,3.0,7.0,6.0
6,472311541015248896,/DougKass/status/472311541015248896#m,DougKass,0.0,0.0,2014-05-30 09:40:00+00:00,1401442800000.0,Fed's Lacker says inflation need not be too fast before rate rise. bloomberg.com/news/2014-05-2…,1.0,2.0,1.0
7,472310914491109376,/DougKass/status/472310914491109376#m,DougKass,0.0,0.0,2014-05-30 09:37:00+00:00,1401442620000.0,In yesterday's GDP report - corp profits (aft tax) dropped by 13.7% - largest decline since 2008. This augurs poorly for cap spending. $SPY,3.0,13.0,5.0
8,472310336138539009,/DougKass/status/472310336138539009#m,DougKass,0.0,0.0,2014-05-30 09:35:00+00:00,1401442500000.0,Banks deny KKR buyout loan as regulatory crackdowns heighten. reuters.com/article/2014/05/…,1.0,3.0,1.0
