,tweet_id,tweet_url,username,is_retweet,is_pinned,time,ts,text,replies,retweets,likes
0,20915805472,/DougKass/status/20915805472#m,DougKass,0.0,0.0,2010-08-11 08:54:00+00:00,1281516840000.0,csco citing the fed's concerns on the economy as similar to his. guiding down on sales in next quarter $$,0.0,4.0,2.0
1,20913097448,/DougKass/status/20913097448#m,DougKass,0.0,0.0,2010-08-11 08:10:00+00:00,1281514200000.0,i bought cso at 22.50 in after market following the so so quarter $$,0.0,3.0,0.0
2,20906224239,/DougKass/status/20906224239#m,DougKass,0.0,0.0,2010-08-11 06:19:00+00:00,1281507540000.0,TRAPPED http://bit.ly/bVQP7F $$,0.0,1.0,0.0
3,20905334303,/DougKass/status/20905334303#m,DougKass,0.0,0.0,2010-08-11 06:05:00+00:00,1281506700000.0,"Kass: Trapped!: We are in a liquidity, tax and regulatory trap. http://bit.ly/d5YtNJ $$",0.0,4.0,1.0
4,20901437129,/DougKass/status/20901437129#m,DougKass,0.0,0.0,2010-08-11 05:05:00+00:00,1281503100000.0,"Coming up.. a liquidity, tax and regulatory trap... we are trapped! http://bit.ly/9SAR35 $$",0.0,1.0,0.0
5,20890175705,/DougKass/status/20890175705#m,DougKass,0.0,0.0,2010-08-11 02:34:00+00:00,1281494040000.0,"with the june deficit balooning, look for 2Q2010 GDP to be revised lower to 0.5% later in the month $$",0.0,9.0,3.0
