,tweet_id,tweet_url,username,is_retweet,is_pinned,time,ts,text,replies,retweets,likes
0,1194728246186856453,/DougKass/status/1194728246186856453#m,DougKass,0.0,0.0,2019-11-13 09:26:00+00:00,1573637160000.0,$CSCO spits the bit.,3.0,0.0,5.0
1,1194727425168556037,/DougKass/status/1194727425168556037#m,DougKass,0.0,0.0,2019-11-13 09:23:00+00:00,1573636980000.0,"You know I like you and respect your work. We had dinner together and got along. I just dont get it unless its in defense of someone else. I really dont, Tim.",1.0,0.0,4.0
2,1194721977614962689,/DougKass/status/1194721977614962689#m,DougKass,0.0,0.0,2019-11-13 09:01:00+00:00,1573635660000.0,"You are better than this, Tim.",3.0,0.0,2.0
3,1194721268353900545,/DougKass/status/1194721268353900545#m,DougKass,0.0,0.0,2019-11-13 08:58:00+00:00,1573635480000.0,"Its funny how you contradict the one for all and all for one argument with tweets like this. I commented on you and @aztecs99 ""tag teaming"" me in our Comments Section. Bring it on but me true to your school and dont contradict yourself. More in my opener on @realmoney tomorrow.",1.0,0.0,2.0
4,1194688214138785793,/DougKass/status/1194688214138785793#m,DougKass,0.0,0.0,2019-11-13 06:47:00+00:00,1573627620000.0,Losing interest Billy.,0.0,0.0,5.0
5,1194688050997137409,/DougKass/status/1194688050997137409#m,DougKass,0.0,0.0,2019-11-13 06:46:00+00:00,1573627560000.0,What I don't understand is why would anyone vote for Congressman Jim Jordan? washingtonpost.com/ I don't get it. But maybe its my bias.,13.0,1.0,20.0
6,1194687622427361281,/DougKass/status/1194687622427361281#m,DougKass,0.0,0.0,2019-11-13 06:45:00+00:00,1573627500000.0,@TVMTrader,1.0,0.0,2.0
7,1194687255945895943,/DougKass/status/1194687255945895943#m,DougKass,0.0,0.0,2019-11-13 06:43:00+00:00,1573627380000.0,Ollie and Daisy- playtime this morning @TVMTrader,2.0,0.0,16.0
8,1194684771751940096,/DougKass/status/1194684771751940096#m,DougKass,0.0,0.0,2019-11-13 06:33:00+00:00,1573626780000.0,"Contributing on Twitter is losing value to me, JA.",8.0,1.0,11.0
9,1194671247625523200,/DougKass/status/1194671247625523200#m,DougKass,0.0,0.0,2019-11-13 05:39:00+00:00,1573623540000.0,I wrote this update at 720AM on @realmoney the morning after the $DIS report on what I was doing with the stock and my analysis of qtr. Its behind the paywall. realmoney.thestreet.com/doug… My responsibility is to real money subs not Twitterettes.,2.0,1.0,6.0
10,1194670509096677382,/DougKass/status/1194670509096677382#m,DougKass,0.0,0.0,2019-11-13 05:36:00+00:00,1573623360000.0,"I had tweeted this out Brian: Nov 07, 2019 | 03:31 PM EST DOUG KASS Disney Earnings I am staying short into the Disney (DIS) earnings release after the close. I don't expect an upside quarter and I anticipate a mediocre 2020 guide.",0.0,1.0,3.0
11,1194650864545419264,/DougKass/status/1194650864545419264#m,DougKass,0.0,0.0,2019-11-13 04:18:00+00:00,1573618680000.0,"Counting the words I write on a daily basis, data mining my posts - enough said. Enjoy the day, all - I have to go back to work.",1.0,0.0,3.0
12,1194650301460029442,/DougKass/status/1194650301460029442#m,DougKass,0.0,0.0,2019-11-13 04:16:00+00:00,1573618560000.0,"On your profile it says you joined Twitter in October, 2019. Respectfully, how would you know what I have been or have not been doing over the last 22 years during which I have written a diary on @realmoney?",7.0,0.0,25.0
13,1194650000556462083,/DougKass/status/1194650000556462083#m,DougKass,0.0,0.0,2019-11-13 04:15:00+00:00,1573618500000.0,If you were a doctor Jeff would you have an obligations to your patients or to people on Twitter? If you were a plumber Jeff would you have the responsbility of repairing the plumbing of your clients or to the people on Twitter?,1.0,0.0,3.0
14,1194649543624790016,/DougKass/status/1194649543624790016#m,DougKass,0.0,0.0,2019-11-13 04:13:00+00:00,1573618380000.0,You are just not being observant Jeff. That is not only inaccurate but on @realmoney I post winners losers (unlike many who fail to follow up) and breakevens on a routine basis. I dont work for Twitter and I have no obligation to Twitter as I do on @realmoney. Done discussing.,0.0,0.0,4.0
15,1194647768616316928,/DougKass/status/1194647768616316928#m,DougKass,0.0,0.0,2019-11-13 04:06:00+00:00,1573617960000.0,Are you aware that Real Money Pro subscribers pay for the service and persons on Twitter don't pay for the analysis? Come on Tim.,1.0,0.0,7.0
16,1194647240884805632,/DougKass/status/1194647240884805632#m,DougKass,0.0,0.0,2019-11-13 04:04:00+00:00,1573617840000.0,"Tim, please don't go there. You have no idea what my contributions are or are not away from my columns. * I dont need help sleeping. * I dont work for Twitter. Subs interact on Comments Section - which is a closed community to subs.",0.0,0.0,4.0
17,1194646500267188225,/DougKass/status/1194646500267188225#m,DougKass,0.0,0.0,2019-11-13 04:01:00+00:00,1573617660000.0,"I dont hang out on Twitter. I dont work for Twitter. I work for @realmoney, Tim. Subscriber are helped by interacting in our Comments Section not in the public domain on Twitter. Twitter is my personal account not a professional account. Just unfollow me if you feel so. Easy.",2.0,0.0,10.0
18,1194645687662776323,/DougKass/status/1194645687662776323#m,DougKass,0.0,0.0,2019-11-13 03:58:00+00:00,1573617480000.0,I don't work for Twitter. As to accuracy of my statements and disclosures I stick to my principles - I dont cherry pick winners and sweep losers under the carpet as many in the media do. I own up to my losers in the best way I can given the amount of trading I do.,1.0,0.0,1.0
19,1194645688585539587,/DougKass/status/1194645688585539587#m,DougKass,0.0,0.0,2019-11-13 03:58:00+00:00,1573617480000.0,I have been doing this for 22 years and hopefully will be doing it for a few more years.,3.0,0.0,6.0
20,1194645683770478592,/DougKass/status/1194645683770478592#m,DougKass,0.0,0.0,2019-11-13 03:58:00+00:00,1573617480000.0,"@revshark Rev and I are fine. Thanks. I didnt jab at him we have differences of opinion that we have covered extensively and respectfully on @realmoney. This morning as I have had in past, I said both technical and fundamental analysis has lost SOME of its value over the",1.0,0.0,1.0
21,1194645686765137922,/DougKass/status/1194645686765137922#m,DougKass,0.0,0.0,2019-11-13 03:58:00+00:00,1573617480000.0,"short term because of the dominance of products and strategies geared towards price momentum (e.g. quants, etfs). I really don't have time (I have two day jobs) to answer questions routinely on Twitter - and I am more off it than on it as a result. I don't hang out on Twitter.",1.0,0.0,1.0
22,1194643305939767298,/DougKass/status/1194643305939767298#m,DougKass,0.0,0.0,2019-11-13 03:48:00+00:00,1573616880000.0,"dont have the time to take on challenges from all that disagree. If I responded to them all, I would be working thirty hours a day and not getting any work done. The fact is that I have been an advocate for you for years - that clearly was to no avail and came on deaf ears.",0.0,0.0,6.0
23,1194626597376016386,/DougKass/status/1194626597376016386#m,DougKass,0.0,0.0,2019-11-13 02:42:00+00:00,1573612920000.0,"And, by the way, I see other influences (such as central bank liquidity, the popularity of ETFs and other factors) as making fundamental analysis less valuable in gauging stock prices over the short term, as well. @hmeisler @revshark",0.0,0.0,4.0
24,1194626092398571534,/DougKass/status/1194626092398571534#m,DougKass,0.0,0.0,2019-11-13 02:40:00+00:00,1573612800000.0,"You are taking my comments that the dominance of passive strategies is making the charts and TA less useful and concluding, inaccurately, that I am saying TA is useless. Come on now, Rev - you know better than to write that, as I am not saying that at all.",1.0,0.0,1.0
25,1194624246544093184,/DougKass/status/1194624246544093184#m,DougKass,0.0,0.0,2019-11-13 02:33:00+00:00,1573612380000.0,"You might think that these influences make it easier, Rev. But I think it makes it harder and, again, less predictable to rely on stock prices/charts because ""price is not necessarily truth."" Its artificial.",0.0,0.0,3.0
26,1194624018122301440,/DougKass/status/1194624018122301440#m,DougKass,0.0,0.0,2019-11-13 02:32:00+00:00,1573612320000.0,"I have a different view, respectfully. And mine comes from my time frames. Charts ruined (and as a consequence TA loses SOME value) because of the dominance (75% of trading) of passive products/strategies that artificially influence the short term course of products.",3.0,0.0,2.0
27,1194622588720304130,/DougKass/status/1194622588720304130#m,DougKass,0.0,0.0,2019-11-13 02:26:00+00:00,1573611960000.0,"Twitter is not the correct forum for this I have written thousands of world on @realmoney regarding the impact of passive products and strategies (etfs, risk parity etc) on trading and prices. The artificiality of these trend following products have made charts and TA less valued",0.0,1.0,3.0
28,1194606699623174144,/DougKass/status/1194606699623174144#m,DougKass,0.0,0.0,2019-11-13 01:23:00+00:00,1573608180000.0,"Referencing Trump Derangement Syndrome (TDS) is a convenient default against respectful debate, Teal.",1.0,0.0,9.0
29,1194606465136414720,/DougKass/status/1194606465136414720#m,DougKass,0.0,0.0,2019-11-13 01:22:00+00:00,1573608120000.0,"Thanks for your advice. But it appears I hold to different views than you do, respectfully.",1.0,0.0,7.0
30,1194605783511687168,/DougKass/status/1194605783511687168#m,DougKass,0.0,0.0,2019-11-13 01:19:00+00:00,1573607940000.0,"Your request for negative interest rates is stupid @realdonaldtrump It worked poorly for Europe's and Japan's economy and has gutted their banking systems. Just ask Sir Larry @larry_kudlow Seriously, did you even attend your Wharton classes? Dougie Kass Wharton, 1972",2.0,3.0,31.0
31,1194604510167097345,/DougKass/status/1194604510167097345#m,DougKass,0.0,0.0,2019-11-13 01:14:00+00:00,1573607640000.0,"@ewarren Billionaires have grown their wealth exponentially thanks to monetary policy (that benefited those with large balance sheets consisting of equities and real estate) and tax policy (carried interest, preferential real estate exchanges). Some payback is reasonable.",4.0,0.0,3.0
32,1194604415392583685,/DougKass/status/1194604415392583685#m,DougKass,0.0,0.0,2019-11-13 01:14:00+00:00,1573607640000.0,@SquawkCNBC @cnbcfastmoney @jimcramer @tomkeene @ewarren @business @Sarge986,0.0,0.0,0.0
33,1194597507537473542,/DougKass/status/1194597507537473542#m,DougKass,0.0,0.0,2019-11-13 12:46:00+00:00,1573649160000.0,"@andrewrsorkin Billionaires have grown their wealth exponentially thanks to monetary policy (that benefited those with large balance sheets consisting of equities and real estate) and tax policy (carried interest, preferential real estate exchanges). Some payback is reasonable.",0.0,1.0,9.0
34,1194597060923801600,/DougKass/status/1194597060923801600#m,DougKass,0.0,0.0,2019-11-13 12:45:00+00:00,1573649100000.0,"""Supply side economic"" again is not working despite Larry Kudlow's protestations. Most 4Q estimates for real GDP growth are one percent or less now. The promise of +4% growth is fake economic news. @cnbcfastmoney @riskreversal @tomkeene",2.0,0.0,21.0
35,1194595488940613635,/DougKass/status/1194595488940613635#m,DougKass,0.0,0.0,2019-11-13 12:38:00+00:00,1573648680000.0,On @realmoney The (Market's) L-I-B-I-D-O Is In Overdrive * But is the market's insatiable sex drive to be trusted? * In the merry old land of Oz piped.video/watch?v=YGAPKnHc… @jimcramer @tomkeene @SquawkCNBC @cnbcfastmoney @riskreversal,1.0,0.0,4.0
36,1194593806114545664,/DougKass/status/1194593806114545664#m,DougKass,0.0,0.0,2019-11-13 12:32:00+00:00,1573648320000.0,Knowledge@Wharton Why older entrepeneurs have an edge. knowledge.wharton.upenn.edu/…,0.0,0.0,6.0
37,1194588612911935495,/DougKass/status/1194588612911935495#m,DougKass,0.0,0.0,2019-11-13 12:11:00+00:00,1573647060000.0,@SquawkCNBC @andrewrsorkin @beckyquick Moreover difference between GAAP and Non GAAP has never been greater. 20 years ago half of the S&P used GAAP - today only 5% uses GAAP!,1.0,1.0,1.0
38,1194588120660008965,/DougKass/status/1194588120660008965#m,DougKass,0.0,0.0,2019-11-13 12:09:00+00:00,1573646940000.0,"@SquawkCNBC @andrewrsorkin @beckyquick Krishna and the bulls are optimistic. But if EPS growth is +5% next year we must have a further reset of valuations. But since all gain in 2019 was higher PEs, how does this happen?",2.0,0.0,0.0
39,1194587852971098113,/DougKass/status/1194587852971098113#m,DougKass,0.0,0.0,2019-11-13 12:08:00+00:00,1573646880000.0,The Fed is pushing on a string. It is not the cost or availability of money that is slowing the domestic economy.,2.0,0.0,11.0
40,1194567487083491328,/DougKass/status/1194567487083491328#m,DougKass,0.0,0.0,2019-11-13 10:47:00+00:00,1573642020000.0,"Coming up this morning on @realmoney ""The (Market's) L-I-B-I-D-O Is In Overdrive"" (What do I mean by Libido? An exclamation will be forthcoming!) @jimcramer @tomkeene @SquawkCNBC @cnbcfastmoney @lizclaman @business @riskreversal @guyadami @terranovajoe @andrewrsorkin @beckyquick",1.0,0.0,5.0
41,1194559263085084672,/DougKass/status/1194559263085084672#m,DougKass,0.0,0.0,2019-11-13 10:14:00+00:00,1573640040000.0,The only certainty sir Thomas is the lack of certainty.,3.0,0.0,5.0
42,1194558281034977280,/DougKass/status/1194558281034977280#m,DougKass,0.0,0.0,2019-11-13 10:11:00+00:00,1573639860000.0,@SullyCNBC Ask every bullish talking head to respond to this: Notwithstanding the strong and persistent price momentum I don't see the basis for further gains: * The Fed Is Pushing on A String: The Fed has now cut three times and there is no meaningful improvement in the domestic,1.0,0.0,6.0
43,1194558281966071808,/DougKass/status/1194558281966071808#m,DougKass,0.0,0.0,2019-11-13 10:11:00+00:00,1573639860000.0,"economic data. Indeed, as mentioned in an earlier post, fourth-quarter Real GDP growth forecasts have moved to 1% or less from 3% in the first-quarter of 2019 and 1.9% in the third quarter. * Nor Are Some Stocks Higher From Easier Money: The Russell Index, supposed to be levered",1.0,0.0,2.0
44,1194558283085946880,/DougKass/status/1194558283085946880#m,DougKass,0.0,0.0,2019-11-13 10:11:00+00:00,1573639860000.0,"to domestic growth, is only 1% higher since the first rate cut in July Meanwhile the CRB Index is down by over 3% and the 10-year TIPS breakeven is 20 basis points lower (to 1.55%) since that first cut in the federal funds rate. @SullyCNBC @fundstrat @SquawkCNBC @cnbcfastmoney",1.0,0.0,7.0
45,1194558283920683011,/DougKass/status/1194558283920683011#m,DougKass,0.0,0.0,2019-11-13 10:11:00+00:00,1573639860000.0,@tomkeene @business,1.0,0.0,0.0
46,1194557527658258433,/DougKass/status/1194557527658258433#m,DougKass,0.0,0.0,2019-11-13 10:08:00+00:00,1573639680000.0,"Every talking head says the same thing - stock prices are a forward indicator and are signalling economic strength ahead. I disagree, especially in a changing market structure, ""Price is not truth."" @SullyCNBC @SquawkCNBC",7.0,7.0,48.0
47,1194556007961235456,/DougKass/status/1194556007961235456#m,DougKass,0.0,0.0,2019-11-13 10:02:00+00:00,1573639320000.0,S&P futures -14 It must be a misprint,8.0,0.0,33.0
