,tweet_id,tweet_url,username,is_retweet,is_pinned,time,ts,text,replies,retweets,likes
0,1033461985827069952,/DougKass/status/1033461985827069952#m,DougKass,0.0,0.0,2018-08-25 09:11:00+00:00,1535188260000.0,What a catch in the Little League World Series! This is the greatest show!!! piped.video/watch?v=NyVYXRD1…,2.0,1.0,8.0
1,1033459555936690177,/DougKass/status/1033459555936690177#m,DougKass,0.0,0.0,2018-08-25 09:02:00+00:00,1535187720000.0,"So what kind of week in the market was it? The President became an un indicted co-conspirator, the China trade negotiations quickly closed producing nothing, evidence is growing that North Korea is continuing its nuclear program, the President tries to interfere with the Fed",10.0,0.0,21.0
2,1033459556930736129,/DougKass/status/1033459556930736129#m,DougKass,0.0,0.0,2018-08-25 09:02:00+00:00,1535187720000.0,and truth is not truth And the market soars @JIMCRAMER @tomkeene @andrewrsorkin @carlquintanilla,5.0,2.0,22.0
3,1033433612425801729,/DougKass/status/1033433612425801729#m,DougKass,0.0,0.0,2018-08-25 07:19:00+00:00,1535181540000.0,Great intro to US Little League World Series playoff at 4 - now on ABC. Featuring Mets' Todd Frazier who won it twenty years ago with the New Jersey team from Tom's River.,0.0,0.0,5.0
4,1033298665253859329,/DougKass/status/1033298665253859329#m,DougKass,0.0,0.0,2018-08-25 10:22:00+00:00,1535192520000.0,"Best weekend of the year for Baseball. At Williamsport, Pa. - the Little League World Series semis and finals. bleacherreport.com/articles/…",1.0,0.0,4.0
5,1033289358747611137,/DougKass/status/1033289358747611137#m,DougKass,0.0,0.0,2018-08-25 09:45:00+00:00,1535190300000.0,$PZZA nypost.com/2018/08/24/papa-j…,2.0,0.0,4.0
6,1033284944070627329,/DougKass/status/1033284944070627329#m,DougKass,0.0,0.0,2018-08-25 09:28:00+00:00,1535189280000.0,"@elonmusk In a 11:15PM Friday announcement Elon Mus(t)k declares $TSLA won't go private tesla.com/blog/staying-publi… as predicted on @realmoney the day of the ""going private"" announcement. @jimcramer @tomkeene @andrewrsorkin @carlquintanilla Proving again, among other things,",3.0,1.0,7.0
7,1033284945047891968,/DougKass/status/1033284945047891968#m,DougKass,0.0,0.0,2018-08-25 09:28:00+00:00,1535189280000.0,"that he represents just another company that brings bad news to shareholders on a quiet Friday night in the Summer. realmoneypro.thestreet.com/d… This is an, old and proven strategy of not immediately facing critics or regulatory bodies. But this @elonmusk charade will not go away",3.0,3.0,24.0
