,tweet_id,tweet_url,username,is_retweet,is_pinned,time,ts,text,replies,retweets,likes
0,568196824592453632,/DougKass/status/568196824592453632#m,DougKass,0.0,0.0,2015-02-18 11:54:00+00:00,1424260440000.0,Aliza at best restaurant ever in palm beach THE KITCHEN tonite. Amazing!!!,1.0,0.0,4.0
1,568179352350769152,/DougKass/status/568179352350769152#m,DougKass,0.0,0.0,2015-02-18 10:44:00+00:00,1424256240000.0,"Ok, enough of this ad, already. piped.video/watch?v=BBXCW-l8…",6.0,1.0,4.0
2,568166653281722368,/DougKass/status/568166653281722368#m,DougKass,0.0,0.0,2015-02-18 09:54:00+00:00,1424253240000.0,@wdw001 Own none of them now Bill.,0.0,0.0,0.0
3,568115550502547456,/DougKass/status/568115550502547456#m,DougKass,0.0,0.0,2015-02-18 06:31:00+00:00,1424241060000.0,"@codywillard Thanks, but I am 110% committed to TheStreet and RealMoneyPro, Cody.",1.0,0.0,0.0
4,568096340535717889,/DougKass/status/568096340535717889#m,DougKass,0.0,0.0,2015-02-18 05:14:00+00:00,1424236440000.0,@codywillard Thanks Cody. I hope you are well!,3.0,0.0,1.0
5,568080722772119552,/DougKass/status/568080722772119552#m,DougKass,0.0,0.0,2015-02-18 04:12:00+00:00,1424232720000.0,"Coming up on RealMoneyPro: ""It's All About That Bass"" piped.video/watch?v=7PCkvCPv…",2.0,3.0,1.0
6,568043752570253312,/DougKass/status/568043752570253312#m,DougKass,0.0,0.0,2015-02-18 01:45:00+00:00,1424223900000.0,from third parties to engage and pursue a strategic transaction with the company. $HLSS biz.yahoo.com/e/150218/hlss8…,0.0,2.0,1.0
7,568043696484003840,/DougKass/status/568043696484003840#m,DougKass,0.0,0.0,2015-02-18 01:45:00+00:00,1424223900000.0,"In an 8-K filing today, HLSS (a recent purchase on RealMoneyPro) has announced that it has received multiple proposals",2.0,1.0,1.0
8,568024552145440769,/DougKass/status/568024552145440769#m,DougKass,0.0,0.0,2015-02-18 12:29:00+00:00,1424262540000.0,"Coming up on RealMoneyPro: ""It's My Party and I'll Cry if I Want To (You Would Cry Too if it Happened to You!)"" piped.video/watch?v=XsYJyVEU…",4.0,0.0,4.0
