,tweet_id,tweet_url,username,is_retweet,is_pinned,time,ts,text,replies,retweets,likes
0,1646186815198490627,/DougKass/status/1646186815198490627#m,DougKass,0.0,0.0,2023-04-12 04:21:00+00:00,1681273260000.0,Calling it the way I see it... Wharton's Dr. Jeremy Siegel is another flip flopper. @ScottWapnerCNBC @riskreversal @guyadami @tomkeene @business,17.0,5.0,85.0
1,1646177894719275009,/DougKass/status/1646177894719275009#m,DougKass,0.0,0.0,2023-04-12 03:46:00+00:00,1681271160000.0,"Apr 12, 2023 | 11:38 AM EDT DOUG KASS Three Moves I covered most of my ($QQQ) trading short rental at $314.01. Will reshort on strength. @realmoney @dougkass @tomkeene @ferrotv @riskreversal",4.0,0.0,30.0
2,1646144380426747905,/DougKass/status/1646144380426747905#m,DougKass,0.0,0.0,2023-04-12 01:32:00+00:00,1681263120000.0,"Apr 12, 2023 | 08:50 AM EDT DOUG KASS @realmoney @dougkass Moved to Medium Sized in QQQ Short I put on a large ($QQQ) short at $319.09 on the cold inflation print. @tomkeen",2.0,2.0,26.0
3,1646091602937495554,/DougKass/status/1646091602937495554#m,DougKass,0.0,0.0,2023-04-12 10:03:00+00:00,1681293780000.0,You have to look at the other side of hedge funds' books - portfolio longs (which are at record levels)... and net out short futures. @dougkass,7.0,4.0,41.0
4,1646078881932140544,/DougKass/status/1646078881932140544#m,DougKass,0.0,0.0,2023-04-12 09:12:00+00:00,1681290720000.0,"Apr 11, 2023 | 09:40 AM EDT DOUG KASS Fasten Your Seatbelts - First Time, Long Time! I am short ($BITO) (bitcoin) at $18.04. @jimcramer @tomkeene @lisaabramowicz1 @ferrotv @business @ScottWapnerCNBC @carlquintanilla @riskreversal @guyadami @cnbcfastmoney @KeithMcCullough",4.0,1.0,30.0
