,tweet_id,tweet_url,username,is_retweet,is_pinned,time,ts,text,replies,retweets,likes
0,1086758214782410752,/DougKass/status/1086758214782410752#m,DougKass,0.0,0.0,2019-01-19 10:52:00+00:00,1547895120000.0,Rev - You know better and are too smart to counter with a straw man fallacy. thoughtco.com/straw-man-fall… Nite,2.0,1.0,11.0
1,1086756301567418368,/DougKass/status/1086756301567418368#m,DougKass,0.0,0.0,2019-01-19 10:44:00+00:00,1547894640000.0,"To some, like myself, Rev, the border wall is a physical representation of the cultural and racial insults President Trump has spewed since his campaign announcement.",18.0,4.0,56.0
2,1086756302481772544,/DougKass/status/1086756302481772544#m,DougKass,0.0,0.0,2019-01-19 10:44:00+00:00,1547894640000.0,"A physical wall is also a wasteful expenditure of taxpayer dollars, stomps on property rights of private landowners, has unknown environmental and wildlife ramifications and stifles economic activity and drain money that’s badly needed to create jobs, fund schools, and repair",9.0,2.0,16.0
3,1086756303396134912,/DougKass/status/1086756303396134912#m,DougKass,0.0,0.0,2019-01-19 10:44:00+00:00,1547894640000.0,"beaten-up roads. There is currently a record-low levels of northbound apprehensions, For example, El Paso is the safest city in the country, and not a single terrorist or terror plot that has used our connection with Mexico to do us harm.",5.0,2.0,12.0
4,1086756304083976193,/DougKass/status/1086756304083976193#m,DougKass,0.0,0.0,2019-01-19 10:44:00+00:00,1547894640000.0,"Border crossing rates have gone down for twenty straight years, according to U.S. Customs and Border Protection (CBP), part of a long-term trend that started long before Trump came into office. Irrational, obsessive focus on the border will prevent us from stopping threats where",2.0,4.0,32.0
5,1086756304696328193,/DougKass/status/1086756304696328193#m,DougKass,0.0,0.0,2019-01-19 10:44:00+00:00,1547894640000.0,"they really exist and will waste precious resources that are needed elsewhere. The future of border security lies in manpower and smart technology, not medieval defenses. The wall is nothing more than a campaign slogan/promise - with little justification imho.",12.0,4.0,54.0
6,1086737702198874113,/DougKass/status/1086737702198874113#m,DougKass,0.0,0.0,2019-01-19 09:30:00+00:00,1547890200000.0,No mention whatsoever about the workers that are suffering from the shutdown of government. @realdonaldtrump the vast majority are outside Washington DC Paany other president not consulted by miller would have included them in the conversation.,12.0,0.0,40.0
7,1086731611876585473,/DougKass/status/1086731611876585473#m,DougKass,0.0,0.0,2019-01-19 09:06:00+00:00,1547888760000.0,Rev - Are you aware that all @realdonaldtrump is doing is returning to what was taken away by the Administration (regarding DACA protection)?,10.0,2.0,33.0
