,tweet_id,tweet_url,username,is_retweet,is_pinned,time,ts,text,replies,retweets,likes
0,17975066591,/DougKass/status/17975066591#m,DougKass,0.0,0.0,2010-07-07 07:48:00+00:00,1278488880000.0,"Kass: Fun and Fisticuffs on 'Fast Money': On last night's show, I essentially argued that the markets are tracin... http://bit.ly/9Lkcxd $$",0.0,0.0,2.0
1,17974757429,/DougKass/status/17974757429#m,DougKass,0.0,0.0,2010-07-07 07:44:00+00:00,1278488640000.0,fun and fisticuffs on fast money http://bit.ly/areHlC $$,0.0,1.0,1.0
2,17965169637,/DougKass/status/17965169637#m,DougKass,0.0,0.0,2010-07-07 05:22:00+00:00,1278480120000.0,@jbeyda ummm... to make money on a trade! $$,0.0,0.0,0.0
3,17963991900,/DougKass/status/17963991900#m,DougKass,0.0,0.0,2010-07-07 05:05:00+00:00,1278479100000.0,i am taking a $2 profit in Spiders bought earlier today $$,0.0,2.0,1.0
4,17958914929,/DougKass/status/17958914929#m,DougKass,0.0,0.0,2010-07-07 03:53:00+00:00,1278474780000.0,here is my interview with jon najarian this morning on yahoo tech ticker http://yhoo.it/bHhHnA $$,0.0,7.0,6.0
5,17944776675,/DougKass/status/17944776675#m,DougKass,0.0,0.0,2010-07-07 12:26:00+00:00,1278505560000.0,fun and fisticuffs on fast money last nite !! http://bit.ly/adOVZf $$,0.0,4.0,2.0
6,17944737740,/DougKass/status/17944737740#m,DougKass,0.0,0.0,2010-07-07 12:26:00+00:00,1278505560000.0,i just paid 102.60 for long spider trading position,0.0,0.0,2.0
7,17944723884,/DougKass/status/17944723884#m,DougKass,0.0,0.0,2010-07-07 12:25:00+00:00,1278505500000.0,i just paid 102.60 for long spider trading position $$,0.0,3.0,1.0
