,tweet_id,tweet_url,username,is_retweet,is_pinned,time,ts,text,replies,retweets,likes
0,607645913062842369,/DougKass/status/607645913062842369#m,DougKass,0.0,0.0,2015-06-07 08:30:00+00:00,1433665800000.0,"""Beautiful Dreamer"" piped.video/watch?v=0SriaRRc…",1.0,0.0,3.0
1,607643286027649025,/DougKass/status/607643286027649025#m,DougKass,0.0,0.0,2015-06-07 08:20:00+00:00,1433665200000.0,"Movie ""Love and Mercy"" is a brilliant. story of Beach Boys' Brian Wilson life. Cusack gets Oscar nomination, imho. piped.video/watch?v=lioWzrpC…",2.0,2.0,5.0
2,607583850588299264,/DougKass/status/607583850588299264#m,DougKass,0.0,0.0,2015-06-07 04:24:00+00:00,1433651040000.0,Fantastic French Open Final going on now. Fourth set. Wawrinka to upset Djokovic?,4.0,1.0,5.0
3,607516979923025920,/DougKass/status/607516979923025920#m,DougKass,0.0,0.0,2015-06-07 11:58:00+00:00,1433678280000.0,"Coming up on RealMoneyPro tomorrow morning: ""Uncle Doug's Band"" piped.video/watch?v=n4-_V__G…",1.0,1.0,2.0
4,607507460354473984,/DougKass/status/607507460354473984#m,DougKass,0.0,0.0,2015-06-07 11:20:00+00:00,1433676000000.0,"Anshu Jain and Juergen Fitschen, co-chief executives of Deutsche Bank, are planning to resign.",0.0,0.0,0.0
5,607493712940122113,/DougKass/status/607493712940122113#m,DougKass,0.0,0.0,2015-06-07 10:26:00+00:00,1433672760000.0,American Pharoah wins the Triple Crown! piped.video/watch?v=ctss9h26…,2.0,4.0,1.0
