,tweet_id,tweet_url,username,is_retweet,is_pinned,time,ts,text,replies,retweets,likes
0,1090584997260656641,/DougKass/status/1090584997260656641#m,DougKass,0.0,0.0,2019-01-30 12:18:00+00:00,1548850680000.0,Enjoy the day and week. Back on Monday. Invest and trade well!,5.0,1.0,26.0
1,1090578784867270657,/DougKass/status/1090578784867270657#m,DougKass,0.0,0.0,2019-01-30 11:53:00+00:00,1548849180000.0,"I dont and never have understood the Bears v. Bulls argument. Mr. Market doesnt think in those terms. Its ""us"" v. Mr. Market. The biggest problem most of us have with trading/investing is ourselves. Our fears, dogmas, unwillingness to do homework and greed.",2.0,3.0,38.0
2,1090578785664229376,/DougKass/status/1090578785664229376#m,DougKass,0.0,0.0,2019-01-30 11:53:00+00:00,1548849180000.0,"As Pogo said, ""we have met the enemy and he is us.""",1.0,1.0,14.0
3,1090577579529125888,/DougKass/status/1090577579529125888#m,DougKass,0.0,0.0,2019-01-30 11:48:00+00:00,1548848880000.0,"We maybe entering an earnings recession, yet bullish talking heads are discussing misses that are better than expectations I am mindful of Monty Python's Upper Class Twit of the Year - contestants Nigel Incubator Jones who's best friend is a tree and in the spare time he",4.0,0.0,8.0
4,1090577580577771522,/DougKass/status/1090577580577771522#m,DougKass,0.0,0.0,2019-01-30 11:48:00+00:00,1548848880000.0,is a stock broker. piped.video/watch?v=k5ba1OKY… @tomkeene @beckyquick @squawkcnbc @cnbcfastmoney @tomkeene @jimcramer @lizclaman @TeamCavuto,0.0,0.0,7.0
5,1090575487569719296,/DougKass/status/1090575487569719296#m,DougKass,0.0,0.0,2019-01-30 11:40:00+00:00,1548848400000.0,"Oh, shit... he is awake",4.0,2.0,35.0
6,1090575121511792641,/DougKass/status/1090575121511792641#m,DougKass,0.0,0.0,2019-01-30 11:39:00+00:00,1548848340000.0,@EconguyRosie,0.0,0.0,0.0
7,1090569213696270336,/DougKass/status/1090569213696270336#m,DougKass,0.0,0.0,2019-01-30 11:15:00+00:00,1548846900000.0,"Group stink is always visible this early in the morning. Think not first level, but second level. And avoid the crowds, mostly. Invest using a calculator and a contrarian streak. Keep your children and portfolios away from the self confident. And do your homework. Enjoy the day",3.0,6.0,51.0
8,1090568267218014209,/DougKass/status/1090568267218014209#m,DougKass,0.0,0.0,2019-01-30 11:11:00+00:00,1548846660000.0,"Today we will hear why $AAPL is cheap (at $164) from the same talking heads who thought $AAPL was cheap (at $230) last August. As I tweeted ""investment wisdom is always 20/20 when seen through the rear view mirror."" @SquawkCNBC @andrewrsorkin @beckyquick @tomkeene @lizclaman",3.0,7.0,42.0
