,tweet_id,tweet_url,username,is_retweet,is_pinned,time,ts,text,replies,retweets,likes
0,1187850635011657734,/DougKass/status/1187850635011657734#m,DougKass,0.0,0.0,2019-10-25 09:57:00+00:00,1571997420000.0,@ChrisCaspsu2000,1.0,0.0,0.0
1,1187804017172328448,/DougKass/status/1187804017172328448#m,DougKass,0.0,0.0,2019-10-25 06:52:00+00:00,1571986320000.0,Not really. Blocked.,2.0,0.0,2.0
2,1187800412788842496,/DougKass/status/1187800412788842496#m,DougKass,0.0,0.0,2019-10-25 06:37:00+00:00,1571985420000.0,This Harvard Biz School professor on @cnbc is one of the most pretentious people I have listened to. Its a good reminder why I chose Wharton over Harvard.,15.0,2.0,56.0
3,1187791827723796486,/DougKass/status/1187791827723796486#m,DougKass,0.0,0.0,2019-10-25 06:03:00+00:00,1571983380000.0,Enjoy the weekend all!,2.0,0.0,22.0
4,1187791224452894720,/DougKass/status/1187791224452894720#m,DougKass,0.0,0.0,2019-10-25 06:01:00+00:00,1571983260000.0,@realmoney Meshuganah is Trump * Craziness is three fold (in Yiddish) Its always interesting to watch the wild intraday swings in bitcoin! Up about $600 in the last half hour and $1000 over the last few hours!! google.com/search?source=hp&… A medium of exchange? Hardly! @jimcramer,0.0,0.0,2.0
5,1187765096430350336,/DougKass/status/1187765096430350336#m,DougKass,0.0,0.0,2019-10-25 04:17:00+00:00,1571977020000.0,There is always large cash reserves. @CNBCFastMoney,2.0,1.0,7.0
6,1187764034084495360,/DougKass/status/1187764034084495360#m,DougKass,0.0,0.0,2019-10-25 04:13:00+00:00,1571976780000.0,"""Price has a way of changing sentiment."" - Divine Ms M @cnbcfastmoney @hmeisler @ScottWapnerCNBC",0.0,1.0,6.0
7,1187763621981511680,/DougKass/status/1187763621981511680#m,DougKass,0.0,0.0,2019-10-25 04:11:00+00:00,1571976660000.0,@cnbcfastmoney,2.0,0.0,3.0
8,1187763535595618305,/DougKass/status/1187763535595618305#m,DougKass,0.0,0.0,2019-10-25 04:11:00+00:00,1571976660000.0,Sentiment is a poor trading tool. @ScottWapnerCNBC @cnbcfastmoney,0.0,0.0,3.0
9,1187763322667622400,/DougKass/status/1187763322667622400#m,DougKass,0.0,0.0,2019-10-25 04:10:00+00:00,1571976600000.0,"The market is falling again for @realdonaldtrump trade ""progress"" - hook, line and sinker. Fool me once, shame on you. Fool me twice, shame on me. @realmoney @SquawkCNBC @ScottWapnerCNBC @terranovajoe",12.0,5.0,40.0
10,1187737859190591494,/DougKass/status/1187737859190591494#m,DougKass,0.0,0.0,2019-10-25 02:29:00+00:00,1571970540000.0,gracias amigo. enjoy the weekend.,1.0,0.0,6.0
11,1187731133452226563,/DougKass/status/1187731133452226563#m,DougKass,0.0,0.0,2019-10-25 02:02:00+00:00,1571968920000.0,"Kass is a jerk. Trust me, I should know. Enjoy weekend DYl.",6.0,0.0,24.0
12,1187727166164873216,/DougKass/status/1187727166164873216#m,DougKass,0.0,0.0,2019-10-25 01:46:00+00:00,1571967960000.0,"ok chief what do you base that on, gut? lets compare spreadsheets. enjoy the weekend. respectfully",3.0,0.0,6.0
13,1187727000494137346,/DougKass/status/1187727000494137346#m,DougKass,0.0,0.0,2019-10-25 01:45:00+00:00,1571967900000.0,thx,1.0,0.0,1.0
14,1187686037071564801,/DougKass/status/1187686037071564801#m,DougKass,0.0,0.0,2019-10-25 11:03:00+00:00,1572001380000.0,Must See Fin TV Ron Baron on @SquawkCNBC And congrats to Ron on his son's wedding two weeks ago! Mazel tov!! @andrewrsorkin @beckyquick,0.0,1.0,2.0
15,1187684729413361664,/DougKass/status/1187684729413361664#m,DougKass,0.0,0.0,2019-10-25 10:58:00+00:00,1572001080000.0,ARK Mgt touted the stock multiple times on @cnbc and cited a $4000 price target. They turn around and sell some out - for nonsensical reasons. Not cool.,2.0,0.0,8.0
16,1187683993858256898,/DougKass/status/1187683993858256898#m,DougKass,0.0,0.0,2019-10-25 10:55:00+00:00,1572000900000.0,"@realmoney An Amazon Deal May Be Approaching * Though guidance was weaker than expected, Amazon is putting more distance between it and its competitors * I continue to expect a ""hockey stick"" improvement in profits and cash flow two years out * After slashing my position at much",2.0,0.0,6.0
17,1187683994630053888,/DougKass/status/1187683994630053888#m,DougKass,0.0,0.0,2019-10-25 10:55:00+00:00,1572000900000.0,"higher prices prior to the EPS release, I began to add back at $1637-$1640 in the after hours * My year-end 2020 price target is $2000-$2300 @jimcramer @tomkeene @SquawkCNBC @cnbcfastmoney @riskreversal @tomkeene @terranovajoe @Sarge986 @guyadami @lizclaman @bobpisani",1.0,2.0,15.0
18,1187683473164775424,/DougKass/status/1187683473164775424#m,DougKass,0.0,0.0,2019-10-25 10:53:00+00:00,1572000780000.0,"I am blocking you because of your comments. Regarding trimming on a move from $180 to $240 because of ""other alternatives"" - considering her $4000 price target, there are no better investments.",2.0,1.0,11.0
19,1187652969363365888,/DougKass/status/1187652969363365888#m,DougKass,0.0,0.0,2019-10-25 08:51:00+00:00,1571993460000.0,"Fib retrace last nite, Sven?",0.0,0.0,9.0
20,1187650471151984643,/DougKass/status/1187650471151984643#m,DougKass,0.0,0.0,2019-10-25 08:41:00+00:00,1571992860000.0,Coming up this morning on @realmoney * Why I Repurchased Some $AMZN at $1637 (in after hours) @jimcramer @tomkeene @SquawkCNBC @cnbcfastmoney @Sarge986 @riskreversal @guyadami @terranovajoe,4.0,1.0,14.0
21,1187647228904706048,/DougKass/status/1187647228904706048#m,DougKass,0.0,0.0,2019-10-25 08:28:00+00:00,1571992080000.0,"Not exactly accurate, Rev!",0.0,1.0,6.0
22,1187539638413606912,/DougKass/status/1187539638413606912#m,DougKass,0.0,0.0,2019-10-25 01:21:00+00:00,1571966460000.0,Yesterday on. Real money I explained specifically why the next twelve months could be a period of underperformance. Apples to oranges Jeff,2.0,0.0,6.0
23,1187538714672685057,/DougKass/status/1187538714672685057#m,DougKass,0.0,0.0,2019-10-25 01:17:00+00:00,1571966220000.0,Make that a $4000 price target.,2.0,1.0,2.0
24,1187538551271018499,/DougKass/status/1187538551271018499#m,DougKass,0.0,0.0,2019-10-25 01:17:00+00:00,1571966220000.0,BS Not with $400 price target. Where are the better reward v risk targets? There arent. Doesnt make sense.,0.0,0.0,5.0
25,1187538394655666178,/DougKass/status/1187538394655666178#m,DougKass,0.0,0.0,2019-10-25 01:16:00+00:00,1571966160000.0,Jeff Not if I had a $4000 price target (as expressed on @cnbc).,1.0,0.0,3.0
26,1187533532467531776,/DougKass/status/1187533532467531776#m,DougKass,0.0,0.0,2019-10-25 12:57:00+00:00,1572008220000.0,"So you sold $TSLA on a rally (while touting the stocks on @cnbc) from $180 to $240 because there were better opportunities? In May 2019 you ""touted"" a $4000 price target on @cnbc. $240 to $4000- don't have to go to Wharton to realize that is a huge return. Ru serious?",9.0,5.0,84.0
27,1187532309672714240,/DougKass/status/1187532309672714240#m,DougKass,0.0,0.0,2019-10-25 12:52:00+00:00,1572007920000.0,"This explanation for a partial sale of $TSLA is total BS - because if your price target is in the thousands of $s and you are selling stock at under $300, makes zero sense. Touting the stock on CNBC and selling it? Not cool.",4.0,7.0,38.0
28,1187531606426345472,/DougKass/status/1187531606426345472#m,DougKass,0.0,0.0,2019-10-25 12:49:00+00:00,1572007740000.0,Better Jewish Luck than Christian Science.,3.0,0.0,9.0
